"language","id","text","resultado"
"pt","23049","as feministas estao ocupadas criticando a fala da ministra damares",0.463430553674698
"pt","29359","nao se preocupe meu presidente  o nosso exercito brasileiro ja esta aqui desde ontem para fazer a sua seguranca merecida ",0.323467254638672
"pt","29360","presidente  nestes casos melhor acionar sempre a guarda nacional  os governadores opostos ao seu governo  mesmo beneficiando sua gente torcem que algo mal lhe aconteca  fica a dica  parabens por mais esta obra  que deus lhe proteja ",0.719148278236389
"pt","23060","alo kefera buchmann vai la explicar o que e feminismo para os homens de la  ",0.656713843345642
"pt","10959","nunca se viu no brasil um presidente escrever nada nem em revistas  bolsonaro nos mostra ser um governo popular sem frescuras e fala e expoes as coisas erradas que fazem nesse pais    vai ser um grande presidente pode anotar",0.711286664009094
"pt","8832","o brasil merece seguir avancando  onde jair for eu vou  e voces  #ondejairforeuvou #estamoscombolsonaro",0.437988221645355
"pt","8833","senhor presidente com todo respeito  faca alguma coisa por nos   nao fique em silencio  nos precisamos de voce  nao se cale  essa nao e sua natureza ",0.325754016637802
"pt","29368","de certa forma  isso e muito bom  bolsonaro  chegou a hora de o brasil pensar no federalismo  onde cada estado gasta o que gera de grana ",0.884615361690521
"pt","12","atencao policiais do amazonas   a bola foi passada para vcs   ",0.488586127758026
"pt","29364","covardia e uma caracteristica essencial da personalidade de um petista",0.30561101436615
"pt","43152","maior  e o exercito  que  estar  com  o senhor   o  exercito  de  cristo em  oracao   pela    a  seguranca       sua e  de  seus   familiares   deus  acima de tudo e de todos",0.740718722343445
"pt","13","se nao tem vaga na penitenciaria  o cemiterio cabe tranquilo ",0.454257428646088
"pt","10951","ato obsceno          art  233 do codigo penal   praticar ato obsceno em lugar publico  ou aberto ou exposto ao publico           pena   detencao  de tres meses a um ano  ou multa ",0.155172407627106
"pt","8834","que tal agir no artigo 142   ta na hora  porque essa justica brasileira ja virou uma verdadeira bagunca ",0.77724152803421
"pt","23053","transfere a embaixada logo  presidente  ",0.484248459339142
"pt","23061","inacreditavel que isso aconteca debaixo dos direitos humanos da onu   ironia ",0.469162166118622
"pt","23122","isso mesmo meu presidente  denuncie   porque nao existe um lider corajoso que enfrente essa monstruosidade   ",0.192156344652176
"pt","18","a juiza que soltou os assassinos e a mesma que foi afastada por facilitar a corrupcao em coari   ana paula de medeiros braga  a juiza que assinou o alvara de soltura  filha do ex secretario de cultura roberio braga ",0.492047011852264
"pt","10956","eu estava com medo da resistencia  confesso  quando vi que se trata de um monte de zumbi que nem sabem o motivo da luta eu fiquei tranquilo  com uma oposicao como essa a direita vai se perpetuar no brasil   #avantecapitao",0.322323888540268
"pt","10944","esse povo pensa com a bunda  afinal o cerebro nunca funciona ",0.0764167904853821
"pt","10961","nao da pra acreditar  que tem quem faca protesto nesse sol de 50 pra defender bandido  ",0
"pt","10947","como podem ser tao inuteis ao nosso brasil ",0.579699814319611
"pt","10962","e por coisas assim que tenho orgulho de ter votado no candidato certo ",0.708372473716736
"pt","29374","se tornou inimigo de quem nao quer ver o bem do brasil   deus o abencoe grandemente nessa jornada ",0.670321345329285
"pt","10327","o lula foi liberto  embora aprecie os feitos do meu presidente  hoje me sinto um brasileiro derrotado e traido pelo minha propria corte suprema  meus pesames a minha patria amada ",0.517745971679688
"pt","10151","voce nao se pronunciou sobre a decisao do stf  estamos aguardando ",0.352657914161682
"pt","22","eu concordo plenamente com a familia   se nao existe justica    que facamos com as proprias maos   lei de hamurabi olho por olho e dente por dente  ",0.451472371816635
"pt","11","presidente contamos com vc para acabar com essas injusticas no brasil  o amazonas esta revoltado ",0.318596124649048
"pt","23114","ana carolina ferreira  voce e a unica feminista sensata e estudiosa que conheco  tem meu respeito e sabe disso  juro que nao e uma provocacao  mas por que o movimento feminista nunca se pronuncia contra isso  por que nao se manifestam contra isso  na minha concepcao  nao ha agressao mais grave as mulheres do que isso  no entanto  nao conheco uma unica feminista que pelo menos fale a respeito ",0.355072468519211
"pt","29361","nos de vitoria da conquista estamos aqui para te receber de bracos abertos   quanto ao governador deste nao pode se esperar muita coisa   ele e orientado por um presidiario",0.455309271812439
"pt","29379","boa viagem meu presidente e desde ja agradeco sua compreensao e sua vinda aqui no nosso estado do maranhao ",0.83855402469635
"pt","23081","ja invadiram londres e paris infelizmente  tem ate canal de tv aberta de muculmano na inglaterra ",0
"pt","8845","senhor presidente  ora bastante por que a inveja vai ser grande o que o lula nao fez durante anos o senhor fez em pouco meses entao ora peca a deus que tire toda a inveja que lhe sera lancada   ",0.461550742387772
"pt","23065","aqui no brasil nao  fechar as fronteiras imediatamente ",0.339640319347382
"pt","15","tudo isso ai culpa dos ministros do stf e do davi alcolumbre e rodrigo maia  principalmente do pt  dia 30 vamos esta em brasilia pelo um brasil melhor  o brasil acima de tudo e deus acima de todos ",0.763157904148102
"pt","42425","sr presidente bolsonaro  equipe e familias  o senhor te abencoe e te guarde  o senhor faca resplandecer o seu rosto sobre ti  e tenha misericordia de ti  o senhor sobre ti levante o seu rosto e te de a paz   numeros 6 24 26 #deusacimadetodos #bolsonarotemrazao",0.708333313465118
"pt","29367","pensei que o presidente fosse autoridade maxima aqui no brasil    lamentavel ver a falta de respeito que o brasileiro tem  para com uma autoridade como um presidente  que deus lhe guarde que nao seja uma emboscada    ",0.258657723665237
"pt","23054","te amo presidente",0.588341116905212
"pt","23064","avante  capitao  vamos mudar o rumo desse pais",0.820962309837341
"pt","17","mas nem um parente do sargento para dar uma cancelada de cpf  depois alegava que agiu sobre forte emocao   ",0.206254422664642
"pt","10965","nem vale a pena prestar atencao nessa gente  vamos prestar atencao no abaixo assinado do deltan dalagnol porque isso ajuda nosso presidente  nada de votacao secreta na camara e no senado   https   www change org p dep rodrigomaia camara leg br exigimos vota c3 a7 c3 a3o aberta para a presid c3 aancia do congresso c c3 a2mara e senado recruiter 928303442 utm source share petition utm medium copylink utm campaign share petition",0.540176749229431
"pt","16","policia do amazonas quero ver resultados o mais rapido possivel nao permita que a morte do sgt seja impune ",0
"pt","23089","a igreja catolica fez pior por 1000 anos e ninguem fala nada kkk",0
"pt","29362","absurda essa decisao  quando precisarem da forca nacional faca o mesmo ",0.523987352848053
"pt","41946","que o nosso deus coloque os seus anjos e te proteja de todos os males   meu presidente   fica bem atento   pq tem muitos que nao estao satisfeitos com os resultados positivos que o senhor vem proporcionando ao brasil   estamos com o senhor e cuidado com alguns falsos que andam do seu lado   que deus te abencoe   tmjs ",0.675438582897186
"pt","29365","moro em vitoria da conquista  e o pt comandou a prefeitura durante 20 anos  e em 2018 conseguimos mudar  gracas a deus   tenho um filho de 11 anos que estava ansioso para ver o nosso presidente  mas acho prudente a inauguracao ser reservada  deus abencoe o bolsonaro   que ele olhe por todos e tente unificar esse nosso brasil  ",0.606977999210358
"pt","23066","obrigada presidente por ser essa voz de alerta como lider maior da nacao  realmente o movimento feminista se manifesta  somente para o que lhe convem",0.899999976158142
"pt","29366","uma verdadeira infantilidade do nosso governador  ruy costa  a policia militar  nao e patrimonio dele  e sim da populacao  esta briguinha ridicula de esquerda x direita no brasil  ja passou do limite  o nordeste tambem e brasil  mas tem gente aqui que nos envergonha demais  um boa viagem presidente  seja bem vindo em nossa cidade ",0.570632755756378
"pt","29370","pode deixar capitao nos faremos a sua seguranca o povo do bem esta aqui pra te receber de bracos abertos",0.883574962615967
"pt","9063","sr  presidente  parabens pelo otimo governo que esta fazendo  mas temos que no ater com o anunciado pelo olavo de carvalho   o brasil e o pais das oportunidades perdidas  o tempo de combater eficazmente o foro de sao paulo ja passou  se o governo nao acordar agora  ele corre o risco de que sua unica realizacao  no fim das contas  consista em entregar aos comunistas uma casa mais arrumadinha  ",0.546653568744659
"pt","10","pois e sr presidente  estamos esperando a reducao da maioridade penal  fim do auxilio reclusao  fim dos indultos  mudancas na audiencia de custodia  ou fomos enganados   ",0.469540148973465
"pt","19","estou achando que a melhor forma de punir eles e ter deixado solto  vamos ver as noticias daq pra frente ",0.674836874008179
"pt","9155","e ai presidente  nao vai fazer nada em relacao ao ocorrido ontem  nos o elegemos acreditando em uma atitude do senhor ",0.407415211200714
"pt","29381","cuidado capitao  pode ter armadilha contra sua vida  que deus o proteja e guarde de todo mal  em oracao por sua vida",0.274161130189896
"pt","10946","a esquerda chora   ",0.341683089733124
"pt","29363","problema nao presidente   o povo da bahia sabe das suas virtudes e do seu carater   deus estara sempre com o sr ",0.204613089561462
"pt","41935","deus vai na frente cuidando de tudo presidente jesus tem muito amor pelo senhor e pelo brasil",0.970419466495514
"pt","14","presidente   essa    juiza   e acusada aqui em coari   cidade do famoso prefeito pedofilo   interior de manaus por corrupcao  e ate hoje nao foi julgada  por favor cobre o cnj eles ate hoje nao fizeram nada  ",0.430904895067215
"pt","23048","pois e triste ele compartilha isso ne  deve ser poq vc prefere viver no seu mundinho e nao ver a realidade voce deveria achar um absurdo a covardia que essa mulher esta passando isso sim ",0.214285716414452
"pt","8838","para o homem mais honesto do mundo  mesmo com dezenas de advogados  foi mais facil mudar a lei do que provar sua inocencia    o brasil dara a resposta nas ruas ",0.818295657634735
"pt","29815","espero que a bahia entenda de vez  quem manda na policia  quando precisar de protecao militar e nao tiver  e so lembrar em quem vcs votaram",0.436612904071808
"pt","21","leis fraca  policia prende  justica solta ",0.434200078248978
"pt","8854","a unica forma de salvar nosso amado brasil",0.939443230628967
"pt","23062","proteja nosso pais bolsonaro  feche nossas fronteiras para essa ideologia  ",0.684522271156311
"pt","23","depois a gente mata e vai preso e conduzido ao juri  esse mp e judiciario ta do lado de quem ",0.485462725162506
"pt","29376","mas um governador pode impedir a presenca da policia em um evento em que participa o presidente da republica    o brasil esta todo errado     coloque entao a policia federa para fazer a sua seguranca presidente   ",0.403852224349976
"pt","23069","a esquerda que implementa o comunismo socialismo sempre teve alianca como isla revolucionario  ",0.510804295539856
"pt","8847","sou portugues  mas acho incrivel um meio de comunicacao como a globo  ser tao parcial em seus comentarios facciosos ",0.523458898067474
"pt","29385","boa viagem senhor presidente   por favor olhe pelos companheiros caminhoneiros   obrigado",0.807047963142395
"pt","8859","presidente o senhor nao vai se posicionar sobre a decisao absurda do stf  ",0.313189208507538
"pt","25512","absurdo  qdo a ignorancia reina entre as pessoas  qual a dificuldade de investir em um pais bom para todos os cidadaos  para todas as pessoas que aqui vivem  pq expor a ignorancia sobre uma religiao  um povo  o que se ganha divulgando odio  violencia  venha conhecer os muculmanos  desca do pedestal  seja um estadista de vdd  aprenda a dialogar com o povo  ainda ha tempo  muitas pessoas deram credito a este governo  um governante governa para o seu pais e nao apenas para os seus eleitores  o islam e a segunda religiao em numero de pessoas no mundo  se fosse uma religiao violenta  este mundo nao existiria  islam significa paz  paz esta q deixamos de ter no nosso pais na ultima campanha presidencial  por fim  convido as pessoas q desconhecem o islam e os muculmanos q visitem uma mesquita  que procure cursos em universidades q trate do tema  chega de violencia e de atacar grupos minoritarios q tb contribuiram para formacao do nosso povo ",0.439024388790131
"pt","42442","que deus o guarde meu amigo e sr  presidente",0.506491303443909
"pt","10963","presidente a italia toda agradece pelo senhor ter mandando battisti de volta ao seu pais  e pagar pelos seus crimesparabens presidente ",0.545647084712982
"pt","23128","sr  presidente  este e um assunto sensivel  nao deveria postar sobre isso  eu acho  ao menos nao de forma tao chocante     ainda mais sendo a cultura de um povo  errado ou nao  pode criar conflitos para um governo que so esta comecando    mas entendo que o sr queira trazer a dura realidade que e o perigo de nao controlar a imigracao para o nosso pais    e muito triste que ainda existam essas coisas em 2019  ",0.366666674613953
"pt","42451","mil cairao ao teu lado e dez mil a tua direita  mas tu nao seras atingido  deus te abencoe meu presidente ",0.387120246887207
"pt","10953","caraca um minuto que ele postou e ja tem varios comentarios ",0.510331273078918
"pt","8861","todo dia um  deslize  desse    isso ai e msg subliminar    programacao neuro linguistica   kkkkkk",0.568351984024048
"pt","8843","tudo estava indo tao bem    ate aqui  daqui pra frente comeca a bagunca e inseguranca de novo   ",0.805848836898804
"pt","23055","quem nao quer ver faz igual o filme bird box  tapa os olhos  a realidade nua e crua",0.451520264148712
"pt","29377","pode vir presidente sou conquistense nossa cidade te esperando com alegria",0.873303174972534
"pt","8853","estamos mudando o brasil presidente  qual a sua postura sobre a barbarie feita no stf ontem  aonde nao vi o senhor tomar nenhuma posicao  ou teve acordao mesmo ",0.394033163785934
"pt","26","presidente estamos contigo  faca todas mudancas necessarias para nosso brasil   ",0.571528553962708
"pt","8841","somos maioria  estamos unidos agora mais do nunca  o brasil esta no caminho certo e nenhum condenado vai atrapalhar",0.122293561697006
"pt","24","pelo amor de deus presidente lute para acabar com essa audiencia de custodia ",0.293675243854523
"pt","23059","https   portalconservador com islamismo a maior maquina assassina da historia da humanidade  fbclid iwar0 bz3gpma7yzhe0 plkcgjs lkin lve7pighfoaw5e9017ac1x 2e4km",0.723839163780212
"pt","23073","caro presidente   promessa e divida e o povo quer saber quando o senhor ira cumprir a promessa de campanha  ",0.60586541891098
"pt","23270","d e s n e c e s s a r i o         o sr  ja deveria se comportar como presidente  esta sua postagem e absurda    ",0.479790329933167
"pt","23063","leiam os ensinamentos do alcorao sao bem claros e eles seguem este video nando moura  livro https   www youtube com watch v fhbvzlibey4",0.921900689601898
"pt","29369","com essa atitude o governado da bahia nao precisa dizer mais nada ja entendi tudo  por que um descontentamento tao grande so tem duas razoes ou e medo que o brasil descubra quem realmente sao  ou e o desespero que daqui para frente nao vao poder desviar milhoes dos cofres publicos ",0.303921580314636
"pt","8846","coloque as forcas armadas nas ruas  antes que seja tarde  mostre para quem votou no sr  que e patriota de fato ",0.510237514972687
"pt","8852","faca alguma coisa presidente  o brasil nao e a favor do que o stf fez",0.440394818782806
"pt","30","leis de crimes hediondos prisao  devem passar de 30 para 60 anos sem sair direito condicional",0.363826483488083
"pt","29373","sou baiana    vizinha a cidade de vitoria da conquista so lamento governador pessimo",0.26445996761322
"pt","8915","https   www fredericorodrigues com br noticias 45 atencao lula foi solto nao foi absolvido",0.447210699319839
"pt","28","sairam pela porta da frente pq se ficassem presos a lei pra quem mata policial nao seria cumprida  aguardem cenas dos proximos capitulos",0.525630354881287
"pt","25154","senhor presidente  sou muculmano e apoiei o na ultima eleicao e acredito que o senhor presidente ira contribuir para tornar este mundo em paz  nao queremos espalhar criticas de odio sobre quaisquer outras regras religiosas  senhor presidente  queremos de voce a respeito de outros religiosos  muitos de nos que nao sabemos sobre o isla e a sharia  entao por favor  pare com comentarios ruins antes de saber sobre isso  obrigado",0.431826680898666
"pt","23076","nao podemos generalizar  nem todos os muculmanos praticam esses atos  a violencia contra a mulher existe em varias religioes  gracas a deus conseguimos conviver com varias religioes em nosso pais  a violencia no brasil contra mulher tambem e grave e tem sido por motivos banais  votei no presidente bolsonaro mas este post gera discordar entre brasileiros e muculmanos ",0.424460649490356
"pt","23058","gente  muitas mulheres sao massacradas no brasil tbm  apenas de forma diferente  sao espancadas  estuprada e muitas mortas por seus proprios companheiro  tem que mudar isso no brasil tbm      nao adianta ficar mostrando o horror de outros paises e fechar os olhos para o que acontece aqui     vamos trabalhar senhor presidente  vamos cuidar do brasil",0.432603716850281
"pt","41127","presidente o senhor nao  precisa  dele  seja bem vindo deus te proteja sempre abracos",0.658329606056213
"pt","23082","presidente  cuidado para suas opinioes pessoais nao atrairem a violencia desse fanatismo religioso para dentro de nossas fronteiras  nao seja responsavel por trazer risco ao povo que jurou proteger  deixe os em seu lugar com sua fe e regras ",0.30269718170166
"pt","23086","segundo a esquerda  a violencia se combate com livros   agora o governador do ceara que e petista de esquerda  quer apoio militar  para conter a criminalidade    porque ele nao usa os livros ",0.313857972621918
"pt","23078","capitao nao ha necessidade  tire o video  se houver alguma ameaca desse absurdos ai deixe que nos postamos  foco bndes ",0.404854536056519
"pt","23057","bolsonaro  os pacientes portadores de esclerose multipla estao sem medicamentos  minha filha usa fingolimode  por favor  priorize a saude ",0.590162217617035
"pt","8850","tanta coisa pra voce fazer e voce vai se importar que a globo te chame de ex presidente   parece crianca com raiva quando chama ela de qualquer coisa ",0.26915243268013
"pt","23085","as feministas devem agradecer a paz que o cristianismo trouxe e mantem no ocidente ",1
"pt","29","esse e o brasil que nao queremos  avante bolsonaro  o brasil de bem esta com voce ",0.710157334804535
"pt","23084","me surpreende falar sobre  sharia aqui no brasil   se a cada 5 minutos uma mulher morrer por serem mortas pelo seus proprios parceiros    quanta coisa sr  presidente vc deveria se preocupar aqui no brasil   estou sem palavras   povo ocidental aqui no brasil e somos mulcumanos brasileiros   islam e  paz  ",0.525149822235107
"pt","33","precisamos urgentemente de mudancas no codigo penal mais tbm precisamos urgentemente de juizes comprometidos verdadeiramente cm a lei e cm o bem estar da populacao brasileira   ",0.884615361690521
"pt","8837","me desculpa mas  muitos ja estao vendo que a melhor saida do brasil e o aeroporto proximo    ",0.54683256149292
"pt","23091","serio  acho que esse tipo de postagem nao pega bem pra conta oficial  presidencial ",0.0167287588119507
"pt","23067","rapaz tudo nesse mundo agora e culpa de esquerda  muda o disco  foca no brasil",0.307217180728912
"pt","23090","cade o hulk  angelica  irma da angelica  fatima bernardes  kefera  daniela mercury  andrea  sei la das quantas  que discutiu  com a senhora no programa da fatima  e todos outros globais ai  cade voces pra defender essa mulher  ",0.308833986520767
"pt","23094","tem que postar mesmo   nao da mais pra ficar escondendo",0.29237961769104
"pt","29386","parabens pelo colaboracao do governador da bahia  sarcasmo isso   espero que o aeroporto possa ajudar as pessoal da regiao e a todos da bahia querida    ",0.830444276332855
"pt","8878","vem tranquilo  lula ",0.727936625480652
"pt","28641","seria bom o presidente ser cuidadoso com a informacao e nos dizer em que pais e local isto foi gravado e quando   absurdo divulgar um video assim violento e culpar todos os mulcumanos  mais respeito",0.459808856248856
"pt","32","bom dia  e assim que funciona as leis no brasil mudanca no codigo penal ja ",1
"pt","23099","que o senhor preserve nossa cultura crista  e que nossos inimigos nao usem discursos enfeitados para trazer esse mal para nossa civilizacao ",0.0454545468091965
"pt","23088","a verdade e essa  temos que saber como e a cultura arabe  parabens presidente  e muda logo a embaixada de israel ",0.608497619628906
"pt","29387","que otimo va mesmo hinario gurar o aeroporto mas nao esqueca das estradas do brasil que esta precisando de pavimentacao e o nossos caminhoneiro nao estao transportando o que precisa porque as estradas nao ajuda parabens presidente estou com voce trabalhe bem porque ninguem quer perder voce quer que voce continue eleito no brasil",0.314814805984497
"pt","27","e revoltante agente ver isso presidente so no brasil que acontece isso temos que muda essas leis com urgencia ",0.336325824260712
"pt","8860","somos 58 milhoes   que querem o melhor para o brasil   tamos unidos ",0.843243479728699
"pt","23080","se nao e muculmano   por favor nao diga nada sobre ele",0.0977813303470612
"pt","23092","excelentissimo sr  presidente  o sr  e o primeiro que vejo que se comunica diretamente com a populacao  parabens e continue assim ",0.797759056091309
"pt","23071","desnecessario a postagem de um video desse presidente  totalmente desnecessario   ",0.227759271860123
"pt","10957","cade as autoridades para prenderem eles por cometerem crime     se for assim vou andar nu na rua tbm     acho que as autoridades sao muito falhas nesse sentido  uma coisa e protestar outra bem diferente e sair nu no espaco publico   ",0.319437891244888
"pt","8879","esta solto o presidente mais santo do brasil    em cada obra que fazia levava um terco  ",0.595087289810181
"pt","29394","o governadot da bahia ta brigando com o paraiba e o maranhao pra ver quem e o pior  o do piaui e ceara correm por fora ",0.139231741428375
"pt","20","parabens  senadores mais um assalto seguido de morte registrado com sucesso   sem chances de defesa  muda brasil ",0.330866813659668
"pt","29372","meu presidente  estou na reserva do 10 gac mas meu uniforme e meu coturno estao impecaveis  so esperando seu chamado para nos juntos botar o nosso brasil em ordem e fazer todos esses esquerdistas virarem gas rsrsrsrsrs",0.449433386325836
"pt","23087","ue bolsonaro  mas seu filho twittou hoje que nao e preciso do feminismo   buguei agora     ta certo que com sua cupula ministerial a comunicacao nao ta fluindo  mas dentro de casa tb nao  ",0.312595307826996
"pt","42438","deus ira protege los presidente ",0.528809368610382
"pt","10960","processa esse mal educado  militante da resistencia presidente",0.363616943359375
"pt","29418","sera que estao tramando algo   cuidado presidente ",0.707759499549866
"pt","29393","deus o acompanhe na ida e na volta  vai dar  alias  ja deu tudo certo  presidente  ",0.599389553070068
"pt","42399","boa tarde   quanto mais tentarem prejudicar o bolsonaro mais abencoado ele sera  ",0.576757967472076
"pt","29388","nossa senhora passa na frente e pisa na cabeca da serpente  deus no comando ",0.498437285423279
"pt","39","isso e uma falta de respeito contra as pessoas de bem  necessitamos de leis mais duras imediatemente ",0.611553132534027
"pt","23097","o refugiado quando migra nao vem sozinho  tambem o acompanha sua cultura sua religiao  realmente tem que ter um filtro  brasil para os brasileiros",0.411117136478424
"pt","36","infelizmente em alguns pontos a democracia e constituicao so atrapalha",0
"pt","38","se a justica nao faz o seu trabalho   o cidadao faz  se fosse comigo enchia ele de facada depois mim entregava a policia ",0.289527535438538
"pt","29378","o cara e fraco presidente  a populacao fara sua seguranca   policiais de folga vai la pela nacao por um novo brasil ",0.270498991012573
"pt","8870","agora so falta o lula me tirar da pobreza  tirou de bilhoes de pessoas e esqueceu de mim",0
"pt","8851","senhor presidente  tome as redeas dessa nacao e imponha respeito  estamos expostos a essa situacao  e somos piada internacional ",0.9005326628685
"pt","29395","nao sei porque ficam magoados e vingativos  aqui em florianopolis tem uma comunidade grande do para   maranhao   bahia e brincamos com eles chamando de paraibas e eles sao amistosos   gentis e nos damos bem ",0.683238744735718
"pt","23095","meu deus   voce e nosso presidente e esse tipo de postagem o senhor nao deveria esta fazendo  deixa isso pra militante ",0.325970560312271
"pt","8868","natuza lambuza ",0.5
"pt","23096","olha     francamente  se manifestar a respeito e uma coisa  replicar essas imagens sendo um presidente da republica e outra  o nosso pais tem problemas serios pra serem discutidos e resolvidos    nossa realidade nao e melhor que a de outros paises  o senhor nao e mais um candidato  tenha compostura e va trabalhar  ",0.307692319154739
