"language","id","text","resultado"
"pt","41302","que coisa inacreditavel   acho que isso e uma afronta a maior autoridade de nosso pais  solicita a forca nacional exercito e policia federal e deixa esse governador de lado  ",0.472417682409286
"pt","32528","cuidado meu presidente desse governador podemos esperar tudo  dobra sua seguranca",0.693817973136902
"pt","33452","carlos alberto tinha que ser na bahia",0.386690735816956
"pt","42818","acho que esses governadores deveriam assumir seus atos e agirem como adultos   estao muito melindrosos pra serem lideres de gente forte   sou nordestina e as palavras do presidente nao me fizeram menor   ou pior  agora vao me dizer que os estados nordestinos estao uma maravilha  o pt e seus governantes acabaram com o principal  dignidade  ficou apenas um bolsa familia  salario de fome  sim  porque isso e voto garantido   vamos trabalhar meu povo    ",0.429535359144211
"pt","32519","deus e o seu escudo  presidente ",0.575827598571777
"pt","29698","pois quando esse governador precisar de reforco do exercito como aconteceu no estado do ceara nege  fique com deus presidente",0.575494408607483
"pt","29694","a seguranca do presidente da republica e obrigatoria e constitucional  pois e a autoridade maior do pais  logo  as forcas de seguranca devem se submeter ao seu comando  demandadas por seus auxiliares regionais  governadores   a pm nao pertence a interesses particulares  pertence ao povo ",0.398076474666595
"pt","6704","essa juiza com certeza e da faccao  revoltante ",0.778980851173401
"pt","45754","o merthiolate precisa voltar a arder  presidente  brasillll",0.356180369853973
"pt","25585","manda o jean willis para la ",0.448230534791946
"pt","29998","boa viagem  manaus tambem  o aguarda na quinta  de uma olhadinha especial para a administracao  que esta  sendo feita aqui ",0.996103584766388
"pt","29676","quase pulei de alegria qd li vitoria ate achei que seria aqui no espirito santo  se fosse eu iria lhe ver venha visitar os capixabas presidente  lhe aguardamos  abracos ",0.658965229988098
"pt","8911","sera que houve uma eleicao hoje e eu estava dormindo ",0
"pt","32323","lamentavel  ele deveria ser rigido assim com a educacao  aqui na bahia ocupamos o ultimo lugar na avaliacao no ensino medio ",0.517788112163544
"pt","37555","bom dia  se cuide presidente ",0.939767718315125
"pt","29414","boa viagem senhor presidente que os anjos do senhor acompanhe e eu tenho certeza que o senhor e o melhor presidente que ja existiu no brasil por que o senhor nao faz separacao nem divisao o senhor quer a uniao e a construcao de um novo brasil",0.609277307987213
"pt","29739","bem vindo  meu presidente  sou nordestina e votei no senhor  que deus o abencoe e proteja ",0.963324308395386
"pt","29761","presidente o senhor tem a maior e melhor guarda que pode existir deus e seus anjos   vai em paz   ",1
"pt","29777","a pm nao e forca auxiliar do exercito  entao  a presidencia deveria exigir a presenca da pm     atraves do exercito ",0.263630270957947
"pt","17429","o que a policia ta fazendo que nao desce o pau nesses vagabundos ",0.334985315799713
"pt","32362","ohh  presidente libera nosso fgts 35 como foi anunciado",0.530644237995148
"pt","29413","pessoal de vitoria da conquista faca bonito e receba nosso presidente  porque essas atitudes desse governador e sem logica ",0.775022625923157
"pt","17432","o cara foi preso na bolivia e esses bostas fazem protesto aqui no brasil     bando de sem nocao ",0.0686866044998169
"pt","12337","coitados   nem sabem o que defendem   ",0.368635445833206
"pt","23686","enquanto a turma da lacracao ficou dias inventando pauta gracas a metafora da ministra damares e simplesmente fingiram nao ver a michele bolsonaro no dia da posse  fazem a mesma coisa com esse tipo de verdade  imitam avestruzes ",0.328046947717667
"pt","37446","deus sera seu guia presidente",0.594105362892151
"pt","678","acabe pelo amor de deus   com essa audiencia de custodia   por favor  senhor presidente   acabe com isso",0.324035197496414
"pt","17459","precisa ficar pelado para protestar     visao do inferno   cruzes ",0.0153892040252686
"pt","37443","pt nao sao brasileiros  sao simplesmente pt ",0.405646622180939
"pt","29733","governo petista  infelizmente e o comportamento esperado  mas deus e contigo presidente  venha em paz ",0.351927876472473
"pt","17413","gracas a deus o brasileiro acordou a tempo  bando de doentes  ",0.608748435974121
"pt","29709","cuidado presidente     nao va para perto das pessoas la   pelo amor de deus olha o que o senhor ja passou    deus va com o senhor  deus segure sua mao e lhe proteja ",0.623708009719849
"pt","17385","nos anos de  piompo  na italia  a ideologia comunista deu na cabeca de muita gente   esse terrorista matou 4 pessoas e deixou um numa cadeira de rodas   filho de um joalheiro     essa pessoa foi protegida pelos esquerdistas franceses e depois os brasileiros    vergonhaaaa",0.433301627635956
"pt","32434","um dia vai precisar da forca nacional ",0.565208315849304
"pt","42679","isso e papo furado dele  estar com ranco do sr presidente  pode ser uma tatica para tentarem te matar de novo  peca auxilio da guarda nacional",0.554757356643677
"pt","42543","deus esta c o senhor        o senhor esta c o escudo de protecao excelente diiiia",0.99216628074646
"pt","29716","aqui ha uma falta de etica muito grande  o governador e o presidente estao  em lados opostos  tudo bem   o mundo politico  e isso mesmo  porem  contudo e todavia  o presidente da republica e chefe de estado e do governo   se o governador nao concorda com o governo isto e uma coisa  agora     esquecer  que o presidente representa tambem a nacao     e portanto representa a todos os brasileiros  incluindo se aqui o sr  governador  e  uma atitude muito pequena  e desrespeitosa da parte do sr governador  sem etica nao  se caminha se tropeca ",0.499995410442352
"pt","17412","fico so rindo em ver um monte de petistas que nao tem nada o que fazer e ficam vindo chorar por atencao na pagina do presidente bolsonaro  kkkkkkkkkkk      esses esquerdopatas desocupados nao sabem que enquanto estao dizendo puras asneiras  o lula  dilma  jose dirceu  haddad e gleisi hoffman estao cheios da grana so no luxo e rindo muito das caras desses militontos desocupados   ",0.341269850730896
"pt","10796","votei no bolsonaro  trabalhei anonimamente e hoje  a decepcao me abraca    confiamos muito no senhor e no seu vice mourao  o senhor tem apoio dos militares e da maior parte da populacao brasileira  e porque essa inercia  nao nos decepcione presidente  o senhor foi esfaqueado  quase morreu  e nao tem coragem de fechar esse stf que so trabalha contra o brasil  muita decepcao  e esse o sentimento  que hoje toma conta dos coracoes dos brasileiros patriotas  muito triste ",0.371794879436493
"pt","29417","vai na paz presidente   o brasil esta de olho  ninguem joga pedra em arvore que nao da fruto ",0.67774510383606
"pt","32411","seja muito bem vindo  presidente bolsonaro ",0.895358681678772
"pt","29720","ele nao vai estar ai mais o povo esta pra homenagear o presidente e fazer a festa  ",0.272176712751389
"pt","29721","nao vai presidente  pode ser cilada    nao arisca  voce e muito importante para os brasileiros de bem   ",0.54438042640686
"pt","23746","o video vai ser denunciado  cuidado pra nao comprometerem a pagina do presidente     ",0.610962867736816
"pt","29726","o senhor dos exercitos  deus mesmo tem feito a seguranca do presidente e ministros ",0.534393072128296
"pt","12361","so lutam pelo que nao presta  ridiculos ",0.299096524715424
"pt","8904","sinto muito mas se o sr nao tomar uma atitude vai ser ex presidente em pouco tempo pq eles nao medem esforcos pelo poder",0.0833333358168602
"pt","12360","atentado ao pudor e crime  so pra lembrar ",0.0659020841121674
"pt","32570","presidente leva um batalhao dai de brasilia",0.482131540775299
"pt","45851","sou nordestina e tenho vergonha dessa gangue formada por esses governadores   ",0.315955877304077
"pt","29466","o presidente da republica federativa do brasil e a maior autoridade de um pais sua autoridade e superior a de um governador e qualquer outra autoridade basta dar a ordem e pronto ",0.52475368976593
"pt","29465","de agora por diante presidente   selecione homens de bem em cada canto da bahia e fortaleca  eles ao combate a esse governador de esquerda   ",0.698984563350677
"pt","29463","nao tem policia militar meu presidente chama as escoltas armadas privadas fazem o mesmo trabalho se ate melhor tem valorizar mais a nossa categoria da seguranca privada ",0.66350919008255
"pt","14501","bolsonaro    que bom que vc esta aqui do nosso lado   obrigado por nos livrar deste mal ",1
"pt","11073","prezado exmo  sr  presidente  ao que me consta salvo melhor juizo  isso e atentado ao pudor ",0.615735054016113
"pt","45843","cada dia me convenco mais o pt e um cancer do mais agressivo",0.35131311416626
"pt","41730","convoca o exercito e pronto ",0.566401839256287
"pt","41728","anderson vieiravieirasheila marinhomarinhopedro coelho",0.512460291385651
"pt","37292","meu presente voce e o melhor ",0.937757015228271
"pt","32243","pra cima deles presidente   brasil ame o ou deixe o ",0.604588806629181
"pt","32247","nos elegemos para ser presidente para todo o brasil  ninguem pode impedir o presidente de entrar ou sair do territorio brasileiro",0.452139407396317
"pt","32248","muda brasil com bolsonaro ja  boa viajem  sr presidente ",0.725273013114929
"pt","29457","quando a policia militar fizer greve na bahia e precisar da forca nacional apenas negue    ",0.391009598970413
"pt","30018","presidente  eu sei como e feita a fraude do desmatamento    ja enviei denunciando para mctic e mma",0.0604517757892609
"pt","32656","lamentavel atitude deste governador   futuramente ele podera a vir precisar do governo federal e ai como fica ",0.546032965183258
"pt","29467","presidente bolsonaro maior autoridade do pais  tem q ser protegido pelo mal politico dessa bahia   deus e nossa senhora vai te proteger e o povo do bem da bahia tbm ",0.260223716497421
"pt","30035","convoca o exercito ou a policia federal meu presidente   sem seguranca e que o sr  nao pode ficar  b17 2 022",0.228820145130157
"pt","45672","intervencao federal ja  tire esse governador usurpador da bahia ",0.49497264623642
"pt","45948","caga pro governador comunista e acione o eb  a prf e a pf  simples assim   ",0.471935361623764
"pt","45673","esse governador  ba  acho que esta querendo roubar o titulo de pior governador do maranhao  so pode ",0
"pt","37215","chama o exercito e pronto",0.566401839256287
"pt","30095","a palavra de deus diz que luz e trevas nao se juntam  onde a luz chega as trevas vao embora  fique tranquilo capitao porque deus esta contigo   #paz ",0.521586358547211
"pt","8979","jair voce nao se lembra mas eu fiz por livre expontanea vontade tua seguranca no padano junto com o salgado aqui nos eua antes de voce ser presidente  pra mim desde entao  eu que moro a 20 anos na america  ja me preocupava com sua seguranca em pleno solo americano  so tenho a dizer uma coisa  e hora de triplicar sua seguranca pessoal   semelhante ao trump  ",0.417778253555298
"pt","32196","chama as forcas armadas para te proteger    presidente pode tudo    manda no brasil   ",0.38444596529007
"pt","45919","so lembrando esse ordinario que o lula ta preso babaca",0.193551331758499
"pt","8976","acho que so vc nao percebeu ainda o tapetao  acorda  senao ate meio do ano que vem vc sera ex presidente msm ",0.348652005195618
"pt","29468","responsabilidade  do estado da bahia em resguardar a seguranca do presidente da republiica em visita ao estado da bahia  um governador irresponsavel pode governar ",0.526653587818146
"pt","30069","seja bem vindo presidente  os moradores de conquista que nao tem politico de estimacao  acolhe o senhor com todo respeito a uma autoridade maxima do pais seja la qual lado for  ",0.822580635547638
"pt","37246","boa  viagem va com deus ",0.692083716392517
"pt","29470","lamentavel  rui costa tem que entender que a bahia e a policia militar nao e dele  com ajuda de deus  do povo brasileiro e do presidente nos aqui da bahia vamos nos livrar desse governador comunista ",0.578047215938568
"pt","14524","mas e isso que queriam  insubordinacao  promiscuidade e baderna  sao os que subornam policiais  roubam dentro de mercado e se acham vitimas da sociedade ",0.43658572435379
"pt","14476","pode tirar a roupa em publico  nao e atentado ao pudor  o pt e tudo de pior ",0
"pt","8927","mas ate agora nao se pronunciou sobre esse caso  estranho ne    porque sera    hummm    estou comecando a achar tem caroco nesse angu  desde quando o moro aceitou renunciar a candidatura para virar ministro  tudo premeditado  sem o moro  logicamente a lava jato perderia forcas  ",0.339854866266251
"pt","29453","senhor presidente o senhor tem 100   das forcas armadas a sua disposicao nao vai fazer falta a pm da bahia",0
"pt","29451","so o presidente nao dar motivos para atacarem      tudo que ira falar deve ser ponderado     ou fica calado     torco para o brasil mas tem que ajudar ne ",0.427980720996857
"pt","33344","muito cuidado  mas como presidente do pais sua ordem deve ser cumprida e exigir a presenca dos militares    tem que mostrar quem manda de uma vez por todas   ",0.691363036632538
"pt","29437","jair messias bolsonaro  melhor presidente do brasil  cada dia te admiro mais  nosso brasil precisa de um homem com h maiusculo  ",0.961224615573883
"pt","32595","parabens que deus abencoe voce sempre",0.549251794815063
"pt","32594","convoca o exercito senhor e maior do q governador",0.494314104318619
"pt","29434","exercito brasileiro e so aciona los e a seguranca sera realizada com sucesso brasil acima de tudo deus acima de todos",0.976190447807312
"pt","29452","nao entendo isso  trata se do presidente  nao e autoridade maxima  acho que isso so acontece aqui no brasil  poe o exercito pra fazer a seguranca ",0.250707417726517
"pt","43427","e um babaca  irresponsavel  bola pra frente bolsonaro  seu compromisso e com o povo baiano  nordestinos e a nacao ",0.561662435531616
"pt","32250","caro governador da bahia  espero que com essa sua atitude a pm cumpra seu objetivo que e de proteger a populacao  ja que voce e quem decide quem merece ou nao ser protegido  ",0.80303031206131
"pt","30015","senhor  jesus  proteja  o nosso  presidente  e a fasta  todo o mal do caminho  dele  senhor  tem de misericordia",0.34242171049118
"pt","29445","ja orei pelo presidente hoje  vai dar tudo certo  e o brasil vai crescer muito ",0.881882905960083
"pt","8940","ele vai assistir aqui de fora o brasil dando certo",0.543213129043579
"pt","8936"," presuncao de inocencia e perfeitamente compativel com a prisao apos condenacao em segunda instancia ",0.770732879638672
"pt","26854","voce um louco",0.527517974376678
"pt","8928","jair messias bolsonaro isentao  pra proteger seu filho voce apagou o post o qual defendia a prisao em segunda instancia  seu filho nao assinou a carta a favor da prisao em segunda instancia  voce ficou pianinho diante do stf  simplesmente te calaram  agora me chama de isentao e comunista por estar te criticando ",0.355881214141846
"pt","34522","vai com deus  presidente  ",0.532920479774475
"pt","23305","acho engracados alguns aqui criticando a postagem do video  simples  nao veja  e segundo  o facebook nao e para criancas  os pais que sao irresponsaveis em permitir que o tenha   denison arenas mendonca mariana mendonca",0.303288280963898
"pt","43212","esse governador da bahia e ridiculo e incompetente  ele deveria se preocupar com a situacao precaria que a bahia se encontra ",0.382835328578949
"pt","23361","achei super condizente a postagem  pra quem esta achando ruim  acho que voce esta na pagina errada  lugar de fingir que nada esta acontecendo e na pagina dos candidatos do pt",0.347648859024048
"pt","23179","feminicidio que fala   cade o movimento feminista para se posicionar contra esse tipo de barbaridade   estao ocupadas demais com outras causas banais que nao seja sobre os direitos das mulheres  ne  ",0.190252810716629
"pt","23180"," devemos respeitar a cultura de cada pais         esquerda ",0.698483407497406
"pt","23183","pessoal presidente postou por causa de usa uma muculmana entrou no congresso e quer tirar trump  ",0.35007643699646
"pt","43215","governador petista  nao poderiamos esperar nada diferente  sao sujos e  nao sao a favor do povo  pois sao do quanto pior melhor  essa tatica aqui em vitoria da conquista nao dara certo  o povo baiano esta com o presidente ",0.243589743971825
"pt","32839","va em paz meu presidente jesus esta te aguardando de todo mau    ",0.380989730358124
"pt","25351","enfim estamos abrindo os olhos   gloria deus   ",0.709872841835022
"pt","10003","fecha logo essa p   ou  tu vai ser  ex  mesmo",0.45967510342598
"pt","43211","muito em breve esse governador ptista estara no palacio da alvorada mendigando dinheiro para a bahia  o povo baiano ainda nao aprendeu a votar  infelizmente ",0.100000001490116
"pt","32851","quando ele pedir exercito  com a policia em greve  nao mande",0.176582098007202
"pt","23185","que tal trabalhar para combater a violencia contra mulher aqui no brasil mesmo  bora trabalhar  kkkkk",0.560746312141418
"pt","32859","leva a gurda nacional e ja traz esse governo junto kkk",0.578827977180481
"pt","23175","senhor presidente com uma postagem dessa o senhor ofende nao somente esse grupo de pessoas que cometeu esse ato  com essa postagem o senhor ofende todos os muculmanos que nao tem nada ver com esse ato  a final machismo esta em todos os paises a final a lei maria da penha nao foi criada por conta de nenhum muculmano ate onde eu saiba ",0.368753403425217
"pt","23174","parabens por mostrar a verdade a milhoes de brasileiros  presidente  ja e hora do ocidente tirar a venda dos olhos para ver o que acontece na maioria dos paises onde a sharia impera  mais uma vez digo  parabens ",0.503509998321533
"pt","27455","algumas pessoas para entender  o que e o islamismo precisam ver esse tipo de imagem  do contrario acham que e perseguicao religiosa  a verdade deve ser mostrada sempre ",0.510469794273376
"pt","25341","e segue o bbb    projetos de governo nada   ",0.516335606575012
"pt","32811","lembra deste governador na hora de distribuir emendas e obras    ",0.559515833854675
"pt","25338","a cada dia me orgulho mais do meu voto ",0.478992640972137
"pt","23169","falam dos cristaos mas n abrem o bico sobre os muculmanos q estao invadindo o ocidente   ja conversei c alguns n rs e m contaram oq fazem c homossexuais e prostitutas    senegaleses e haitianos principalmente ",0.412284016609192
"pt","23409","galerinha que estao cobrando um monte de coisas  estamos no quinto dia de mandato ainda  nao deu tempo de fazer muita coisa  talkei  ",0.316365838050842
"pt","23399","pergunte se isso acontece em israel  jamais ",0.530179798603058
"pt","23215","opinarmos sobre as barbaries de la  nao fara tais paises mudarem em nada  vale ressaltarmos que estamos falando de pessoas que sao capazes de se matar e matarem os outros  apenas reveja o processo de visto para paises com tais praticas  mas sem alarde   eles sao vingativos e melhor proteger a populacao e literalmente nao inflamarmos esse povo ",0.327586203813553
"pt","23201","isso e muito triste  caro presidente diz uma coisa assim so um palpite  sera que seria possivel destina uma parcela do valor da lei rouanet para incentivar o futebol feminino  acho que seria bom pra nossa cultura ja que o futebol corre nas nossas veias ",0.546919941902161
"pt","25400","estamos do lado de israel e eua ",0.514844655990601
"pt","25411","sr presidente nao esqueca   ",0.339640319347382
"pt","23204","as feministas devem estar ocupadas  criando # das cores      ",0.486524075269699
"pt","25414","e melhor jair se acostumando bolsonaro2022",0.861317038536072
"pt","10332","ela vai ve  quem e ex presidente  leles nao  sabem que os leoes  do brasil  vao  para ruas   e o leao  dos leoes  o da tribo de juda  estara na frente  ",0.495959132909775
"pt","23209","seu governo vai ser baseado apenas em ataques a esquerda presidente ",0.543582499027252
"pt","23214","quem apoia a violencia de qualquer especie nao e ser humano todo o ser humano merece respeito  e ser protegido contra qualquer tipo de injustica  e ninguem  tem o direito  de julgar ninguem",0.554949581623077
"pt","27559","grade mentira isso  um filme bem bem antigo    alcorao sagrada disse quem matar um alma inocente como se tivesse matado todo humanidade  isla significa paz   paz no coracao de cada um tem odio",0.80303031206131
"pt","23387","cade os direitos humanos a anisstia internacional so querem acusar o presidente do brasil bolsonaro",0.0724858641624451
"pt","25392","desnecessario esse video capitao ",0.39260333776474
"pt","23371","sobre isso ngm fala ou pede e protesta  ja sobre o azul ou rosa   ",0.505808532238007
"pt","23190","meu deus do ceu  temos o feminismo seletivo  piadas sobre rosa e azul sem pensar no abuso sexual de criancas  violencia contra a mulher    precisamos de amor nesse planeta ",0.631006419658661
"pt","23372","que horror    deus recaira com sua ira aos homens ruins  agradecemos pelo nosso pais e ao nosso presidente em manter a soberania para nos salvaguardar ",0.314024090766907
"pt","23193","existem 1 8bilhoes de mosulmanos nesse planeta  a maioria vive em paz e recusa esse tipo de violencia   generalizando nunca fiz bem pra ninguem na historia do humano ",0.298078119754791
"pt","32884","vc e o presidente acaba com essa bagunca foi por isso que votamos no senhor ",0.335367947816849
"pt","10292","eu nunca vou te abandonar estamos juntos forte abraco deus te abencoe",0.152072787284851
"pt","25317","mexeu com uma  mexeu com    nao pera",0.360366225242615
"pt","25281","hj fazem 4 meses do atentado e nao temos nenhuma resposta ",0.0832903385162354
"pt","23287","siga em frente capitao com as verdades     isso sim e presidente  ",0.609460532665253
"pt","23295","os primeiros muculmanos chegaram ao brasil pelos portugueses como escravos  e ate hoje nunca pregamos o odio como esta sendo feito agora ",0.338981091976166
"pt","23307","foi eleito pra governar e nao ficar nas midias sociais ",0.354713022708893
"pt","23285","aqui no brasil nunca permitiremos isso",0.404411971569061
"pt","25381","coloca  cpf nos bilhete da loteria ",0.5
"pt","23283","islamismo e a unica salvacao ao resgate dos valores morais no brasil   farei de tudo para colaborar com o crescimento do mesmo aqui ",0.693657338619232
"pt","23240","assim que que isso tem a ver conosco  isso e problema do oriente medio nos temos problemas mais urgentes aqui no brasil",0.543696403503418
"pt","23246","entenda a historia do isla  traduzido para o portugues   voce vai conhecer a verdadeira mentalidade e o embasamento historico e religioso das atitudes dos lideres muculmanos de ontem e de hoje    https   youtu be f2sv xrtdrq",0.645878672599792
"pt","23248","sera que sai na tv este caso da vida real    ou o que importa mesmo e o azul e o rosa    ",0.606810033321381
"pt","23255","manoo e o que muda vc postar isso  mostre alguma medida ou proposta de lei pra endurecer as penas do crime passional contra a mulher  o feminicidio no brasil esta  bizarro  e nao venham falar que eh pra cuidar como qqer homicidio  pq o passional e sempre na maioria contra a mulher  entao  acho melhor postar uma proposta do que um video que acontece em outro pais  mostre a solucao para o brasil ",0.546751141548157
"pt","23261","e triste ler esses comentarios  mas e necessario para compreender o raciocinio dos eleitores do atual presidente  o prejuizo social nao sera pequeno ",0.0652173906564713
"pt","23262","nao podemos aceitar a lei deles no nosso pais ",0.413960635662079
"pt","25375","aqui nao   deus abencoe as cruzadas ",0.361496955156326
"pt","23230","muitos preferem fechar os olhos ao sofrimento dos inocentes injusticados",0.27998822927475
"pt","25427","eduardo lima marco aurelio c  borges deve ser o primeiro presidente do brasil a se manisfestar contra isso ",0.539635121822357
"pt","23278","que nivel msm    nunca antes um presidente abriu o olho da sua nacao  o pt compactou com tudo isso sem vcs perceberem ",0.371786892414093
"pt","23279","aguinaldo gomes marcos vinicius quando falamos em  controlar entrada de refugiados  e para evitar esse tipo de coisa  muitos vao para paises acolhedores e querem manter isso   temos que fazer um filtro  nao tem como evitar ",0.39916917681694
"pt","23333","doi muito no meu coracao  como eleitora e marqueteira do nosso presidente bolsonaro  sendo muculmana e brasileira  ler esse tipo de coisa    parte meu coracao    eu espero muito que o sr presidente  que eu e minha familia depositamos nossa esperanca  amplie seus conhecimentos pra que tenha sabedoria ao se expressar  para que saiba exatamente distinguir os tres assuntos  religiao  feminismo  terrorismo    nao e mesmo meus amigos  mariam el tassa bruno saint",0.359154939651489
"pt","49126","infelizmente hj os petistas abriram mao de exercer sua cidadania e seu voto em eleicoes  eles nao  votam em seu proprio candidato eles votam no pt  nem se preocupam procurar saber a indole e carater de tal candidato  o que importa pra eles e que seja do pt    lamentavel e triste realidade   nao se importam com o brasil se importam com o pt  mesmo vendo na cara os roubos q o partido fez ao longo dos anos  cegueira total  ",0.373417735099792
"pt","23338","lembrando que se nao fosse os cristaos  o planeta inteiro estaria vivendo sob este regime ",0.35304269194603
"pt","32788","a maior seguranca o senhor ja tem   que a protecao de deus presidente     ",0.475640952587128
"pt","23349","postagem  resumindo  totalmente desnecessario e sem vergonha levando em consideracao como muitas criancas e mulheres vivem e morrem no brasil ",0.158602297306061
"pt","32802","o senhor estara quardado nas maos do senhor  ",0.512629806995392
"pt","23350","e as que morrem todos os dias aqui     o brasil que e bom em ",0.905774116516113
