"language","id","text","resultado"
"pt","25528","melhor decisao porque um monte ali depois de se eleger foram traidores coloque pessoas que voce possa confiar e isso e em qualquer momento paz ou conflito",0.870370388031006
"pt","27255","nao votei no psl  votei em jair messias bolsonaro  por acreditar  em sua ideia de administracao para o bem do brasil e nao me arrependo  ao contrario  pela primeira vez em minha vida  tenho orgulho do meu voto e do presidente que ajudei a eleger  estamos juntos  capitao    #bolsonaro2022",0.557633280754089
"pt","25544","vou me filiar pela primeira  vez as 53 anos ",0.504212319850922
"pt","25506","partido alianca pelo brasil",0.483259081840515
"pt","25589","foi nesse dia  presidente ",0.495081752538681
"pt","25567","onde assinamos  boa decisao presidente  ",0.793017089366913
"pt","101133","tite falando  ainn o presidente foi no estadio de futebol   ainn meus jogadores chamaram ele pra foto e gritaram mito mito mito    ainn magoei   vou tirar do time todo mundo que gritou mito mito mito    kkkkkk",0.441487938165665
"pt","25548","conta comigo e com 75 por cento da cidade de paraiso do tocantins",0.657689988613129
"pt","29198","por nada presidente  estou a disposicao ",0.644893884658813
"pt","43393","vamos fazer uma alianca de verdade   1  filiados ao partido somente com curriculo e reputacao ilibada   2  candidatos e partido abrindo mao do fundo partidario e fundo eleitoral  a mudanca que o brasil deseja deve partir do bom exemplo  vamos limpar esta nacao dos maus costumes  que tal comecarmos limpando a propria casa  curtam e comentem para o comentario ter relevancia e poder ser comentado pelo nosso presidente e demais partidarios ",0.640845060348511
"pt","25492","unidos pelo brasil ",0.5
"pt","102294","ate a foice",0.502121448516846
"pt","75764","que hospital porcaria  todo mundo sabe que sabadao e dia de feijoada  po ",0.282764464616776
"pt","50657","nosso presidente se superou  nunca que o brasil vai ter no futuro um presidente como bolsonaro  carismatico e do povo ",0.204136848449707
"pt","75833","estamos orando pela sua recuperacao sr presidente   fique tranquilo  pois somos um exercito de intercessores e estamos atentos nesta guerra espiritual   nenhuma arma forjada contra ti prosperara  e toda lingua que se levantar contra ti em juizo  tu a condenaras  esta e a heranca dos servos do senhor e a sua justica que vem de mim  diz o senhor     isaias 54 17",0.48848894238472
"pt","75790","vida longa ao nosso  presidente    primeira vez que me importo de verdade com um presidente do brasil   que deus o torne cada dia mais forte  para combater todas as malicias politicas e morais  que nosso senhor abencoe nossa nacao pelo governo  do bolsonaro   a deus a gloria por tudo que ja foi vencido ate aqui  gratidao a deus e aos homens de bem  incluindo os parceiros internacionais    deus fara maravilhas no meio de nos    ",0.635135114192963
"pt","75797","com certeza presidente continuo em oracao por sua recuperacao e muito orgulhoso de tudo que tem feito pelo brasil",0.71854430437088
"pt","75802","meu presidente    siga firme em seu proposito  deus esta contigo e a maioria dos brasileiros tambem  avante  capitao    muda brasil ",0.578520119190216
"pt","75803","amem deus e maravilhoso e ele te quer bem o sr e o escolhido para salvar o nosso maravilhoso pais   deus pai todo poderoso lhe abencoe e proteja presidente bolsonaro ",0.833333313465118
"pt","75808","e isso ai capitao  deus esta contigo e logo voce vai sair desse hospital para assumir as suas atividades para continuar a sua jornada para melhorar o nosso querido brasil  voce e forte e destemido por isso tudo ja deu certo com a sua saude  vai sair dai curado e renovado para a sua linda familia e para o brasil  nos vamos continuar em oracoes para que sua recuperacao seja constantemente e definitiva  procure fazer o repouso direitinho para ficar curado logo  deus e o povo brasileiro esta contigo  forca  determinacao  garra e vontade  e tudo isso voce tem de sobra ",0.599009871482849
"pt","55257","parabens presidente  deus abencoe  vc",0.549251794815063
"pt","75811","gostaria que o sr presidente enviasse  uma  comissao de fiscalizadores a nosso maranhao  estamos pedindo socorro em todos as areas da educacao e saude  publica ",0.65412175655365
"pt","75815","capitao  assim como os rangers americanos  a nacao brasileira nao vai te deixar para tras  estamos orando como bons soldados de cristo  deus lhe conceda muita saude    ",0.852653026580811
"pt","68","deus abencoe essa uniao   sinceros votos de felicidades   ",0.7726149559021
"pt","75828","imagino o sofrimento  decorrente da tentativa de assassinato  tres cirurgias delicadas  alem da dor  ficar dias sem comer    deus e maior    gloria a deus  por sua recuperacao  sr  presidente ",0.155172407627106
"pt","29252","estou aguardando ansiosa o novo partido",0.709326803684235
"pt","75832","que maravilha presidente  saude muita saude para o sr   avante presidente  avante brasil ",1
"pt","25532","goias e 100  a favor do bolsonaro  por um brasil melhor   ",0.9003626704216
"pt","75835","forca meu presidente  nos brasileiros de bem  estamos orando pela sua recuperacao  nao se esforca  siga todas as orientacoes medicas e logo logo vai estar completamente curado  deus esta no comando   ",0.614498496055603
"pt","29259","estamos juntos  presidente  como fazer a pre filiacao ",0.505687236785889
"pt","27135","vou permanecer no psl pq tenho compromisso com meus pre candidatos a vereadores e a prefeito  um trabalho sendo feito desde antes das eleicoes para presidente  foi muito suor  fome e gastos por um brasil melhor  sem nunca receber absolutamente nada em troca  e por sinal nao pedimos  so queriamos uma limpeza na politica nacional  ser do psl nao e indigno  pelo contrario  foi o unico partido que esteve em todos os movimentos contra a esquerda  nao posso simplesmente abandonar pq o presidente saiu ou pq alguns nao querem transparencia  cada um com suas particularidades e responsabilidades  espero que possa selecionar pessoas de carater  hombridade e responsabilidade para compor cada diretorio municipal e estadual do novo partido   alfredo filho presidente psl viana es",0.430750042200089
"pt","35486","vesti a camisa do presidente diuturnamente na campanha e continuo vestindo  meu site de noticias bate no pt 24 horas por dia  o que eu quero agora e fazer parte do partido que bolsonaro vai criar  itamar will  cuiaba mt ",0.343475937843323
"pt","29255","sugestao de nome para o partido  partido liberal cristao  plc",0.461661636829376
"pt","29125","continuo com o senhor  presidente  nao votei na sigla  votei em bolsonaro ",0.324132025241852
"pt","7143","estaremos na luta amanha  capitao",0.506234169006348
"pt","29065","#aliancapelobrasil vamos fechar o ano com 1 milhao de filiados  ",0.695086658000946
"pt","29660","vou aonde meu capitao vai",0.51726222038269
"pt","25547","boa sorte sr presidente e que deus te abencoe sempre tamos juntos aqui em casa estamos todos com o sr",1
"pt","29923","gostei do nome  como faco para me filiar  caxias do sul  rio grande do sul ",0.827007174491882
"pt","63","se casamento fosse bom nao precisava de testemunha  avisa ele presida    ",0.805265665054321
"pt","37185","elegemos um presidente  por confiar na sua retidao politica  e nao num partido  onde rachaduras estao destruindo todo o trabalho deste patriota  que seja anunciado logo este novo  partido alianca pelo brasil    papb  esta sera nossa nova empreitada  com certeza teremos aqui  o maior partido politico do brasil  #somostodosbolsonaro  e quem estiver a direita  #bolsonaro2022 com muito orgulho ",0.651522040367126
"pt","50733","deus ja esta abencoando a nossa nacao  temos um presidente de verdade   que deus continue abencoando mais e mais   tamos juntos presidente ",0.703359305858612
"pt","50675","eu so queria apertar sua mao e dizer que acredito e confio em voce ",0.23408305644989
"pt","101159","capitao o senhor precisa ir sempre nos jogos do palmeiras coitados nao tem mundial  e o senhor da muita sorte  eu sou palmeirense ",0.435383558273315
"pt","35917","excelente presidente  vou me filiar  esse sim vai nos representar  os outros voltarao a ser anao  #grandedia ",0.883530735969543
"pt","50659","que lindo este amor das crianca com o sr  meu presidente jair bolsonaro   crianca tem tanta pureza e sensibilidade que sente o quanto o sr  e especial carinhoso e sincero",0.833333313465118
"pt","28001","uma alianca forte pelo parana e pelo brasil sera construida no parana junto a deputada aline sleutjes  presidente  conte conosco neste novo caminho ",0.622828781604767
"pt","71","excelente  minha michele vai ser primeira dama em 3 eleicoes  ela ordenou   ",0.905834317207336
"pt","101168","boa noite  senhor presidente        de malta para o brasil",0.831264138221741
"pt","50649","amanha vai estar nos jornais que o presidente sequestrou duas criancas  parabens  meu estimado presidente ",0.580403029918671
"pt","25569","vamos conseguir essas assinaturas em dois tempos e ate com firma reconhecida se necessario for    pra cima presidente",0.742980480194092
"pt","102160","o casal mais fofo que veras hoje ",0.933743834495544
"pt","50653","queridaozao     que bacana isso  presidente  o pai das criancas e que deve ter ficado feliz da vida   e eu  aqui    vendo o senhor com a camiseta do meu inter    que alegria master   a gauchada vibrou com seus videos hoje vestindo ela #intersempre",0.732558131217957
"pt","50650","esse e meu presidente  oro sem por ele e por todo o brasil ",0.477142333984375
"pt","102361","melhor foto  do dia  parabens  ",0.906498551368713
"pt","29211","estamos juntos presidente jb",0.517607629299164
"pt","101167","boa noite presidente jair bolsonaro  primeiro presidente do brasil a levantar a taca e comemorar o campeonato com os jogadores viva o brasil  somos campeoes copa america 2019  o sr  e muito querido por todos nos brasileiros do bem e o melhor o maior presidente do brasil de todos os tempos  brasil acima de tudo e deus acima de todos  deus te abencoe sempre e a sua familia tambem  # somostodosbolsonaro2022 ",0.640845060348511
"pt","75915","depois do almoco ja sabe ne   corre pro celular pra gente jogar um pouco de free fire  ",0.512857615947723
"pt","75908","outro nao teria suportado  so mesmo alguem tocado por deus para aguentar uma coisa dessas e nao morrer  forca  presidente  sua missao esta apenas comecando  temos um pais para consertar ",0.457065433263779
"pt","75878","que deus abencoe cada dia mas presidenteestamos em oracoes ",0.498106241226196
"pt","75877","recupera logo  capitao  o brasil  precisa se vc ",0.53416383266449
"pt","75875","forca presidente e se cuida  continuemos da orando por vc  mais por favor da repouso  queremos vcs firme e fortw pra colocar o brasil nus eixos",0.456474095582962
"pt","75874","forca presidente o brasil precisa de vc que bom que ja esta se alimentando",0.975065529346466
"pt","75873","obg sr presidente um otimo sabado de muitas bencaos pra vc e sua familia continuamos nas oracoes em seu favor pela sua total recuperacao  pois a nacao brasileira tem confiado no sr  e que o nosso deus confiou a ti o nosso brasil para que vc possa governar pois muitos falam que ficamos te idolatrando  e endeusando a vossa pessoa nao e nada disso pois so o nosso criador o pai o filho e o espirito santo e que e digno de toda honra e todo o louvor pois o que temos por ti sr presidente e muita confianca e admiracao  pois por muito tempo fomos traidos por governos anteriores que so queriam acabar com o nosso brasil  estamos com vc sr presidente pra o que der e vier conte com os milhoes que te elegeu e continuo fazendo campanha pra vc sr presidente    deus familia brasil  brasil acima de tudo e deus acima de todos   ",0.564102590084076
"pt","25520","deus no comando e o capitao na orientacao   selva brasil",0.543250203132629
"pt","75841","longa vida presidente deus o abencoe ",0.5166996717453
"pt","75831","continuamos em oracao para o senhor e pelo brasil   quando deus quer nao tem quem nao queira ",0.209922313690186
"pt","75827","vamos mostrar aos lambaios do psol que temos vontade de consertar este pais ",0.616766452789307
"pt","75825","presidente mais querido brasil  clamamos a deus em oracoes pedido que vencesse esta situacao  quando sair do hospital  teremos um compromisso com deus    agradece lo por estar vivo  logo tudo em seu lugar  ",0.773119151592255
"pt","75817","cuide muito de sua saude  para ter uma excelente recuperacao  o brasil precisa do senhor  recuperado ",1
"pt","75816","forca presidente     estamos torcendo pra ter uma otima recuperacao   deus esta no comando   e bolsonaro na veia  somos todos bolsonaro  tamos juntos nesta luta por um brasil melhor      forca  foco e fe que vai dar tudo certo     os humilhados serao exaltados ",0.743902444839478
"pt","75813","deus esta no controle  ja e o melhor presidente do brasil  melhoras  avante brasil ",0.808274328708649
"pt","75810","capitao  meu presidente  que estou aprendendo a amar como a um irmao querido  estou em oracao constante  o brasil esta em oracao constante  deus esta no comando  abracos da dulcineaframil  itajuba mg",0.684027433395386
"pt","75799","boa tarde capitao    honra e gloria a deus pela sua recuperacao     nos que cremos no deus do impossivel  temos a plena certeza que estara realizando grandes feitos para nossa patria amada brasil    ",0.8125
"pt","75785","o brasil agora tem um presidente de verdade  que se preocupa com o bem estar do povo brasileiro  avante senhor presidente  o brasil esta com voce ",0.831702947616577
"pt","75911","cada dia melhor  com a graca de deus  continuo orando pela sua completa recuperacao  presidente  um abraco",0.862901926040649
"pt","75868","boa tarde nosso presidente bolsonaro deus e contigo ninguem destroi um escolhido de deus pra libertar o brasil  forca capitao o brasil precisa do senhor",0.692134976387024
"pt","75967","tem que dar bola sim  tem que processar  nao seja ingenuo  vc tem obrigacao de fazer isso e processar todos em favor de todos que o elegeram ",0.361076265573502
"pt","76528","trate de melhorar tche   o brasil precisa de ti   tu me convenceu que era possivel   e eu creio   por nos brasileiros  eu creio    po vizinho   se cuida e que dhieulla te proteja verdadeiramente   luta ingloria essa nossa justa  mas haveremos de vencer   ja nao tolero mais  brasil pra minorias   quero um brasil de melhorias xiru   um baita abraco desse cigano e gaucho   lux et pax",0.420791536569595
"pt","45978","vamos que vamos  avante  brasil ",0.789280414581299
"pt","75985","o ungido  o escolhido de deus  sera para sempre abencoado  por estar guiando o brasil para o rumo certo  o progresso e a paz  ",0.916666686534882
"pt","75962","orando pela pronta recuperacao do nosso presidente  forca   ",0.582925796508789
"pt","75960","essa agua de coco no prato na caixinha de do conde bahia",0.548184096813202
"pt","76061","toda saude do mundo  meu presidente   uma rapida e plena recuperacao    um excelente final de semana para o senhor e sua familia ",0.954545438289642
"pt","44784","como faz para se filiar   ",0.460512518882751
"pt","29957","meu voto foi do bolsonaro nao do psl ",0.352442383766174
"pt","76320","descanse  presidente  recado da janaina e de milhoes de brasileiros ",0.295417129993439
"pt","50667","a cada dia que passa  aumenta a certeza de que estamos no caminho certo  parabens nosso presidente ",0.956595718860626
"pt","75824","deus o  abencoe sua vida presidente e te proteja sempre de todo mau  levata te  capitao o brasil precisa de vc  ",0.304495394229889
"pt","25553","o psl ja estava se tornando um caminho sem futuro nenhum  o bolsonaro sem o psl continua sendo o bolsonaro presidente da republica  mas o psl sem bolsonaro nao e absolutamente nada  parabens sr  presidente por ter saido desse partido e boa sorte com a criacao do alianca pelo brasil ",0.484298586845398
"pt","29853","vamos juntos nessa alianca pelo brasil  presidente  ",0.647005796432495
"pt","75829","juntos em oracao pela sua saude e por um brasil com ordem e progresso ",1
"pt","29873","vamos  que vamos   precisamos saber como vai ficar aqui em criciuma",0.799701690673828
"pt","50655","esse presidente so nos orgulhar",0.479232043027878
"pt","75844","peco em oracao que o senhor presidente fique logo curado   sei que sera um presidente honesto e vai colocar nosso brasil em ordem  deus te abencoe ",0.702861130237579
"pt","75830","que deus abencoe o nosso presidente  o brasil esta em oracao por sua total recuperacao ",0.514089822769165
"pt","75852","fique tranquilo  nao pule etapas na recuperacao  o brasil pode esperar um pouco mais  deus te abencoe e te proteja sempre  ",0.618297934532166
"pt","50685","equipe b  e preciso preparar as proximas eleicoes  buscar consolidar uma base de apoiadores alinhados pra que a gente ja fique de olho nos possiveis candidatos a deputado e senador  com essa listinha os espertinhos que tiveram apoio do b e estao dando uma de independentes terao o que temer  cade o partido novo que o presidente vai criar pra si  psl ja deu ",0.48289966583252
"pt","75838","tenho  certeza  que  teremos  um brasil melhor   forca presidente   deus  no comando  do seu  breve  restabelecimento ",1
"pt","29944","onde eu assino  ",0.37483873963356
"pt","31593","sou vereador em guarapuava pr  fui o unico  politico com mandato a fazer campanha para o presidente vou me filiar no novo partido e ajudarei a estruturar na regiao ",0.619483172893524
"pt","46625","brasil acima de tudo  deus acima de todos",0.772346258163452
"pt","50683","perdi alguns amigos por ter votado no bolsonaro     ganhei um amigo melhor   valeu a pena   ",1
"pt","75931","presidente  fico muito feliz em ver voce se alimentando  come tudo isso ai direitinho e fica bom logo ",1
"pt","50689","deus te abencoe meu querido presidente e te livre de todo mal ",0.454043507575989
"pt","25499","ja vou comecar minhas  oracoes  #apb parabens por sabia decisao meu presidente ",0.544142246246338
"pt","75801","deus te proteja de todo mal  senhor  acompanhei nosso presidente  o brasil esta comecando a ver a luz de cristo e nao mais as trevas  estas estao sendo dissipadas  ",0.269474864006042
"pt","7190","que deus abencoe essa familia",0.504069864749908
"pt","7192","parabens familia bolsonaro",0.54518187046051
"pt","7521","presidente bolsonaro    amanha  domingo  dia 26    fique em casa com a familia  o exercito bolsonariano estara nas ruas do brasil  de forma pacifica e ordeira  em favor de seu governo e das reformas  para o brasil voltar a crescer e gerar empregos pra galera  ",0.538146913051605
"pt","55393","meus parabens presidente o senhor e o presidente que eu pedi a deus e ele nos atendeu que deus te abencoe e continue sendo o homem humilde que sempre foi ",0.833333313465118
"pt","45154","ja podes contar nao somente com a minha assinatura como tambem com a minha filiacao  presidente ",0.318064123392105
"pt","33826","como faco para me filiar ao partido   ",0.442151546478271
"pt","75854","muita saude e forca    presidente    e conte com minhas oracoes    o senhor e deus sao nossa esperanca   na certeza de um brasil melhor   ",0.93478262424469
"pt","50741","e impressionante como que o jair messias bolsonaro e incrivel demais  quem vai ao rei  jamais volta sem ter o seu pedido atendido  as criancas amam o bolsonaro  que tem um fantastico poder de atracao sobre qualquer pessoa de bem  adultos  jovens  idosos  criancas se encantam com ele  #feemdeus #certezaricobrasilrumoaoprimeiromundo #brasilprosperidade",0.591774165630341
"pt","50739","fala serio  e ainda diz   ganhei o dia  como nao amar    ",0.212993025779724
"pt","25551","isso ai presidente estaremos sempre com voce onde estiver queremos o brasil melhor pra todos nos brasileiros boa noite",1
"pt","50732","nunca vi em minha vida um presidente tao simples  mas queria que tivesse mais cuidado  infelizmente a midia distorce tudo ",0
"pt","50710","jair   nos pequenos gestos se mostra a grandeza de um grande estadista   faz toda diferenca    ",1
"pt","50706","esse presidente e muito carinhoso e atencioso  fico a pensar como ficou o coracao daquelas duas criancas e da familia   muito obrigado bolsonaro   ",0.93478262424469
"pt","50704","presidente o sr ja entrou para a historia deste pais  sao gestos assim q levam o sr adiante   obg presidente  deus te abencoe",0.724837601184845
"pt","50700","capitao venha visitar floriano piaui estamos de bracos aberto sempre   ",0.607933640480042
"pt","38105","nao sou filiado a partido algum  mas continuarei lhe apoiando presidente ",0.32088029384613
"pt","29537","nao sei nem o que fazer como filiado  mas quero tb esse negocio ai  pela primeira vez na vida vou me filiar a um partido  bolsonaro me fez vestir a camisa verde e amarelo ",0.336824953556061
"pt","29541","estamos juntos presidente  bora colher assinaturas",0.640962600708008
"pt","75916","bom apetite capitao  sei que o senhor queria era um cachorro quente  melhore logo  estamos aguardando sua volta ",0.646044790744781
"pt","27420","onde assino querido presidente ",0.52538001537323
"pt","101661","tu tem carisma presidente   o tite nao  ",0.548842787742615
"pt","75909","deus e contigo presidente   estamos aqui fora na luta e orando pelo seu restabelecimento o mais breve possivel se cuida ai   que aqui estamos com noticias fresquinhas de tudo que acontece em nosso brasil  bjos fica em paz  ",0.702878475189209
"pt","75910","ainda nao vai ter pao com leite condensado  mas esta cada dia mais proximo  avante presidente  continuo em oracao ",0.278073370456696
"pt","75912","muitas bencaos do eterno o todo  poderoso com certeza ele esta sempre protegendo os justos estamos junto orando no logo retorno amem",0.813721060752869
"pt","25660","vou ajuda no que posso  recolher assinaturas e filiacao",0.554759621620178
"pt","25654","me coloco a disposicao para participar e formar um diretorio em minha cidade e regiao    ",0.429503977298737
"pt","25653","vamos com tudo presidente   conto com o apoio de todos nos de angra dos reis  ",1
"pt","25644","faco questao de me filiar tbm    tenho 40 anos e nunca encontrei motivacao para me filiar a algum partido    desta vez estou junto",0.168653562664986
"pt","75895","obrigada deus como e gratificante ver a melhora do nosso presidente ",1
"pt","25643","o sr e aguia",0.52627432346344
"pt","25641","nunca pensei em me filiar a partido algum     mas nesse irei me filiar  ",0.356474995613098
"pt","25602","nunca me interessei tanto por politica em 31 anos de existencia   o que muito pouco   mas pela primeira vez irei me filiar a um partido ",0.50318306684494
"pt","75926","deus te abencoe muito e te de muita saude muita mesmo querido precisamos muito de vc",0.733687341213226
"pt","27641","estamos com vc capitao   aguardando suas instrucoes   rumo ao novo brasil ",0.716180443763733
"pt","101176","nao existe presidente mais patriota que o nosso presidente bolsonaro  por ele   perco a amizade mas nao perco meu orgulho de ter trabalhado tanto na sua campanha ",0.516803622245789
"pt","102202","eu torci pra selecao brasileira so por causa de vc presidente ",0.472851932048798
"pt","29218","parabens presidente pela decisao  vamos estar juntos nesse novo planejamento  muito importante analisar os candidatos que vao fazer parte do novo partido e os futuros candidatos nas proximas eleicoes  #jairmessiasbolsonaro  #elesim #bolsonaro2022",0.67663586139679
"pt","29483","gigantesco diaaaa",0.715859889984131
"pt","75855","forca comandante   precisamos de voce   p brasil esta orando pela sua recuperacao   sua missao e ardua  e estaremos juntos ate o fim ",0.509599208831787
"pt","75856","capitao o senhor vai mostrar   que o brasil  voltara a ser o brasil que merecemos ",0.528412759304047
"pt","75861","tenho certeza que logo o senhor vai estar governando o nosso brasil em nome de jesus cristo tenha fe ",0.781607151031494
"pt","75864","eu  aprendi muito cedo que quanto maior a ira do inimigo maior e a verdade da sua vitoria   arvores secas nao levam pedradas  aguente firme somos uma floresta ao teu lado e fortes e firmes",0.217418506741524
"pt","75865","estamos c vc presidente e sabemos q e vontade de deus a sua governancia sobre o brasil   oraremos sempre pra ter sabedoria de deus ",0.688986897468567
"pt","48607","se o senhor achou melhor assim  tem o meu apoio   siga em frente  grandes coisas tem jesus para o futuro  ",1
"pt","76004","deus esta contigo meu presidente    estamos orando    logo vai ficar bom ",0.854290008544922
"pt","101171","boa noite capitao     que bela imagem    tenha uma bela semana    fique com deus   ",0.837234258651733
"pt","29083","nunca pensei em participar de politica  mas me candidato a me filiar     #tamujuntospresidente",0.299653172492981
"pt","29077","qual  numero do partido joao 8 32   ",0.483259081840515
"pt","29074","sou albra  alianca pelo brasil   ",0.528666973114014
"pt","101172","vamos colecionar muitas vitorias para esse pais  presidente   nao so no futebol  mas na economia  no emprego  na saude  na educacao e na etica  tamojunto ",0.702415347099304
"pt","29056","francisco beltrao esta com o senhor capitao   ",0.544426560401917
"pt","46851","estamos juntos presidente   desfililei do psb para filiar no psl porque o psb nao quis apoia lo  vamos todos  para o alianca pelo brasil  um partido novo e limpissimo  brasil ",0.52598237991333
"pt","75839","jesus mt obgda  pela vida do nosso  presidente jesus q te de a recuperacao  abencoadate amamos    o brasil tdo te ama",0.635226190090179
"pt","47833","parabens pela decisao e coragem presidente",0.776437103748322
"pt","69","casal lindooo  boa noite a vc meu presidente e a sua esposa ",1
"pt","25579","o que importa e a vossa pessoa  estamos juntos   aqui de jaragua do sul sc",0.62546318769455
"pt","43387","temo juntos",0.502365589141846
"pt","76251","amado presidente continuarei orando  deus o guarde boa recuperacao ",0.870169103145599
"pt","38089","nao votei no psl votei em jair messias bolsonaro",0.339640319347382
