"language","id","text","resultado"
"pt","75906","que deus te abencoe meu presidente  estamos confiantes no novo brasil     ",0.408842086791992
"pt","75905","muito bom  bora la o brasil esta a tua espera  ",1
"pt","75904","sr  presidente do brasil  crie uma nova lei contra esses usuarios que defamam  as autoridades  que nao mede consequencias com as asneiras que falam  e que deus te abencoe sempre ",0.495628774166107
"pt","75903","meu coracao  transborda de  alegria  a fe  em deus  traz seus milagres guiando as maos  dos medicos   o brasil  precisa mto de vc ",0.850020408630371
"pt","75901","tamo juntos a uma corrente do mal torcendo para o brasil nao prosperara mas o mal nunca vencera o bem",0.0656463205814362
"pt","29032","estamos juntos  a caminhada e unica e o objetivo e o brasil ",0.596054673194885
"pt","75898","gracas a deus senhor tem q por o brasil em ordem e a vossa missao  q nos estamos em oracao",0.652232527732849
"pt","50679","este e o meu presidente  abraca criancas o tempo todo e nao so na epoca  de eleicao   brasil  acima  de tudo    deus acima de todos ",0.639578938484192
"pt","25617","parabens pela decisao presidente  que deus continue nos abencoando  para colocarmos esta nacao adiante  forca e honra capitao  ",1
"pt","75894","pode nao ser o melhor mais o unico que vai concertar  o brasil sucesso presidente  o povo brasileiro precisa muito de vc deus no comando",0.845533013343811
"pt","75893","se cuida presidente o brasil precisa do senhor  estamos orando pela sua recuperacao ",0.517449736595154
"pt","75891","deus te abencoe uma otima recuperacao firme forte o brasil precisa de vc ",0.587603449821472
"pt","76221","ficamos muito feliz pela sua recuperacao temos coisas a serem resolvidas aqui no mato grosso  o meio ambiente esta a deus dara  so serve para cabide de emprego com altos salarios  os peixes morrendo nos rios contaminados por coliformes fecais dos esgostos residenciais  o pantanal agoniza  acabou o oxigenio dos rios   volte logo meu presidente amado ",0.676105380058289
"pt","76220","forca capitao  o batalhao bolsonariano te aguarda j raimundo lider caminhoneiros do leste mineiro ",0.617015063762665
"pt","76098","em frente  meu presidente  com relacao aos inimigos de vexa  vao cair por terra um por um em nome de jesus     ",0.535121917724609
"pt","30990","50 anos  nunca fui filiado  espero ansiosamente o dia para concretizar",0.545505404472351
"pt","75887","a comunidade do culto da mata  unasp  esta em oracao  todos os domingos as 4h45  pela sua excelencia ",0.814968585968018
"pt","49233","imenso dia     ",0.512917399406433
"pt","101175","boa noite    em 6 meses de governo bolsonaro o brasil ja e campeao   kkkkl",0.778025150299072
"pt","101177","ue  o tite disse que nao mistura politica com a profissao dele  por que nao fez nada para impedir do mito entregar as medalhas ",0.278399676084518
"pt","25565","eu tambem acabei de pedir para presidente do psl de porto ferreira que eu estou saindo do partido agora vou ser da alianca pelo brasil",0.368563413619995
"pt","25572","penso em me filiar  o que nunca imaginei antes",0.361867249011993
"pt","76274","estou imensamente feliz em ver que jesus esta realmente contigo presidente  nada nem ninguem vai atrapalhar seu caminho na recuperacao  continuamos rezando  tudo ja deu certo     ",0.884615361690521
"pt","76264","forca guerreiro  vc ira vencer e nos ajudar para termos dias melhores em nosso pais  abraco  ",1
"pt","29726","presidente  uma grande licao foi aprendida quando no psl  no inicio  la eram so sorrisos  abracos e juramentos de fidelidade  depois  sabemos bem o que aconteceu   jamais confiar 100  em alguem  esteja de olho nas atitudes destes que hoje dizem estar com o senhor  observe o modus operandi perante as situacao que surgirem  se estarao em harmonia com o partido ou nao    enquanto ainda e somente um graveto  e facil de quebrar ao meio e depois lancar na fogueira  porem  depois que se torna um grande galho  ai a coisa e  mais dificil  por isso  olhos atentos sempre  observando sempre estes  pupilos  que rodeiam o senhor   alguns podem sim  ser de confianca  porem  nao foram poucas as mascaras que cairam no psl   muita sorte e que deus o abencoe  presidente ",0.576923072338104
"pt","50661","nunca tivemos no brasil um presidente mais popular e mais humilde do que bolsonaro  que deus de a ele muitos anos de vida e sabedoria   ",0.899999976158142
"pt","76096","eu nao so brasileira  so boliviana  mais so sua fans y gusto muito bem de bolsonaro  deus abencoe sempre e cuide de vc  pronto vai tomar as rendas de tudo  pronta recuperacao ",0.369723558425903
"pt","29323","o senhor pode ir pra onde quiser que vamos atraz rumo a 2022 nosso querido presidente    ",1
"pt","50662","essas sao o futuro de um brasil melhor    parabens meu presidente ",0.879660785198212
"pt","50663","esse e meu querido presidente do brasil   o melhor ate hoje    ",0.927408933639526
"pt","75929","feliz em saber q o senhor esta cada dia melhor  deus abencoe sua recuperacao  forca ai capitao  o brasil precisa de voce ",0.954545438289642
"pt","75928","presidente jair bolsonaro  se deus e por voce  quem sera contra voce  ninguem  deus e maior  deus e o povo esta do seu lado  confie em deus  que voce vai vencer essa batalha  voce vai vencer esses inimigos que querem ver a sua derrota  deus vai te dar a vitoria  os anjos e os santos te guardem e te protejam  o seu anjo da guarda te acompanhe sempre  jesus e o medico dos medicos  grande presidente voce e a solucao do nosso brasil  presidente jair bolsonaro  quando voce sempre sair de casa  reze  deus por mim  e ninguem contra mim ",0.600000023841858
"pt","30989","precisa disponibilizar em pdf as pautas e a ideologia do partido  se tiver escrito social democracia  deixo de apoiar  ",0.580281674861908
"pt","75888","que bom meu presidente  fico contente e feliz em ve lo se recuperando  va com calma  uma coisa de cada vez  e em primeiro lugar a sua saude  os brasileiros do bem lhe amam e estao ao seu lado para o que der e vier  avante meu capitao  unidos seremos mais fortes  brasil acima de tudo  deus acima de todos ",0.666666686534882
"pt","101208","ja cancelou sua veja   11  5087 2112 para grande sp e 0800 7752112 demais   localidades  de segunda a sexta  das 8 as 22 h ",0.597961902618408
"pt","75957","sr presidente  faca do brasil um pais de excelencia  de respeito  para que o povo brasileiro trabalhador possa ter os mesmos direitos e ter dignidade de vida  nos o apoiaremos ",0.743597745895386
"pt","50803","a camisa do uniao fc e mais bonita  se o presidente aceitar uma camisa do nosso clube  enviarei ",0.778908252716064
"pt","133","#deusbrasilbolsonaro #bolsonaronossopresidente #dia26nasruas ",0.5
"pt","75853","essa sopinha deve estar uma delicia       to ate com inveja       cuide se bem capitao    voce precisa estar bem forte pra tocar o batente    va devagar que o senhor e consigo    estamos em permanente oracoes pela sua rapida recuperacao    vai dar tudo certo    a sua equipe e aguerrida e competente    tudo vai acontecer no tempo de deus    continue confiando    o brasil inteiro acredita e espera em voce    ",0.651515126228333
"pt","31043","so dizer onde eu tenho que ir pra assinar  seja como filiado  candidato    o que for preciso  ",0.164121270179749
"pt","75850","volta logo o brasil precisa de vc urgente ",0.291491210460663
"pt","75848","isso mesmo senhor presidente  do seu lado somos maioria e a minoria que lhe desejou mal  so podemos dizer deus sabera o que fazer nao cabe a nos desejarmos mal ne  um abraco do tamanho do brasil pro senhor e bem vindo a vida  vida longa ao nosso presidente do brasil  siga firme capitao  nos seguimos em oracao pelo senhor e pelo brasil ",0.46472030878067
"pt","75846","presidente continue firme no proposito de fazer o melhor pro nosso brasil  deus e maior e a maldade das pessoas nao pode derrotar os bons  que deus cuide do senhor ",0.753391623497009
"pt","75843","presidente muito feliz em ver o sr melhor  o brasil precisa do sr  volte logo ",1
"pt","51860","na moral  se esse nao e o melhor presidente que o brasil ja teve e melhor cancelar o brasil ",1
"pt","25738","onde assino  manda uma lista  imprimo  colho assinatura e mando via correio ",0.646928548812866
"pt","76150","deus o abencoe e proteja  os brasileiros de bem estao contigo  ",0.910073757171631
"pt","75837","ja deu tudo certo  agora e questao de mais algum tempo a recuperacao   orando e mandando muita energias positivas  ",0.642913103103638
"pt","75836","forca presidente  o brasil e os brasileiros de bem precisam do senhor  gracas a deus deu tudo certo ",1
"pt","25719","presidente deverias marcar dotodos os que te apoiaram nessa foto  pra sabermos em quem votar nas proximas eleicoes ",0.68187153339386
"pt","75834","todos nos somos teus filhos e filhas porque e o pai da nossa nacao melhoras oramos por ti pai bolsonaro    pai do brasil",0.411915153264999
"pt","25723","como faco para criar este partido em minha cidade       ",0.450183928012848
"pt","34133","1 milhao de filiados em menos de 24h   ",0.476532548666
"pt","29131"," meu presidente  tenho 53 anos e nunca fui filiado a partido algum   agora estou aguardando para fazer minha filiacao  com a ajuda de deus e com o apoio dos srs  vamos tirar da prefeitura de ipira sc o  pt que esta  15 anos frente a prefeitura  ",0.61594694852829
"pt","75826","sua recuperacao e acompanhada por milhoes de brasileiros que assistirao mais uma vitoria sua  presidente  o brasil quer aplaudir sua superacao e deus esta ao seu lado  que o seu domingo seja belo junto aos seus familiares  daqui continuaremos orando ",0.75
"pt","75822","meu querido amigo e presidente  bom ver que nossas oracoes estao sendo atendidas  se cuide e volte logo  vamos salvar essa nacao  bjs",0.93478262424469
"pt","75857","o brasil precisa de muitos homens e mulheres fortes e destemidos como nosso presidente  alguem pode levantar a mao ",0.711018204689026
"pt","75858","boa tarde presidente  que deus lhe conceda melhoras  e logo possa estar a frente do governo fazendo o que todos nos desejamos  brasil limpo  com progresso   paz e harmonia ",0.844827592372894
"pt","50703","minha filha isadora  ajudou na campanha do bolsonaro tambem",0.576808571815491
"pt","31032","boa vou me filiar ao novo partido",0.721726655960083
"pt","75883","que deus abencoe sua vida presidente   estamos te esperando  por um brasil melhor ",0.895244956016541
"pt","102606","cada um comemora como pode kkk",0.661086559295654
"pt","50789","tu e o cara  presidente   so troca a camisa  poe uma do gremio po   kkkkkkkkkk",0.450169205665588
"pt","29247","estamos com voce presidente  vou assinar  colher assinaturas e me filiar a alianca pelo brasil ",0.542929947376251
"pt","148","deus te abencoe presidente  muita saude para comandar esse brasil ",0.732991993427277
"pt","43947","tmj",0.531063079833984
"pt","29239","meu primeiro partido foi o psl em meio seculo de vida   e o segundo sera alianca pelo brasil  onde jair for eu vou ",0.401092082262039
"pt","76202","presidente estamos juntos em oracoes   e com a fe de deus  por que so ele sabe de todas as coisas   o senhor sair a semana que vem firme e forte  pelo amor de deus do nao va pagar  polichinelo ",0.410582929849625
"pt","75859","forca e fe  presidente  o brasil esta orando pela sua recuperacao ",0.539977014064789
"pt","75798","gloria a deus  obrigado meu deus meu presidente deus e fiel em sua vida ninguem derruba o filho que deus escolhe para governar o brasil   nos a maior parte dos brasileiros  deseja que voce volte pra nos  amamos nosso capitao  tamos juntos de",0.732558131217957
"pt","50773","que legal  eu tambem gostaria de conhecer o alvorada",0.396424412727356
"pt","25662","e sei que nos votamos na pessoa nao no partido   continuou firme com meu capitao bolsonaro",0.442319929599762
"pt","29206","viva  vamos comecar do zero  parabens  estamos juntos  ",0.843024134635925
"pt","75862","amem  para dar conta de governa nosso brasil teria mesmo de renascer um homem de  muitas provas e lutas por isso eu creio o senhor foi e sera o escolhido de deus para salvar nossa nacao  deus abencoe com uma recuperacao rapida ",0.694948315620422
"pt","76184","vamos em frente presidente   os cachorros latem enquanto a carroagem passa ",0.667466938495636
"pt","31096","pela primeira vez na vida  cogito a possibilidade de me filiar a um partido politico  ",0.477166682481766
"pt","101174","excelentissima noite presidente bolsonaro para todos nos  os brasileiros de bem   foi muito mas  muito bommm ver o senhor e os nossos super ministros no maracana       nosso pais sendo passado a limpo             porque somos brasileiros                                         sim senhor                                             doa em quem doer                       ",0.743902444839478
"pt","75821","forca presidente jair bolsonaro    as pessoas de bem do nosso brasil  estamos todos orando pedindo a deus pelo seu pronto restabelecimento    saude e o que interessa o resto nao tem pressa    avante capitao  ",0.80303031206131
"pt","76009","meu presidente jair messias bolsonaro  doi saber  do seu sofrimento  uma pessoa saudavel ser covardemente agredida para ser morta  mas  seio que deus esta  cuidando do senhor  sei que  quanto mais nos aproximamos se deus o inimigo tenta nos destruir  o senhor deus te guardara de todo mal sempre  ",0.295918375253677
"pt","29937","biritiba mirim sp esta com vc",0.531796813011169
"pt","26934","nao sou filiado a nenhum partido  mas nesse estarei dentro  lutaremos juntos por um brasil melhor  mesmo estando no exterior  farei minha parte com muita honra  orgulho de voce  meu presidente ",0.800193130970001
"pt","76081","o senhor e contigo presidente  portanto  nada  nada escapa do controle de deus   forca e que tenha pronto restabelecimento  deus acima de tudo ",0.772940993309021
"pt","76080","parabens continuemos orando para seu retorno completamente   tmj presidente jair bolsonaro abencoado   animados pela fe avante ",0.756812274456024
"pt","75979","muito obrigada deus por uma recuperacao tao rapida e termos o melhor e mais saudavel presidente  ",1
"pt","55367","nao larga mais o manto sagrado",0.380661964416504
"pt","75982","e isso mesmo    se for por oracoes  vc  vai voverais uns 500 anos  meu presidente   ao sobreviver ao atentado  ficou claro que deus operou um milagre     e deus nao para milagres pela metade  avante presidente  avante brasil",0.529517948627472
"pt","30866","pra onde for  estou junto ",0.533445060253143
"pt","26543","presidente amado  por onde vc for  estaremos apoiando e lutando  pelo seu sucesso e sonhos realizados    estamos mega felizes com as perspectivas de um brasil muito grande  gratidao sempre    ",0.844827592372894
"pt","29978","forca presidente minas gerais esta contigo    ",0.563348412513733
"pt","7133","olha essa primeira dama minha gente ",0.540797710418701
"pt","102420","o presidente do povo   ",0.441099405288696
"pt","54982","por que tu diz que e sua residencia ate 2022  todos sabemos que e ate 2026 o cabecao ",0.440461397171021
"pt","59","sentimos paz com um presidente que ama a deus   e que tem uma esposa que tambem ama a deus ",1
"pt","184","e amanha presidente veras que um bolsonariano nao foge a luta dia 26 o brasil mostrara novamente o quanto te ama ",0.371403336524963
"pt","79","parabens que deus proteja vc e sua familia  elegancia total e top",0.720298767089844
"pt","135","muitas felicidades jair e michele  longa vida a este casal  viva portugal  viva o brasil",1
"pt","25992","como faz pra abrir um diretorio aqui em americana sp  eu votei em jair messias bolsonaro nao em partido  onde jair messias bolsonaro for eu to junto ",0.197840958833694
"pt","76071","bom almoco capitao  continuamos em oracao pelo restabelecimento total de sua saude  deus o proteja   sempre ",1
"pt","76518","para meditacao do nosso presidente salmos 91 verso 7 mil cairao ao teu lado e dez mil a tua direita e nao seras atingido glorias  a deus te amamos e oramos pelo senhor e sua linda familia",0.718521654605865
"pt","75994","nosso capitao presidente vai  se sair bem paraquedistas sao muito fortes fisicamente ",0.715752065181732
"pt","25496","estamos juntos presidente  pode contar com o alianca pelo brasil de parnamirim rn ",0.622693359851837
"pt","29943","quero me filiar  como devo agir    ",0.416279017925262
"pt","75973","isso mesmo presidente se alimenta bem  limpa o prato  fica bem forte  porque coragem nos ja sabemos que o sr tem de sobra deus no comando ",0.884615361690521
"pt","75974","amamos muito o senhor e rezamos por sua recuperacao  deus lhe abencoe todos os dias  ",0.383955091238022
"pt","25533","espero que as assinaturas sejam online  mas  se nao for  recolheremos assinaturas no papel com prazer aqui em mt ",0.735797047615051
"pt","45755","conte conosco  presidente  a sua coragem e determinacao sao a nossa forca  ",0.762669563293457
"pt","101169","faca um decreto para o neymar nao poder ser mais convocado por favor  nunca te pedi nada bonoro ",0.147705495357513
"pt","61","elegantes   que seu filho seja feliz e faca feliz a pessoa com quem ira compartilhar a vida  ",1
"pt","55279","orgulho de ter um presidente patriota",0.568190634250641
"pt","76065","a uniao faz a forca  presidente e ninguem vai nos ganhar essa batalha  forca ai que estamos lhe esperando para mudar o nosso pais como ele merece  ",0.472827315330505
"pt","76060","somos todos bolsonaro    forca presidente   o universo conspira a seu favor    ",0.690069198608398
"pt","28325","faca a limpa  preciso fazer a mesma coisa no meu facebook",0.213663518428802
"pt","31381","vou me filiar aqui em dourados ms ab  estamos juntos presidente jair messias bolsonaro",0.51172262430191
"pt","47038","queria muito que  santo andre  a minha cidade tivesse a representacao desse partido",0.148720145225525
"pt","76005","querido presidente em minha casa toda minha familia ora pela sua total recuperacao",0.516618192195892
"pt","27009","parabens presidente    o brasil precisava mesmo de um partido limpo de direita  que nossa senhora abencoe a alianca pelo brasil   amei o nome  sucesso pra nos  me aguarde serei filiada ",0.833333313465118
"pt","45167","estaremos juntos presidente  brasil acima de tudo e deus acima de todos ",0.825781166553497
"pt","76087","caminho junto desde antes da sua candidatura a presidencia   trabalhei  de graca na sua campanha  dei meu voto   consegui mais alguns   tou junto e misturado    pela minha familia   pelo bem comum  pelo brasil ",0.643171310424805
"pt","29643","#bolsonaro2022 ",0.5
"pt","75968","presidente so por ter nos devolvido o patriotismo adormecido meu voto ja teria valido a pena  fico felicissima ao ve lo cada dia melhor  avante presidente querido  deus esta contigo  ",0.814055263996124
"pt","75969","boa tarde  sr  presidente  saude  nesse momento  e o mais importante    o brasil  em sua grande maioria  esta torcendo pela sua recuperacao  ignore o povo que nao faz parte dessa corrente    tenha um otimo sabado ",0.776402771472931
"pt","102303","dilma   7x1  temer   gol do fernandinho  bolsomito   ",0.776517868041992
"pt","65","parabens presidente jair bolsonaro e familia  que as bencaos e a sabedoria de jesus estejam sobre as suas vidas ",0.797786593437195
"pt","57081","eu e meu pai com 83 foi mascarado na paulista e fez mo sucesso kkkk foi as ruas para votar no melhor presidente do brasil  ele e super fa  do bolsonaro  brigou com o bairro inteiro kkkkkk",0.77027028799057
"pt","98","lindo casal que jesus os abencoe para sempre ",1
"pt","7214","ifelicidades ao casal  e  a toda familia bolsonaro    ",0.388895332813263
"pt","30839","nunca fui filiado a partido algum mas nesse novo partido faco questao de me filiar",0.360886484384537
"pt","45789","pela primeira vez tenho vontade de me filiar a um partido   deus abencoe essa nova jornada   brasil agradece presidente  ",0.583995223045349
"pt","29778","sugestao pro numero do novo partido  o numero 57 em memoria dos mais de 57 milhoes de votos pra presidente   ",0.545790314674377
"pt","76459","eu e minha familia estamos sempre em oracao pelo sr e pelo brasil    deus te guarde presidente bolsonaro  ",0.519755661487579
"pt","47220","presidente saiba de uma coisa  vc esta saindo de cabeca erguida  pois sai mas forte  o brasil acordou e confia no seu trabalho  #aliancapelobrasil #bolsonaropresidente #bolsonaro2022",0.560550451278687
"pt","30846","parabens presidente   manda as fichas  ",0.538513660430908
"pt","25845","isso e exemplo de presidente  se o lula sempre falou q nao sabia de nada porq nao saiu do pt e formou seu partido so com gente honesta isso prova quem tem carater e quer o melhor pelo nosso pais parabens capitao eu ja tinha me filiado no psl mais ja estou saindo e estarei pronto para a nova missao ",0.666666686534882
"pt","76451","que bom ver o senhor com o semblante sereno e corado     ninguem vence os justos forca presidente porque nos aqui estamos mais fortes que palanque de banhado    ",0.738014996051788
"pt","76416","gracas a deus esta bem meu querido presidente amapa orando por vc",0.936869740486145
"pt","33695","seguiremos contigo  nos votamos em voce e nao no partido ",0.408363401889801
"pt","76396","esteja tranquilo  estamos rezando por sua melhora  aguardando ansiosa a sua volta  mas gozando de plena saude  bom fim de semana presidente querido   ",0.93478262424469
"pt","7991","sentido ",0.5
"pt","76402","bom fim de semana capitao do brasil  deus lhe abencoe ricamente ",0.914276659488678
"pt","26028","melhor coisa que o presidente fez  quero ver a cara de quem se achava dono do psl nas pequenas cidades  principalmente aqui na regiao de campinas    ",0.82202821969986
"pt","45849","estamos juntos   moro em porto velho  estou a disposicao para trabalhar em prol do nosso pais  que deus abencoe  sua vida presidente e lhe muita saude e sabedoria ",0.574846208095551
"pt","29122","ah meu presidente    deus e contigo e nos estamos torcendo para tudo dar certo  feliz  e a nacao cujo deus  e o senhor",0.93478262424469
"pt","76602","muito bom ver q o nosso presidente esta melhorando louvado seja o nome do senhor jesus",1
"pt","50756","as criancas sentem quem e puro de coracao pra atender um gesto tao simples e que muitos nem dariam a menor atencao  deus te abencoe presidente #b17",0.6258385181427
"pt","50770","eu nao deveria me surpreender mas me surpreendo com o presidente bolsonaro ",0.549306869506836
"pt","120","presidente  confio em voce  nao decepcione aqueles que lutaram e lutam por um pais melhor  nao cometa erros bobos e nem graves  separe a familia da sua obrigacao  e vamos em frente em combate a corrupcao e crescimento  voce tem a faca e o queijo para ser o presidente da historia do pais  nao deixe os vermelhos voltarem  faca um governo que todos que votaram no senhor espere  deus esteja com voce ",0.498548120260239
"pt","25745","pronto capitao ",0.540127575397491
"pt","44293","feliz dos eleitores que tem vc como politico e nao depende de fundo partidario  ",0.77615225315094
"pt","81050","que bom que esta melhor presidente   gracas a deus  o brasil precisa do senhor ",1
"pt","76421","orei e continuarei orando pela sua pronta recuperacao  presidente    o senhor precisa estar bem e forte para colocar ordem na casa    volta logo  deus lhe abencoe",0.747721791267395
"pt","76423","deus esta presente e nada pode contra sua vontade  nosso presidente tem a sua volta e sobre si  o manto de protecao dos escolhidos do senhor  que e o senhor da luz do amor e do poder  jesus ensinou tudo que precisamos para a vitoria  ",0.503834784030914
"pt","76435","nossas oracoes sao ouvidas nos mais longinquos rincoes das moradas do senhor  bolsonaro    forca ai que o pior ja passou   ",0.00421535968780518
"pt","76597","nao e a toa que deus esta te mantendo vivo  o sr  tem uma nacao pra governar  chegou o momento de cumprir sua missao  que seja amparado pela espiritualidade maior  e que nao desista do seu povo ",0.396698921918869
"pt","76506","minhas mensagens talvez nao chegue ate sua leitura mas peco a deus que o cure rapido e minhas oracoes cheguem ao ceu ",0.536535322666168
"pt","32023","aguardando a instalacao do partido aqui em joinville para minha filiacao ",0.46720290184021
"pt","29004","brasi acima de tudo deus acima de todos   #euapoiosergiomoro #euapoioalavajato #euconfionobolsonaro",0.772346258163452
"pt","76574","boa tarde presidente  eu sou pr israel pedrosa de nova iguacu  a vossa excelencia esta debaixo da protecao de deus porque  o senhor esta ao lado de israel e quem e amigo de israel e  tem a protecao de deus quem e contra israel e contra deus  estamos orando por vossa elegancia",0.595494389533997
"pt","106","deus  abencoe  vcs presidente   bem como vassos  familiares  ",0.762842893600464
"pt","107","felicidades    este casal representa todos os brasileiros do bem  que o nosso deus os abencoe com saude  sabedoria  forca e temor ao pai celeste",0.916666686534882
"pt","32142","parabens presidente bolsonaro   ja  somos  73 milhoes de brasileiros honestos apoiando seu governo",0.584102749824524
"pt","7992","todos la ",0.5
"pt","47955","o pt tem 2 1 milhoes de afiliados   vamos afiliar 57 milhoes",0.657270014286041
"pt","32141","onde assino ",0.5
"pt","50844","jesus esse homem nao existe  meu filho joao vitor de 7 anos  vive me pedindo  mae a gente pode ir visitar o bolsonaro  dai sempre explico que nao da  que ele e muito ocupado tem muitos compromissos  se ele sonha ",0.437089771032333
"pt","25821","sabia que aconteceria  por isso nao me filiei na epoca ao psl  agora vamos com o apb",0.59886646270752
"pt","47329","parabens presidente   deus esteja conosco   abencoe sempre   estamos com voce   ",0.605238914489746
"pt","28999","queria tbm poder anunciar minha saida de alguma coisa     #paidegua",0.153907775878906
"pt","25830","vou dar uma ideia senhor presidente  em vez de criar mais um partido politico  faca uma reforma politica e diminua para somente 5 partidos  e libere as candidaturas avulsas ",0.533474564552307
