"language","id","text","resultado"
"pt","50596","nunca em toda minha vida conheci um presidente tao humilde quanto o senhor  tenho 17 anos e 2018 foi meu primeiro voto para presidente  e nunca me senti tao orgulhoso  presidente  vc e o cara   ",0.508195877075195
"pt","75709","ao sair descubra quem mandou mata lo  nao e vinganca  e justica  e o brasil espera por isso  continuo em oracao pelo seu restabelecimento ",0.448849081993103
"pt","82639","senhor presidente jair bolsonaro   transforme os hospitais federais em hospitais de excelencia igual ao hospital albert einstein   os brasileiros e as brasileiras merecem qualidades nos atendimentos medicos  farmaceuticos e tudo mais que e oferecido no hospital albert einstein ",0.321233719587326
"pt","75685","nao vejo a hora de ver nosso presidente comendo aquele churrasco   ",0.701620221138
"pt","75708","o teu sofrimento nao sera em vao    nos seremos eternamente gratos pelo seu calvario por nos e pelo brasil",0.134057730436325
"pt","25427","presidente assim que estiver formado o partido em todos os estados eu e meu esposo iremos nos filiar  nunca fomos filiados a nenhum partido mas estamos de maos dadas contigo  deus lhe abencoe   ",0.298369199037552
"pt","50615","amanha vai ser noticia presidente bolsonaro sequestrou criancas e fez churrasquinho delas ",0.513644456863403
"pt","50607","voce e demais bolsonaro  eu como professora de educacao infantil fico muito feliz que tenha amor pelas nossas criancas ",1
"pt","50601","bolsonaroooo minha familia nao fala mas comigo porque votei no senhor   17 votarei de novo em 2022 que orgulho do senhor presidente",0.303437292575836
"pt","50617","pesquisa rapida   satisfeito  votaria novamente  insatisfeito",0.514253318309784
"pt","25415","continuaremos ao seu lado sempre   presidente ",0.537270486354828
"pt","50619","tenho 37 anos de idade e ate hoje em todos esses anos de vida que deus tem mim concedido nunca vir na estoria do brasil um presidente honesto de carater simples com tanta humildade igual temos visto ja durante esses cinco meses  analisando tudo isso vejo com todo conviccao que nunca em toda minha vida votei tao certo  sem duvida meu voto e meu esforco nas minhas redes sociais em apoio a esse grande homem meu presidente tem valido muito apena  sem duvida vc nos representa ",0.616279065608978
"pt","10","sua formatura de espadim 1977 capitao reliquia hein   rsrs",0.744506001472473
"pt","75707","forca presidente  o brasil esta contigo ",0.57597827911377
"pt","25426","alguem sabe o horario do sepultamento do psl ",0.480779200792313
"pt","50600","oooo lula posso ir na sua casa     nao companherinho la e muito apertado  nem o sol da para ver nascer kkkkk pega a visao ai vitor hugo",0.203786104917526
"pt","75703","saude presidente   confiamos no seu trabalho   deus acima de tudo",0.897028088569641
"pt","75705","forca capitao e presidente  o brasil precisa de vc   deus o abencoe ",0.567984700202942
"pt","75700","meu presidente e honesto e honrado  o melhor presidente que o brasil tera  firme e forte  deus acima de tudo   ",1
"pt","50616","correcao  residencia bolsonaro ate 2026  no minimo ",0.5
"pt","25433","por um brasil melhor  estamos juntos  boa sorte e que deus nos abencoe ",1
"pt","25434","o senhor estava precisado experimentar novos ares   agora escolha com sabedoria aqueles que estarao ao seu lado nessa nova caminhada ",0.915801227092743
"pt","44123","amamooooos voce  pr   3",0.510645151138306
"pt","17","casal lindo    conquistou a todos nos  presidente o sr e tudo de bom   mas a sua esposa domina nossa apreciacao   e meiga e especial e divina e abencoada   parabens a ambos",0.822580635547638
"pt","25452","estamos juntos pelo brasil ",0.503565728664398
"pt","25437","parabens presidente  estou junto onde o senhor estiver ",0.569259345531464
"pt","75697","nao tenho duvidas que ira transformar o brasil em algo jamais visto para o melhor e claro ",0.878900468349457
"pt","50613","ah eu amo meu presidente  ainda vou ver ele pessoalmente e tirar uma foto para mostrar aos meus netos e bisnetos que um dia o brasil teve um presidente honesto  humilde e abencoado por deus  ",0.785714268684387
"pt","101135","boa noite  obrigada por ser uma pessoa simples e de bom coracao ",1
"pt","101139","boa noite  e uma semana abencoada para o senhor e familia  meu amado presidente  ",1
"pt","25432","vamos nessa presidente  se foi deus que respondeu as suas oracoes  tudo bem  iremos juntos para que possamos ter um brasil bem melhor e mais justo ",0.884615361690521
"pt","25444","continua com nosso apoio ",0.840140819549561
"pt","75691","com deus no comando de tudo em sua vida  nada e ninguem o impedira de ser o melhor presidente do brasil  que deus pai  deus filho  deus  espirito santo na sa aparecida e todos os anjos e arcanjos celestiais de deus acampam sobre ti e em todos seus familiares   amem  amem  amem  ",0.692307710647583
"pt","9","eduardo cansou de ser feliz e resolveu ser mais feliz ainda                     jair bolsonaro",1
"pt","50610","me surpreendo cada dia mais com o nosso presidente   deus abencoe nosso presidente  deus abencoe nosso brasil ",0.575372338294983
"pt","43","folha de sao paulo  bolsonaro em vez de trabalhar pelo pais  fica indo a casamentos regados de luxuria  so as  langostas  foram mais de 400 mil reais  dizem especialistas  pessoal e uma piada que eu fiz  todos sabemos que a folha e contra o bolsonaro  sou bolsonaro ",0.450503140687943
"pt","101115","dilma 2014  alemanha 7 x 1 brasil temer 2018  gol contra de fernandinho bolsonaro 2019 ",0.707982540130615
"pt","25413","estamos juntos    boa sorte  faca o melhor pelo brasil que tera sempre o nosso apoio ",1
"pt","25424","parabens presidente por reconhecer os que lhes ajudou ate aqui  gratidao e uma chave muito importante pras nossas vitorias  independente do tomada de rumo dos demais  os respeite e bola pra frente ",0.79639732837677
"pt","25448","estou contigo  meu presidente  abri mao de todas as funcoes que eu exercia no psl para te acompanhar    brasil acima de tudo  deus acima de todos   ",0.655567705631256
"pt","101116","a tranquilidade de entregar a taca na mao do presidente e saber que ele nao vai rouba la e nem encher de cachaca     ",0.302949488162994
"pt","25423","a sabedoria de deus o conduziu na melhor decisao ",1
"pt","50597","parabens meu presidente  um dia essa nacao toda ira se orgulhar de ti  assim como eu ja me orgulho  deus nos abencoe ",0.55984365940094
"pt","25430","parabens pela sabia decisao   aonde assino para a criacao do nosso partido   ",0.591087698936462
"pt","25425","presidente  que deus abencoe essa nova lideranca   que ismael  o anjo protetor das terras brasileiras  esteja a proteger e intuir para o bom caminho  de prosperidade  fraternidade e progresso do brasil e de todos nos ",0.785714268684387
"pt","25440","so falta o numero",0.211744368076324
"pt","25471","ameiiiii nome divino ",0.813496887683868
"pt","25460","tmj ",0.531063079833984
"pt","26552","eu sugiro que o nome do partido seja   brasil acima de tudo  deus acima de todos ",0.6951744556427
"pt","25442","parabenizo a iniciativa   novo partido  novo tempo  novos politicos para a eleicao 2020   esperamos candidatos condizentes as proximas eleicoes  torcemos pelo brasil e a mudanca radical deve comecar pelos municipios  com politicos serios e trabalhadores ",0.48161593079567
"pt","101157","essa foto vai ficar na historia  e uma honra ve o tite se curvando para o nosso querido presidente bolsonaro  kkkkkkkkk ",0.976190447807312
"pt","20","muitas felicidades aos noivos e que deus os abencoe ricamente  e parabens presidente jair bolsonaro pela bela familia",0.907112598419189
"pt","50658","jair messias bolsonaro obrigado por fazer parte da historia do nosso brasil   hoje tenho orgulho de dizer aos meus filhos que podemos voltar a sonhar em um futuro com dignidade e respeito pela familia   #parabenscapitao #2022enoisnovamente ",0.756410241127014
"pt","25446","estamos com bolsonaro     nao tem como atingir objetivos diferentes fazendo a mesma coisa sempre  temos que acredita na mudanca e acredita em nos mesmo    pois foi a maioria que elegeu a bolsonaro  sendo assim  devemos esta com ele nas empreitadas  e a nossa fiscalizacao do proprio bolsonaro faremos nas urnas  se ele continua com o bom trabalho que esta fazendo concerteza tera nosso voto de novo   ",0.562833845615387
"pt","25946","agora sim  um partido a altura do presida  ja nascendo gigante parabens aos integrantes   #aliancapelobrasil ",0.963131785392761
"pt","25414","vou me filiar pela primeira fez em um partido onde for eu e meus filhos tbm irao ",0.597099781036377
"pt","25419","deus mostrou um novo caminho  um novo rumo   conhecereis a verdade e a verdade vos libertara joao 23  somos unidos e estaremos unidos por um brasil mais justo para todos  serei filiada eu e minha familia  com amor e determinacao  parabens sr  presidente deus o abencoe sempre ",0.71276593208313
"pt","101137","nem nos meus melhores sonhos imaginei que o brasil  teria um um presidente de verdade  que ama o brasil ama estar pertinho dos brasileiros e que esta elevando o nosso brasil  ao topo obrigado por existir  orgulho  imagem perfeita ",0.756410241127014
"pt","101121","dilma  7x1 temer  gol contra do fernandinho bolsonaro  campeao ",0.776517868041992
"pt","50594","me emocionei muito que coisa linda  deus abencoe a ti e a toda sua familia senhor presidente bolsonaro e essa equipe que trabalha o tempo todo com o senhor fiquei mais feliz em ver que es mesmo um ungido  ",0.756410241127014
"pt","25443","estou no espirito santo  em cariacica  o que posso fazer para ajudar a se aliar a alianca pelo brasil  estou no aguardo ",0.734319806098938
"pt","1016","nordeste se levanta em apoio a governo jair bolsonaro  lindos  deus abencoe sempre  tamos juntos ",1
"pt","25421","agora o psl ja era  ja que foi o senhor que carregou o partido inteiro nas costas ",0.419711530208588
"pt","75688","deus no controle       amem louvado seja deus vai da tudo certo",0.812268495559692
"pt","33","lindos  felicidades ao edu  futuro presidente do brasil em 2026 ",1
"pt","101127","a maior virtude de um homem e saber ser humilde quando tudo conspira para arrogancia    parabens continue assim  ",1
"pt","101122","obrigado moca  se nao fosse voce nada disso teria acontecido  muito obrigado  te espero na copa ",0.653043746948242
"pt","101129","que show meu presidente  nao ligue para os recalcados  parabens  sua atitude e linda  estamos juntossss",0.89276659488678
"pt","50608","esse e o presidente que o brasil precisava   que humildade     deus lhe abencoe ",0.571623861789703
"pt","25557","mostra tua forca brasil pelas nossas criancas ",0.544982433319092
"pt","25436","excelente chance de fazer um partido digno   assino para a criacao do partido e posterior filiacao no primeiro dia  ",1
"pt","101123","foi sensacional  presidente   exceto a falta de educacao do tecnico tite   o senhor tem de sobra  o que faltou nele  parabens ",0.310379147529602
"pt","50606","deus abencoe grandemente o nosso brasil e nosso  presidente e seus ajudantes",0.618028402328491
"pt","18","lindo casal mas que a bencao de deus seja mais linda sobre voces e a familia ",1
"pt","75711","nosso presidente mito estamos rezando direto pelo sr e pra que maria passe na frente e jesus medico dos medicos opera junto aos medicos vai sair logo do hospital  amanha eu vou deixar um agradecimento pela sua vida na aparecida do norte capitao  ta ",0.332999259233475
"pt","75689","melhoras capitao  sim  a cara do brasil esta mudando a olhos nus  seguimos na vigilia ",0.531632363796234
"pt","101134","grande presidente    amei te ver parecia  crianca kkkk obrigada por tudo    mito  vc merece    ",1
"pt","40186","o presidente bolsonaro esta dando o maior exemplo de honestidade ja visto na historia da politica brasileira ao abrir mao de quase r 400 milhoes de fundo partidario do psl para fundar um novo partido  ele mostrou mais uma vez ser um politico diferenciado  dando um tapa na cara da oposicao ",0.685030996799469
"pt","50621","aiiiii que criancas lindas  parabens pela atitude e humildade nosso querido presidente  que deus o abencoe e proteja sempre ",0.921716213226318
"pt","19","parabens a familia  casal lindo o nosso presidente e esposa ",1
"pt","75712","com certeza o teremos logo logo conosco dando entrevistas dos feitos em favor do nosso brasil e seu povo fique na certeza do amor de deus para com vc nosso presidente querido  saude   ",0.80303031206131
"pt","50598","voce e o cara me representa sem duvidas alguma deus sempre lhe abencoe ",0.440148651599884
"pt","11","lindo o nosso casal presidencial  felicidades aos noivos  ",1
"pt","75714","come bastante caldo e gelatina pra sarar logo     as pessoas do bem te esperam  o brasil precisa de voce    ",0.929175615310669
"pt","50604","parabens mais uma vez por sua simpatia excelencia se o senhor continuar assim sera nosso presidente ate 2060 pois nos precisamos de pessoas com seu carisma e seu amor para com essa nacao    ",0.80303031206131
"pt","14","parabens presidente pelo o casamento de seu filho  deus abencoe o casal ",0.730479598045349
"pt","25453","desejo que nao exista divergencia no seu partido caro presidente   que aqueles que estejam ao seu redor sejam politicos de bem   com um enorme nivel patriotico e moral   que queiram o brasil acima dos interesses pessoais",0.692916989326477
"pt","50612","parabens capitao   e essas suas qualidades que nos faz acreditar num brasil melhor    deus acima de tudo ",0.963544607162476
"pt","16","lindos    meu presidente  desejo toda  felicidade  do mundo para o casal    deus os abencoe   ",1
"pt","31379","primeira vez que irei me filiar a um partido   tmj  presidente  ",0.590043365955353
"pt","50623","esse e nosso presidente   cabo frio tem orgulho do senhor",0.624421000480652
"pt","101125","primeira final de futebol que eu assisto em que os dois maiores idolos do pais estao fora de campo  jair bolsonaro e sergio moro",0.501363098621368
"pt","75713","forca presidente o brasileiro de bem esta do seu lado  avante brasil ",0.888802707195282
"pt","75687","aqui em nazare  na galileia     na basilica da anunciacao estamos rezando pelo nosso presidente     e o esperamos aqui em breve ",0.739237189292908
"pt","25418","votei no sr pela trajetoria e pela esperanca de um pais melhor  ninguem confia em partido  votamos nas pessoas ",0.697396636009216
"pt","50665","e isso ai presidente alem de ser um otimo presidente mostrou seu lado humano   parabens  capitao  e nao esmoreca  estamos juntos ",0.615293502807617
"pt","50627","eita pega q esse cara me surpreendi  q deus seja seu guia   admiro a humildade ",0.536325216293335
"pt","50624","diferenciado nosso presidente  parabens pela atitude ",0.599866628646851
"pt","13","parabens presidente   pelo casamento de seu filho  muitas bencaos e felicidades aos recem casados ",0.893388152122498
"pt","101170","parabens pela humildade dos dois vida que segue  ficamos felizes com o titulo mas precisamos de ajuda nos bairros e comunidades  tipo rua com asfalto  iluminacao  esgoto o basico  abraco",0.733223497867584
"pt","25473","deus  obrigado por bota esse cara na presidencia   lutei muito por isso e o senhor atendeu minhas oracaos",0.812352538108826
"pt","15","felicidades que deus abencoe seu governo lhe dando sabedoria e discernimento  e lhe de livramentos de todos os males entregue seu trabalho nas maos de deus    ",0.884615361690521
"pt","75690","bom final de semana  meu presidente  que deus o abencoe ",0.941510558128357
"pt","44300","eu nunca me filiar a algum partido mas pela primeira vez na minha vida pelo amor ao brasil vou me filiar alianca pelo brasil",0.284672170877457
"pt","101165","bolsonaro no estadio  lula preso  neymar fora da selecao e o brasil campeao  grande dia ",0.651529848575592
"pt","101145","boa noite meu presidente  o melhor presidente da historia brasileira ",1
"pt","25456","e isso ai  estamos juntos e unidos  nao vamos soltar a sua mao presidente",0.183006078004837
"pt","50593","eu tambem quero presidente kkkkk parabens meu presidente     que deus continue lhe tanto muita protecao e sabedoria para conduzir o nosso querido e amado  brasil  cada dia mais orgulho do meu voto  capitao  ",0.80303031206131
"pt","50622","que coisa mais linda   amando capitao vc cada dia   deus te abencoe  ",1
"pt","32","que deus abencoe essa familia  que vcs sejam exemplos para esse pais  oro por isso ",0.544362723827362
"pt","101141","boa noite presidente bolsonaro    deus te abencoe e proteja sempre ",0.8148233294487
"pt","50628","um gesto de humildade e amor pelo futuro do nosso pais  #bolsonaro2022",0.854228377342224
"pt","25477","eu vou para onde meu presidente for estarei ao seu lado mesmo de longue torcendo pelo senhor e pelo brasil",0.61313658952713
"pt","37","parabens a toda familia  bolsonaro presidente  que deus abencoe vcs",0.528229892253876
"pt","101143","boa noite presidente que voce e familia tenha um excelente inicio de semana sempre com deus no comando abraco ",1
"pt","101138","eu amo o meu pais  a minha selecao e o meu presidente  bolsonaro  o senhor e um homem fora de serie  eu te admiro muito  avante brasil ",0.474550127983093
"pt","75718","amem deus e por nos    forte abraco presidente e continuamos nossas oracoes para o senhor e para nosso brasil  hoje o senhor se tornou um exemplo de superacao ",0.730593144893646
"pt","25454","estamos todos unidos presidente  veras que um filho teu nao foge a luta  esta no nosso hino nacional nao e  entao vamos honrar essa nacao  e fazer um brasil gigante  para que o mundo veja nossa soberania ",0.616692304611206
"pt","27098","gracas a deus  presidente  estarei nesse novo partido",0.739102482795715
"pt","50630","meu presidente  so deus sabe o bem q fez a essas criancas e como elas lembraram disse pra sempre  ",0.768927156925201
"pt","101142","nosso maior titulo e ter voce como nosso presidente e capitao bolsonaro ",0.516150653362274
"pt","21","parabens familia bolsonaro   felicidades aos noivos ",0.810628294944763
"pt","75719","shabat shalom  longa vida presidente  e volta logo  nao estamos aguentando  olhe pela classe media  faca uma linha de credito para aqueles que foram lesados pela crise proposital criada pela esquerda  pequenos e micro empresarios  por favor  queremos produzir ",0.243589743971825
"pt","46","parabens e felicidades pra familia   que venham um monte de netinhos     ",0.865052819252014
"pt","75692","deus e poderoso   mais uns dias e o senhor estara comendo pao com leite condensado  ",0.692923426628113
"pt","25480","parabens presidente    vamos apoia lo sempre  e se precisar de 500 mil assinaturas  vamos dobrar a meta  conte comigo ",0.891092658042908
"pt","25483","primeiro partido que irei me filiar  #aliancapelobrasil",0.524500489234924
"pt","25459","como posso filiar a nossa alianca pelo brasil ",0.511364758014679
"pt","26","deus abencoe e proteja tds vcs   parabens pelo casorio do filhao    ",0.587228715419769
"pt","101147","boa noite presidente     e campeao    presidente bolsonaro  os soldados especialistas da fab cesd  agradecem por tudo  rumo a reintegracao  com o seu apoio estamos voltando para um lugar que nunca deveriamos ter saido  fab  obrigado presidente turmas 94 a 01  brasil acima de tudo  deus acima de todos ",0.708333313465118
"pt","25462","somos a alianca ",0.508799195289612
"pt","25416","bolsonaro  quando que vai comecar o partido  nunca me filie a nenhum  pois nunca tive interesse por politica  me interessei nos ultimos 3 anos quando voce comecou a divulgar seu trabalho e assim eu acreditei que ali estava pra surgir um novo brasil  entrei junto na batalha  sendo um formador de opiniao e divulgando ao maximo o seu trabalho  desde entao tenho me esforcado para fazer a minha parte para um brasil melhor  atualmente estou morando nos eua legalmente  porem um dia retornarei para o meu pais que tanto amo  quero ser o primeiro a se alistar no partido alianca pelo brasil  abracos ",0.436972349882126
"pt","50632","que presidente ja fez isso     atendendo pedido dessas inocencias rs",0.723996579647064
"pt","25479","parabens presidente  sua posicao mediante ao psl e de extrema importancia ",0.687348186969757
"pt","50629","exemplo de humildade  esse e meu presidente  bolsonaro 2022",0.532267808914185
"pt","50631","nao tem boca vai ser o melhor presidente que o brasil ja teve pode ter certeza",0.930495917797089
"pt","25458","estamos juntos presidente  com muito orgulho  estaremos juntos em qual for o partido  por um brasil melhor  honesto e digno do tamanho que ele e ",0.899999976158142
"pt","25467","sou seu soldado capitao ",0.565937459468842
"pt","50609","parabens meu presidente  cada dia me surpreendo mais com sua humildade    ",0.657052755355835
"pt","75723","forca senhor presidente bom almoco que o senhor o abencoe e o recupere rapidamente   forte abraco ",0.917702674865723
"pt","75722","que bom ve lo almocando presidente bolsonaro  nao esqueca o senhor e blindado por deus  escolhido por deus para uma grande obra nesta nacao  um novo tempo sobre o brasil  obs  em breve um churrasco ne rsrs  deus o abencoe",0.75
"pt","50636","que linda atitude  por ser o  presidente do nosso brasil  nunca vi isto antes ",0.733851671218872
"pt","75728","eu creio em deus que vossa excelencia  saira mais forte desse hospital do que quando entrou  e seu destino governar e recuperar a nossa nacao ",0.345018416643143
"pt","101126","tite nao te cumprimentou com educacao    morreu pra mim    parabens ao senhor  pela educacao e respeito   ",0.294315189123154
"pt","75717","estou profundamente feliz por acompanhar a evolucao positiva do seu quadro de saude  sabia que nao seria diferente   voce tem meritos para superar os obstaculos no caminho tortuoso que percorreu  apos o fatidico atentado contra a sua vida   sua capacidade de resiliencia e sua fe sao extraordinarias   combater o bom combate   assim como o preconizou sao paulo  e a sua meta  e a sua missao  e esta a cumpri la  dando nos exemplos diarios de sua coragem e perseveranca  pronta recuperacao  presidente   estamos a orar e emanar energias de luz ",0.611111104488373
"pt","118","parabens   muitas felicidades e bencaos de deus para toda a familia bolsonaro   ",0.811144590377808
"pt","44","parabens   deus ilumine sua familia  sr  presidente ",0.584105849266052
"pt","41","parabens presidente  pelo casamento de seu filho  que deus abencoe o casal ",0.717849731445312
"pt","50602","boa noite capitao  poderia criar um decreto obrigando todo mundo trabalhar so depois do almoco  acordar cedo e complicado  um forte abraco",0.118233874440193
"pt","75720","boa tarde presidente sr jair messias bolsonaro       deus esta no comando de tudo e precisamos do senhor na direcao    forca capitao   o brasil esta com vc de ponta a ponta    ja deu tudo certo    ",0.780533194541931
"pt","75738","forca capitao deus e contigo te queremos com muita saude para lutar pelo nosso brasil ",0.887674808502197
"pt","75729","boa meu presidente   se recupere e volte com sangue nos olhos    ",0.672482132911682
"pt","75725","que em breve o senhor esteja liderando essa nacao rumo a grandes mudancas e prosperidade     deus te abencoe presidente    ",1
"pt","25457","agora so a nata do respeito ao brasil e  sem nem um envolvidos em corrupcao  o brasil estara sempre em sua direcao  parabens pela mudanca",0.4986432492733
"pt","75702","somos a maioria no brasil pela sua recuperacao  a minoria deixamos pra la  conte com nossas oracoes em todas as situacoes  q deus abencoe   presidente ",0.572324872016907
"pt","106541","",NA
"pt","75730","a midia ignora o poder das oracoes do povo    ela nao sabe o poder que tem deus  ele vai te fazer forte capitao  deus vai te curar  para cuidar do povo do brasil ",0.450635343790054
"pt","39","parabens deus abencoe  a familiares do presidente bolsonaro",0.551373243331909
"pt","101149","boa noite sr  presidente    vossa ilustre presenca nos jogos  e a incansavel luta  da selecao resumiu se  nesse belo trofeu   ",1
"pt","45","parabens  estao lindos e muita felicidade aos noivos e familiares  deus os abencoe infinitamente ",1
"pt","75744","que deus lhe conceda mais essa vitoria    tudo na vida tem um proposito e permissao de deus    se deus permitiu pq sabia que o sr e forte e tiraria de letra essa prova    estamos intercedendo pela sua vida    creio eu que o sr saira mais forte e mais resistente dessa prova    uma otima recuperacao para o senhor    o povo de bem lhe ama    o brasil conta contigo   ",0.649253726005554
"pt","42","felicidades ao casal que deus abencoe essa familia linda ",1
"pt","101146","eu seria a primeira a comentar  mas a emocao foi tanta que fiquei sem palavras  e agora ja devo ser a centesima  por questoes de segundos  kkkkkk",0.464308351278305
"pt","75726","sua saude em primeiro lugar presidente     com certeza as coisas serao resolvidas e nosso gigante adormecido    o nosso brasil ficara no lugar que nunca deveria ter saido     e voce presidente desfrutara do tao sonhado e saudoso pao com leite condensado     lembra se   kkklkjkkk",0.732558131217957
"pt","101151","boa noite presidente  uma abencoada semana no governo e no brasil  ",0.785451292991638
"pt","50634","esse e o nosso presidente      melhor atitude   nunca vi igual      parabens jair bolsonaro  ",0.845057129859924
"pt","75743","grande  corajoso e altivo presidente jair bolsonaro  que deus lhe de sempre muita saude  forca e protecao  estamos todos em pensamento e vibracao justos torcendo  para seu rapido e total restabelecimento  brasil acima de tudo e deus acima de todos   ",0.75
"pt","50635","meu filho qria tanto lhe conhecer presidente nos moramos em rondonia porto velho ele tem 7 anos  ",0.0625922679901123
"pt","101150","estou  ansiosamente  aguardando a revista veja postar uma foto com o ultimo presidente brasileiro que entrou em campo e tirou uma foto com a selecao ",0.614930331707001
"pt","75740","bora forca o brasil precisa do sr por mais 8 anos",0.605032205581665
