,path,id,parent_id,level,object_id,object_type,query_status,query_time,query_type,message,created_time,like_count,comment_count,error.message
50735,jairmessias.bolsonaro/211857482296579_1475667249248923/1475667249248923_118336172721324,50740,4,2,1475667249248923_118336172721324,data,fetched (200),2020-05-29 13:18:01.463627,Facebook:/<post-id>/comments,bolsonaro sendo bolsonaro  um homem com uma queda acentuada para a familia  principalmente para as criancas  enquanto a esquerda e acentuada a favor de lula livre independente do que tenha feito de errado para o brasil  ainda nao vi o bolsonaro fez contra o brasil  a reforma da previdencia e a medida mais dolorosa mas e necessaria ,2019-06-03T08:08:56+0000,4.0,7.0,
114524,jairmessias.bolsonaro/211857482296579_1512227452259569/1512227452259569_1512230508925930,114527,8,2,1512227452259569_1512230508925930,data,fetched (200),2020-05-29 13:33:22.393755,Facebook:/<post-id>/comments,melhor imagem do dia  vlw presidente    parabens selecao  ,2019-07-08T01:02:54+0000,4.0,0.0,
66,jairmessias.bolsonaro/211857482296579_1467409400074708/1467409400074708_871773269866456,73,2,2,1467409400074708_871773269866456,data,fetched (200),2020-05-29 13:05:21.939019,Facebook:/<post-id>/comments,parabens   sr  presidente jair messias bolsonaro  pelo casamento do seu querido filho  eduardo bolsonaro   que deus abencoe essa uniao hoje e sempre  parabens tbm     pelo lindo e elegante casal   o sr  e sua bela esposa  michele bolsonaro   arrasaram   bjosss   ,2019-05-26T00:06:46+0000,4.0,0.0,
31567,jairmessias.bolsonaro/211857482296579_1663830393765940/1663830393765940_2705417136192790,31573,3,2,1663830393765940_2705417136192790,data,fetched (200),2020-05-29 13:13:18.623282,Facebook:/<post-id>/comments,meu presidente jair messias bolsonaro eu posso mim filiar ao seu novo partido ,2019-11-12T22:47:30+0000,4.0,0.0,
29687,jairmessias.bolsonaro/211857482296579_1663830393765940/1663830393765940_439074526804475,29693,3,2,1663830393765940_439074526804475,data,fetched (200),2020-05-29 13:12:50.596457,Facebook:/<post-id>/comments,eu  ja fii vice prefeito  candidato a prefeito  fui o vereador tive s maior votacao de toda a historia da minha cidade  em 2004  que ate  hoje ninguem  atingiu  em 2009  parei com a politica  voltei  quebrei ate a promessa  para trabalhar para um brasil melhor junto com o nosso capitao jair messias bolsonaro  com esse novo partido  estou empolgado de estar junto e me filiar  vamos juntos ,2019-11-13T01:58:41+0000,4.0,0.0,
25489,jairmessias.bolsonaro/211857482296579_1663830393765940/1663830393765940_2385051081744108,25495,3,2,1663830393765940_2385051081744108,data,fetched (200),2020-05-29 13:11:50.050368,Facebook:/<post-id>/comments,um partido novo para um bebe que acabou de nascer     seremos uma grande nacao,2019-11-12T22:47:52+0000,4.0,1.0,
31246,jairmessias.bolsonaro/211857482296579_1663830393765940/1663830393765940_983098508695402,31252,3,2,1663830393765940_983098508695402,data,fetched (200),2020-05-29 13:13:14.265532,Facebook:/<post-id>/comments,vou me filiar com certeza  presidente  estamos juntos ,2019-11-12T23:11:46+0000,4.0,0.0,
37186,jairmessias.bolsonaro/211857482296579_1663830393765940/1663830393765940_149887542943761,37192,3,2,1663830393765940_149887542943761,data,fetched (200),2020-05-29 13:14:48.315667,Facebook:/<post-id>/comments,,2019-11-12T22:39:03+0000,4.0,0.0,
77073,jairmessias.bolsonaro/211857482296579_1370373509778298/1370373509778298_758764794508141,77077,5,2,1370373509778298_758764794508141,data,fetched (200),2020-05-29 13:24:22.044110,Facebook:/<post-id>/comments,meu presidente  que felicidade ve lo bem  ,2019-02-09T15:40:03+0000,4.0,0.0,
31586,jairmessias.bolsonaro/211857482296579_1663830393765940/1663830393765940_2485382798385207,31592,3,2,1663830393765940_2485382798385207,data,fetched (200),2020-05-29 13:13:19.308088,Facebook:/<post-id>/comments,nunca me filiei a partido nenhum  mais esse eu tenho o prazer ,2019-11-12T23:18:46+0000,4.0,1.0,
31598,jairmessias.bolsonaro/211857482296579_1663830393765940/1663830393765940_154400352443858,31604,3,2,1663830393765940_154400352443858,data,fetched (200),2020-05-29 13:13:19.308088,Facebook:/<post-id>/comments,quero ver agora os trairas do psl ter toda essa popularidade   andaram de carona pra chegar onde chegaram   ,2019-11-12T22:40:55+0000,4.0,0.0,
25501,jairmessias.bolsonaro/211857482296579_1663830393765940/1663830393765940_2568628550038953,25507,3,2,1663830393765940_2568628550038953,data,fetched (200),2020-05-29 13:11:50.050368,Facebook:/<post-id>/comments,que enquanto o senhor seguir e guardar o interesse do brasil e seu povo o suporte de todos os cidadaos te sustentara  nao desista  minhas oracoes e votos de sucesso na busca de um brasil melhor,2019-11-12T23:31:56+0000,4.0,0.0,
29696,jairmessias.bolsonaro/211857482296579_1663830393765940/1663830393765940_1002868690077734,29702,3,2,1663830393765940_1002868690077734,data,fetched (200),2020-05-29 13:12:50.596457,Facebook:/<post-id>/comments,logotipo,2019-11-12T23:13:41+0000,4.0,0.0,
25503,jairmessias.bolsonaro/211857482296579_1663830393765940/1663830393765940_714843532357088,25509,3,2,1663830393765940_714843532357088,data,fetched (200),2020-05-29 13:11:50.050368,Facebook:/<post-id>/comments,vai ser abencoado pq teve ate oracoes ja no inicio,2019-11-13T00:55:04+0000,4.0,1.0,
25512,jairmessias.bolsonaro/211857482296579_1663830393765940/1663830393765940_2661293047225148,25518,3,2,1663830393765940_2661293047225148,data,fetched (200),2020-05-29 13:11:50.332296,Facebook:/<post-id>/comments,fui convidado a me filiar ao prb porem nao senti vontade  agora estou esperando ansiosamente o partido alianca pelo brasil para pedir minha filiacao ,2019-11-13T02:05:55+0000,4.0,0.0,
31617,jairmessias.bolsonaro/211857482296579_1663830393765940/1663830393765940_983101305361789,31623,3,2,1663830393765940_983101305361789,data,fetched (200),2020-05-29 13:13:19.626536,Facebook:/<post-id>/comments,ate hoje nao fui filiada a nenhum partido politico   sempre votei na pessoa   mas vou me filiar ao seu partido presidente ,2019-11-12T23:16:51+0000,4.0,3.0,
25516,jairmessias.bolsonaro/211857482296579_1663830393765940/1663830393765940_776509072798598,25522,3,2,1663830393765940_776509072798598,data,fetched (200),2020-05-29 13:11:50.332296,Facebook:/<post-id>/comments,a primeira alianca feita na terra foi entre deus e noe   ate hoje ela e lembrada nos arcos iris  que deus abencoe essa nova alianca com brasil ,2019-11-12T23:32:19+0000,4.0,0.0,
172,jairmessias.bolsonaro/211857482296579_1467409400074708/1467409400074708_318939495667416,179,2,2,1467409400074708_318939495667416,data,fetched (200),2020-05-29 13:05:23.753704,Facebook:/<post-id>/comments,parabens para eduardo que seja muito feliz e um filho maravilhoso  e merece ser feliz,2019-05-25T23:22:48+0000,4.0,0.0,
169,jairmessias.bolsonaro/211857482296579_1467409400074708/1467409400074708_407949623389103,176,2,2,1467409400074708_407949623389103,data,fetched (200),2020-05-29 13:05:23.753704,Facebook:/<post-id>/comments,o melhor presidente de toda a republica  e o casal mais lindo que ja representou nosso pais  amo essa familia ,2019-05-25T23:39:26+0000,4.0,0.0,
166,jairmessias.bolsonaro/211857482296579_1467409400074708/1467409400074708_2322769864478362,173,2,2,1467409400074708_2322769864478362,data,fetched (200),2020-05-29 13:05:23.753704,Facebook:/<post-id>/comments,lindos meus amores meu mito capitao presidente e a mais bela das mulheres primeira dama,2019-05-25T23:16:31+0000,4.0,0.0,
25529,jairmessias.bolsonaro/211857482296579_1663830393765940/1663830393765940_1077407492429557,25535,3,2,1663830393765940_1077407492429557,data,fetched (200),2020-05-29 13:11:50.332296,Facebook:/<post-id>/comments,pela primeira vez na minha vida vou me filiar a um partido politico  brasil acima de tudo deus acima de todos  #aliancapelobrasil,2019-11-12T23:53:21+0000,4.0,0.0,
164,jairmessias.bolsonaro/211857482296579_1467409400074708/1467409400074708_127416971788496,171,2,2,1467409400074708_127416971788496,data,fetched (200),2020-05-29 13:05:23.753704,Facebook:/<post-id>/comments,viva  deus abencoe toda essa familia linda  ,2019-05-25T23:22:51+0000,4.0,0.0,
77105,jairmessias.bolsonaro/211857482296579_1370373509778298/1370373509778298_2078446598938456,77109,5,2,1370373509778298_2078446598938456,data,fetched (200),2020-05-29 13:24:22.363170,Facebook:/<post-id>/comments,bencaos e paz ao nosso presidente jair messias bolsonaro ,2019-02-09T21:50:29+0000,4.0,0.0,
25539,jairmessias.bolsonaro/211857482296579_1663830393765940/1663830393765940_154408405776386,25545,3,2,1663830393765940_154408405776386,data,fetched (200),2020-05-29 13:11:50.727732,Facebook:/<post-id>/comments,estaremos juntos e unidos por um brasil melhor   continuaremos acreditando e botando fe nas reformas politicas   sociais e economicas necessarias para o crescimento e desenvolvimento ,2019-11-12T23:13:15+0000,4.0,0.0,
25540,jairmessias.bolsonaro/211857482296579_1663830393765940/1663830393765940_2528089020615693,25546,3,2,1663830393765940_2528089020615693,data,fetched (200),2020-05-29 13:11:50.727732,Facebook:/<post-id>/comments,estarei sempre com o sr  firme e forte para coloca o brasil nos trilho,2019-11-12T23:23:04+0000,4.0,0.0,
158,jairmessias.bolsonaro/211857482296579_1467409400074708/1467409400074708_658096314613180,165,2,2,1467409400074708_658096314613180,data,fetched (200),2020-05-29 13:05:23.753704,Facebook:/<post-id>/comments,parabens presidente e familia   que deus abencoe e proteja todos voces ,2019-05-26T00:22:06+0000,4.0,0.0,
156,jairmessias.bolsonaro/211857482296579_1467409400074708/1467409400074708_2322910881130927,163,2,2,1467409400074708_2322910881130927,data,fetched (200),2020-05-29 13:05:23.409683,Facebook:/<post-id>/comments,felicidades aos noivos  aproveitando  o casal esta mais lindo ,2019-05-26T01:19:27+0000,4.0,0.0,
153,jairmessias.bolsonaro/211857482296579_1467409400074708/1467409400074708_127425688454291,160,2,2,1467409400074708_127425688454291,data,fetched (200),2020-05-29 13:05:23.409683,Facebook:/<post-id>/comments,felicidades meu querido   e  amanha fique em casa curtindo sua familia   tem muito louco na rua   deixe que nos vamos pra voce ,2019-05-25T23:51:49+0000,4.0,1.0,
25552,jairmessias.bolsonaro/211857482296579_1663830393765940/1663830393765940_156594022255653,25558,3,2,1663830393765940_156594022255653,data,fetched (200),2020-05-29 13:11:50.727732,Facebook:/<post-id>/comments,creio que seja uma manobra arriscada  mas vamos orar para que de tudo certo,2019-11-12T22:47:12+0000,4.0,1.0,
31562,jairmessias.bolsonaro/211857482296579_1663830393765940/1663830393765940_1663833497098963,31568,3,2,1663830393765940_1663833497098963,data,fetched (200),2020-05-29 13:13:18.623282,Facebook:/<post-id>/comments,como fazemos filiacao em seu novo partido,2019-11-12T22:33:11+0000,4.0,0.0,
25719,jairmessias.bolsonaro/211857482296579_1663830393765940/1663830393765940_149892719609910,25725,3,2,1663830393765940_149892719609910,data,fetched (200),2020-05-29 13:11:53.182113,Facebook:/<post-id>/comments,estarei junto  nunca fui filiado a nenhum partido politico  mas dessa vez nao vou ficar fora,2019-11-12T22:52:08+0000,4.0,0.0,
76847,jairmessias.bolsonaro/211857482296579_1370373509778298/1370373509778298_1885924668180054,76851,5,2,1370373509778298_1885924668180054,data,fetched (200),2020-05-29 13:24:18.743637,Facebook:/<post-id>/comments,esta com a carinha triste e abatida ne meu querido presidente mais deus e fiel e vai restabelecer sua saude ,2019-02-09T17:18:40+0000,4.0,0.0,
31354,jairmessias.bolsonaro/211857482296579_1663830393765940/1663830393765940_579209882819157,31360,3,2,1663830393765940_579209882819157,data,fetched (200),2020-05-29 13:13:15.700628,Facebook:/<post-id>/comments,estamos juntos nessa nova missao ,2019-11-12T22:49:33+0000,4.0,1.0,
29613,jairmessias.bolsonaro/211857482296579_1663830393765940/1663830393765940_156593618922360,29619,3,2,1663830393765940_156593618922360,data,fetched (200),2020-05-29 13:12:49.532810,Facebook:/<post-id>/comments,sem duvida sera o partido mais forte ja criado no brasil  todos pelo brasil  todos contigo comandante  ,2019-11-12T22:46:00+0000,4.0,0.0,
55322,jairmessias.bolsonaro/211857482296579_1475667249248923/1475667249248923_1475682745914040,55327,4,2,1475667249248923_1475682745914040,data,fetched (200),2020-05-29 13:19:08.326157,Facebook:/<post-id>/comments,estas criancasnunca mais esquecerao ,2019-06-03T02:27:43+0000,4.0,0.0,
31345,jairmessias.bolsonaro/211857482296579_1663830393765940/1663830393765940_198638824499339,31351,3,2,1663830393765940_198638824499339,data,fetched (200),2020-05-29 13:13:15.700628,Facebook:/<post-id>/comments,como vamos fazer para nos filiar     ,2019-11-12T22:53:08+0000,4.0,0.0,
31403,jairmessias.bolsonaro/211857482296579_1663830393765940/1663830393765940_102007871220668,31409,3,2,1663830393765940_102007871220668,data,fetched (200),2020-05-29 13:13:16.368024,Facebook:/<post-id>/comments,parabens  manda logo a legenda pra gente se filiar   ,2019-11-12T23:10:33+0000,4.0,0.0,
76947,jairmessias.bolsonaro/211857482296579_1370373509778298/1370373509778298_377903546093788,76951,5,2,1370373509778298_377903546093788,data,fetched (200),2020-05-29 13:24:20.242321,Facebook:/<post-id>/comments,forca presidente   acredito no teu governo 2019 mudanca no brasil,2019-02-09T17:31:32+0000,4.0,0.0,
76946,jairmessias.bolsonaro/211857482296579_1370373509778298/1370373509778298_379207492875375,76950,5,2,1370373509778298_379207492875375,data,fetched (200),2020-05-29 13:24:20.242321,Facebook:/<post-id>/comments,realmente presidente ja estamos tendo resultados muito bom  porem nos produtores de leite estamos muito precisando de sua ajuda neste momento  pois agora que iriamos ter uma folga vem a assustadora possibilidade de importacao da europa de leite em po  nos ajude  obrigada e deus ja esta agindo para que fiques bom logo  abraco ,2019-02-09T17:09:40+0000,4.0,0.0,
31429,jairmessias.bolsonaro/211857482296579_1663830393765940/1663830393765940_2401765223420543,31435,3,2,1663830393765940_2401765223420543,data,fetched (200),2020-05-29 13:13:16.841121,Facebook:/<post-id>/comments,liga o filtro no modo turbo ,2019-11-12T22:41:53+0000,4.0,0.0,
29557,jairmessias.bolsonaro/211857482296579_1663830393765940/1663830393765940_559725184795032,29563,3,2,1663830393765940_559725184795032,data,fetched (200),2020-05-29 13:12:48.539646,Facebook:/<post-id>/comments,alianca pelo brasil o primeiro partido verdadeiramente de direita no brasil se chamara alianca pelo brasil  eu apoio  #b2022,2019-11-13T01:16:24+0000,4.0,0.0,
76927,jairmessias.bolsonaro/211857482296579_1370373509778298/1370373509778298_805410259807870,76931,5,2,1370373509778298_805410259807870,data,fetched (200),2020-05-29 13:24:19.962466,Facebook:/<post-id>/comments,estamos felizes pela sua recuperacao  mas nao tenha pressa em sair dai  o importante e a sua saude   quando o sr  sair do hospital   ainda vai precisar tomar muito cuidado  deus esta contigo ,2019-02-09T20:07:01+0000,4.0,0.0,
76924,jairmessias.bolsonaro/211857482296579_1370373509778298/1370373509778298_119484779133407,76928,5,2,1370373509778298_119484779133407,data,fetched (200),2020-05-29 13:24:19.962466,Facebook:/<post-id>/comments,tenho 92 anos  sou engenheiro civil  pela primeira vez acredito no governo de meu pais  saude  ordem e progresso ,2019-02-09T16:20:58+0000,4.0,0.0,
31460,jairmessias.bolsonaro/211857482296579_1663830393765940/1663830393765940_579203559486456,31466,3,2,1663830393765940_579203559486456,data,fetched (200),2020-05-29 13:13:17.122752,Facebook:/<post-id>/comments,agora pensei em me filiar     ,2019-11-12T22:40:23+0000,4.0,0.0,
55292,jairmessias.bolsonaro/211857482296579_1475667249248923/1475667249248923_154683612246867,55297,4,2,1475667249248923_154683612246867,data,fetched (200),2020-05-29 13:19:07.728525,Facebook:/<post-id>/comments,acorda brasil        nosso presidente e dez         ele e como uma abelhinha   nao para         viva  b17       ,2019-06-03T04:07:28+0000,4.0,0.0,
109,jairmessias.bolsonaro/211857482296579_1467409400074708/1467409400074708_127416571788536,116,2,2,1467409400074708_127416571788536,data,fetched (200),2020-05-29 13:05:22.874488,Facebook:/<post-id>/comments,tem mais bolo na segunda feira  presidente  estou indo para as manifestacoes de amanha ai em brasilia  terei duas audiencias no mdh  na segunda feira que e meu niver  se a damares deixar  levo a comilanca pra la  ai a festa continua     compro ate pao e leite moca para o senhor ,2019-05-25T23:21:57+0000,4.0,2.0,
29514,jairmessias.bolsonaro/211857482296579_1663830393765940/1663830393765940_1356723014497486,29520,3,2,1663830393765940_1356723014497486,data,fetched (200),2020-05-29 13:12:47.933515,Facebook:/<post-id>/comments,onde estiver  estaremos juntos ,2019-11-12T23:53:23+0000,4.0,0.0,
114310,jairmessias.bolsonaro/211857482296579_1512227452259569/1512227452259569_612517382604159,114313,8,2,1512227452259569_612517382604159,data,fetched (200),2020-05-29 13:33:18.812194,Facebook:/<post-id>/comments,tite sem educacao  alguem avisou que o lula esta preso   #somostodosbolsonaro #foratite,2019-07-08T01:08:58+0000,4.0,2.0,
31501,jairmessias.bolsonaro/211857482296579_1663830393765940/1663830393765940_1663832753765704,31507,3,2,1663830393765940_1663832753765704,data,fetched (200),2020-05-29 13:13:17.872496,Facebook:/<post-id>/comments,parabens jair     o senhor esta dando o exemplo e e maior q o partido  estamos com vc  ,2019-11-12T22:33:02+0000,4.0,0.0,
31510,jairmessias.bolsonaro/211857482296579_1663830393765940/1663830393765940_2705434309524406,31516,3,2,1663830393765940_2705434309524406,data,fetched (200),2020-05-29 13:13:17.872496,Facebook:/<post-id>/comments,tamo junto presidente    nos informe  vou me filiar,2019-11-12T22:59:46+0000,4.0,0.0,
57,jairmessias.bolsonaro/211857482296579_1467409400074708/1467409400074708_407963836721015,64,2,2,1467409400074708_407963836721015,data,fetched (200),2020-05-29 13:05:21.939019,Facebook:/<post-id>/comments,casal lindo e a primeira  dama entao uma diva  parabens pelo casamento d seu filho  senhor presidente q deus abencoe,2019-05-26T00:15:07+0000,4.0,0.0,
228,jairmessias.bolsonaro/211857482296579_1467409400074708/1467409400074708_2322814754473873,235,2,2,1467409400074708_2322814754473873,data,fetched (200),2020-05-29 13:05:24.432857,Facebook:/<post-id>/comments,o legal e que parece ser meu amigo de verdade  eu ate  acredito e fico muito feliz  eu  uma simples professora aposentada  amiga do presidente do meu pais  inacreditavel o casal esta muito lindo  parabens para o filhao  e esposa ,2019-05-25T23:54:18+0000,4.0,0.0,
31533,jairmessias.bolsonaro/211857482296579_1663830393765940/1663830393765940_2401765170087215,31539,3,2,1663830393765940_2401765170087215,data,fetched (200),2020-05-29 13:13:18.263257,Facebook:/<post-id>/comments,quero saber como me filiar ,2019-11-12T22:41:49+0000,4.0,3.0,
214,jairmessias.bolsonaro/211857482296579_1467409400074708/1467409400074708_1026947990834720,221,2,2,1467409400074708_1026947990834720,data,fetched (200),2020-05-29 13:05:24.432857,Facebook:/<post-id>/comments,lindos     parabens pelo casamento de seu filho  e que deus te proteja hoje e sempre juntamente com os seus familiares  felicidades,2019-05-25T23:25:18+0000,4.0,0.0,
80600,jairmessias.bolsonaro/211857482296579_1370373509778298/1370373509778298_289961228359428,80604,5,2,1370373509778298_289961228359428,data,fetched (200),2020-05-29 13:25:10.770953,Facebook:/<post-id>/comments,lets go  presidente bolsonaro e equipe   deus continue abencoando abundantemente vossa vida e tambem nosso imenso brasil ,2019-02-09T16:49:33+0000,4.0,0.0,
34737,jairmessias.bolsonaro/211857482296579_1663830393765940/1663830393765940_1008981742775364,34743,3,2,1663830393765940_1008981742775364,data,fetched (200),2020-05-29 13:14:04.725352,Facebook:/<post-id>/comments,o bom da criacao do novo partido e que aqueles que permanecerem no psl ja podem ser considerados traidores e nao merecem se eleger nas proximas eleicoes ,2019-11-12T23:14:44+0000,4.0,0.0,
31671,jairmessias.bolsonaro/211857482296579_1663830393765940/1663830393765940_156597318921990,31677,3,2,1663830393765940_156597318921990,data,fetched (200),2020-05-29 13:13:20.269679,Facebook:/<post-id>/comments,segue em frente  estamos com vc bolsonaro,2019-11-12T23:01:06+0000,4.0,1.0,
25553,jairmessias.bolsonaro/211857482296579_1663830393765940/1663830393765940_2528084617282800,25559,3,2,1663830393765940_2528084617282800,data,fetched (200),2020-05-29 13:11:50.727732,Facebook:/<post-id>/comments,presidente  nao gostei dessa possivel juncao com o dem  seria muito bom que o alianca pelo brasil fosse puro sangue  o rodrigo maia mostrou sua arrogancia ao dizer que  a camara nao tem a obrigacao de ouvir a populacao para tomar decisoes  ,2019-11-12T23:19:14+0000,4.0,1.0,
25554,jairmessias.bolsonaro/211857482296579_1663830393765940/1663830393765940_156588352256220,25560,3,2,1663830393765940_156588352256220,data,fetched (200),2020-05-29 13:11:50.727732,Facebook:/<post-id>/comments,presidente olhe pelos moradores de rua do brasil crie albergues e o a tire do frio da noite e das drogas internando os que precisam,2019-11-12T22:37:06+0000,4.0,3.0,
50647,jairmessias.bolsonaro/211857482296579_1475667249248923/1475667249248923_146489363176728,50652,4,2,1475667249248923_146489363176728,data,fetched (200),2020-05-29 13:18:00.316578,Facebook:/<post-id>/comments,presidente do brasil    orgulho de ter votado certo ,2019-06-03T13:10:31+0000,4.0,0.0,
76701,jairmessias.bolsonaro/211857482296579_1370373509778298/1370373509778298_298123494221424,76705,5,2,1370373509778298_298123494221424,data,fetched (200),2020-05-29 13:24:16.866243,Facebook:/<post-id>/comments,tenho orado pedindo a deus saude e sabedoria para o senhor e seus ministros ,2019-02-09T18:45:51+0000,4.0,0.0,
25630,jairmessias.bolsonaro/211857482296579_1663830393765940/1663830393765940_561884694570755,25636,3,2,1663830393765940_561884694570755,data,fetched (200),2020-05-29 13:11:51.776665,Facebook:/<post-id>/comments,ja aviso  vou me filiar  comecei a acreditar na mudanca qdo conheci teus ideais,2019-11-12T23:00:22+0000,4.0,0.0,
76697,jairmessias.bolsonaro/211857482296579_1370373509778298/1370373509778298_420132082061794,76701,5,2,1370373509778298_420132082061794,data,fetched (200),2020-05-29 13:24:16.866243,Facebook:/<post-id>/comments,votei no sr  votaria de novo  porque do jeito que tava  nao dava mais   tenho certeza  de que deus vai te abencoar  e vai te recuperar  amem,2019-02-09T16:42:26+0000,4.0,0.0,
29250,jairmessias.bolsonaro/211857482296579_1663830393765940/1663830393765940_198636907832864,29256,3,2,1663830393765940_198636907832864,data,fetched (200),2020-05-29 13:12:44.391394,Facebook:/<post-id>/comments,psl sem bolsonaro ,2019-11-12T22:45:21+0000,4.0,1.0,
29248,jairmessias.bolsonaro/211857482296579_1663830393765940/1663830393765940_156588542256201,29254,3,2,1663830393765940_156588542256201,data,fetched (200),2020-05-29 13:12:44.391394,Facebook:/<post-id>/comments,deus abencoe o novo partido presidente  se saiu do psl e porque tem caroco nesse angu ,2019-11-12T22:37:14+0000,4.0,0.0,
143,jairmessias.bolsonaro/211857482296579_1467409400074708/1467409400074708_318931895668176,150,2,2,1467409400074708_318931895668176,data,fetched (200),2020-05-29 13:05:23.409683,Facebook:/<post-id>/comments,esse casal conquistou o coracao dos brasileiros ,2019-05-25T23:14:18+0000,4.0,0.0,
142,jairmessias.bolsonaro/211857482296579_1467409400074708/1467409400074708_2322780821143933,149,2,2,1467409400074708_2322780821143933,data,fetched (200),2020-05-29 13:05:23.409683,Facebook:/<post-id>/comments,lindissima sra  michelle  uma verdadeira crista   linda e maravilhosa  deus os abencoe presidente e tudo de bom pro edu ,2019-05-25T23:24:15+0000,4.0,0.0,
76689,jairmessias.bolsonaro/211857482296579_1370373509778298/1370373509778298_416873632452196,76693,5,2,1370373509778298_416873632452196,data,fetched (200),2020-05-29 13:24:16.614494,Facebook:/<post-id>/comments,todos sabem  que deus esta  com nosso presidente  saiba presidente   que vc esta  iluminado e  amparado pelo todo poderoso  deus    voce  esta  curado e sarado    nao  fique assustado  o povo brasileiro esta  ao vosso lado  independente de sua  experiencia crista ou das circunstancias que esteja enfrentado   deus te capacitou  e  tem planos para  voce   e  tendo  recebido em seu  espirito a revelacao  sobre  quem  voce  e  e  qual  o seu  chamado   a sua  vitoria vira  com  certeza juntamente  com todo o seu  povo  saude     paz seja contigo   amem,2019-02-09T18:11:45+0000,4.0,0.0,
31814,jairmessias.bolsonaro/211857482296579_1663830393765940/1663830393765940_2179348805702532,31820,3,2,1663830393765940_2179348805702532,data,fetched (200),2020-05-29 13:13:22.896468,Facebook:/<post-id>/comments,nunca me filiei a um partido  vou me filiar pela primeira vez   meu presidente abencoado   juizes 10 3 depois dele veio jair  de gileade  que liderou israel durante vinte e dois anos  ate a biblia faz mencao do nosso presidente ,2019-11-13T03:59:00+0000,4.0,0.0,
76375,jairmessias.bolsonaro/211857482296579_1370373509778298/1370373509778298_408130373273557,76379,5,2,1370373509778298_408130373273557,data,fetched (200),2020-05-29 13:24:11.632815,Facebook:/<post-id>/comments,deus o proteja    nao vejo a hora do sr  postar aquela foto comendo pao com muiiiiito leite condensado   ,2019-02-09T16:11:10+0000,4.0,0.0,
25641,jairmessias.bolsonaro/211857482296579_1663830393765940/1663830393765940_521413145075842,25647,3,2,1663830393765940_521413145075842,data,fetched (200),2020-05-29 13:11:52.140166,Facebook:/<post-id>/comments,tbm quero me filiar no seu partido nunca participei da politica mas vi que o sr  pensa exatamente como penso e todas suas atitudes eu faria igual    obrigado  pelo que faz por nos e pelo brasil ,2019-11-13T00:46:09+0000,4.0,0.0,
