,path,id,parent_id,level,object_id,object_type,query_status,query_time,query_type,message,created_time,like_count,comment_count,error.message
75861,jairmessias.bolsonaro/211857482296579_1370373509778298/1370373509778298_982769971918257,75865,5,2,1370373509778298_982769971918257,data,fetched (200),2020-05-29 13:24:04.139448,Facebook:/<post-id>/comments,estamos c vc presidente e sabemos q e vontade de deus a sua governancia sobre o brasil   oraremos sempre pra ter sabedoria de deus ,2019-02-09T15:56:53+0000,6.0,0.0,
48601,jairmessias.bolsonaro/211857482296579_1663830393765940/1663830393765940_161458758283931,48607,3,2,1663830393765940_161458758283931,data,fetched (200),2020-05-29 13:17:31.045055,Facebook:/<post-id>/comments,se o senhor achou melhor assim  tem o meu apoio   siga em frente  grandes coisas tem jesus para o futuro  ,2019-11-12T23:59:05+0000,6.0,0.0,
76000,jairmessias.bolsonaro/211857482296579_1370373509778298/1370373509778298_2028609733853148,76004,5,2,1370373509778298_2028609733853148,data,fetched (200),2020-05-29 13:24:06.475489,Facebook:/<post-id>/comments,deus esta contigo meu presidente    estamos orando    logo vai ficar bom ,2019-02-09T16:10:23+0000,6.0,0.0,
101168,jairmessias.bolsonaro/211857482296579_1512227452259569/1512227452259569_463444421146866,101171,8,2,1512227452259569_463444421146866,data,fetched (200),2020-05-29 13:30:06.959921,Facebook:/<post-id>/comments,boa noite capitao     que bela imagem    tenha uma bela semana    fique com deus   ,2019-07-08T01:16:21+0000,6.0,0.0,
29077,jairmessias.bolsonaro/211857482296579_1663830393765940/1663830393765940_2401766506753748,29083,3,2,1663830393765940_2401766506753748,data,fetched (200),2020-05-29 13:12:42.081739,Facebook:/<post-id>/comments,nunca pensei em participar de politica  mas me candidato a me filiar     #tamujuntospresidente,2019-11-12T22:43:22+0000,6.0,4.0,
29071,jairmessias.bolsonaro/211857482296579_1663830393765940/1663830393765940_149889212943594,29077,3,2,1663830393765940_149889212943594,data,fetched (200),2020-05-29 13:12:42.081739,Facebook:/<post-id>/comments,qual  numero do partido joao 8 32   ,2019-11-12T22:41:54+0000,6.0,0.0,
29068,jairmessias.bolsonaro/211857482296579_1663830393765940/1663830393765940_156590785589310,29074,3,2,1663830393765940_156590785589310,data,fetched (200),2020-05-29 13:12:42.081739,Facebook:/<post-id>/comments,sou albra  alianca pelo brasil   ,2019-11-12T22:39:50+0000,6.0,0.0,
101169,jairmessias.bolsonaro/211857482296579_1512227452259569/1512227452259569_174874916860570,101172,8,2,1512227452259569_174874916860570,data,fetched (200),2020-05-29 13:30:06.959921,Facebook:/<post-id>/comments,vamos colecionar muitas vitorias para esse pais  presidente   nao so no futebol  mas na economia  no emprego  na saude  na educacao e na etica  tamojunto ,2019-07-08T04:01:37+0000,6.0,0.0,
29050,jairmessias.bolsonaro/211857482296579_1663830393765940/1663830393765940_156597818921940,29056,3,2,1663830393765940_156597818921940,data,fetched (200),2020-05-29 13:12:41.720273,Facebook:/<post-id>/comments,francisco beltrao esta com o senhor capitao   ,2019-11-12T23:03:48+0000,6.0,0.0,
46845,jairmessias.bolsonaro/211857482296579_1663830393765940/1663830393765940_102168994530834,46851,3,2,1663830393765940_102168994530834,data,fetched (200),2020-05-29 13:17:05.550452,Facebook:/<post-id>/comments,estamos juntos presidente   desfililei do psb para filiar no psl porque o psb nao quis apoia lo  vamos todos  para o alianca pelo brasil  um partido novo e limpissimo  brasil ,2019-11-12T23:29:39+0000,6.0,1.0,
75835,jairmessias.bolsonaro/211857482296579_1370373509778298/1370373509778298_934712613585777,75839,5,2,1370373509778298_934712613585777,data,fetched (200),2020-05-29 13:24:03.760211,Facebook:/<post-id>/comments,jesus mt obgda  pela vida do nosso  presidente jesus q te de a recuperacao  abencoadate amamos    o brasil tdo te ama,2019-02-09T15:47:10+0000,6.0,0.0,
47827,jairmessias.bolsonaro/211857482296579_1663830393765940/1663830393765940_1356718054497982,47833,3,2,1663830393765940_1356718054497982,data,fetched (200),2020-05-29 13:17:19.813027,Facebook:/<post-id>/comments,parabens pela decisao e coragem presidente,2019-11-12T23:44:16+0000,6.0,2.0,
62,jairmessias.bolsonaro/211857482296579_1467409400074708/1467409400074708_127420155121511,69,2,2,1467409400074708_127420155121511,data,fetched (200),2020-05-29 13:05:21.939019,Facebook:/<post-id>/comments,casal lindooo  boa noite a vc meu presidente e a sua esposa ,2019-05-25T23:34:30+0000,6.0,0.0,
25573,jairmessias.bolsonaro/211857482296579_1663830393765940/1663830393765940_148476389766081,25579,3,2,1663830393765940_148476389766081,data,fetched (200),2020-05-29 13:11:51.193451,Facebook:/<post-id>/comments,o que importa e a vossa pessoa  estamos juntos   aqui de jaragua do sul sc,2019-11-13T00:21:28+0000,5.0,0.0,
43381,jairmessias.bolsonaro/211857482296579_1663830393765940/1663830393765940_149898166276032,43387,3,2,1663830393765940_149898166276032,data,fetched (200),2020-05-29 13:16:15.638531,Facebook:/<post-id>/comments,temo juntos,2019-11-12T23:20:10+0000,5.0,0.0,
76247,jairmessias.bolsonaro/211857482296579_1370373509778298/1370373509778298_331520947463309,76251,5,2,1370373509778298_331520947463309,data,fetched (200),2020-05-29 13:24:09.751001,Facebook:/<post-id>/comments,amado presidente continuarei orando  deus o guarde boa recuperacao ,2019-02-09T15:58:54+0000,5.0,2.0,
38083,jairmessias.bolsonaro/211857482296579_1663830393765940/1663830393765940_975952652744869,38089,3,2,1663830393765940_975952652744869,data,fetched (200),2020-05-29 13:15:01.048922,Facebook:/<post-id>/comments,nao votei no psl votei em jair messias bolsonaro,2019-11-13T00:12:19+0000,5.0,1.0,
75902,jairmessias.bolsonaro/211857482296579_1370373509778298/1370373509778298_2048601775223023,75906,5,2,1370373509778298_2048601775223023,data,fetched (200),2020-05-29 13:24:04.837296,Facebook:/<post-id>/comments,que deus te abencoe meu presidente  estamos confiantes no novo brasil     ,2019-02-09T16:10:40+0000,5.0,0.0,
75901,jairmessias.bolsonaro/211857482296579_1370373509778298/1370373509778298_316834798815320,75905,5,2,1370373509778298_316834798815320,data,fetched (200),2020-05-29 13:24:04.837296,Facebook:/<post-id>/comments,muito bom  bora la o brasil esta a tua espera  ,2019-02-09T16:29:48+0000,5.0,0.0,
75900,jairmessias.bolsonaro/211857482296579_1370373509778298/1370373509778298_2274102345945270,75904,5,2,1370373509778298_2274102345945270,data,fetched (200),2020-05-29 13:24:04.837296,Facebook:/<post-id>/comments,sr  presidente do brasil  crie uma nova lei contra esses usuarios que defamam  as autoridades  que nao mede consequencias com as asneiras que falam  e que deus te abencoe sempre ,2019-02-09T17:28:15+0000,5.0,3.0,
75899,jairmessias.bolsonaro/211857482296579_1370373509778298/1370373509778298_286906848642501,75903,5,2,1370373509778298_286906848642501,data,fetched (200),2020-05-29 13:24:04.837296,Facebook:/<post-id>/comments,meu coracao  transborda de  alegria  a fe  em deus  traz seus milagres guiando as maos  dos medicos   o brasil  precisa mto de vc ,2019-02-09T16:20:16+0000,5.0,0.0,
75897,jairmessias.bolsonaro/211857482296579_1370373509778298/1370373509778298_244110933194207,75901,5,2,1370373509778298_244110933194207,data,fetched (200),2020-05-29 13:24:04.837296,Facebook:/<post-id>/comments,tamo juntos a uma corrente do mal torcendo para o brasil nao prosperara mas o mal nunca vencera o bem,2019-02-09T17:34:43+0000,5.0,1.0,
29026,jairmessias.bolsonaro/211857482296579_1663830393765940/1663830393765940_561875487905009,29032,3,2,1663830393765940_561875487905009,data,fetched (200),2020-05-29 13:12:41.335696,Facebook:/<post-id>/comments,estamos juntos  a caminhada e unica e o objetivo e o brasil ,2019-11-12T22:43:53+0000,5.0,0.0,
75894,jairmessias.bolsonaro/211857482296579_1370373509778298/1370373509778298_663773387375440,75898,5,2,1370373509778298_663773387375440,data,fetched (200),2020-05-29 13:24:04.837296,Facebook:/<post-id>/comments,gracas a deus senhor tem q por o brasil em ordem e a vossa missao  q nos estamos em oracao,2019-02-09T16:07:07+0000,5.0,0.0,
50674,jairmessias.bolsonaro/211857482296579_1475667249248923/1475667249248923_468047123970153,50679,4,2,1475667249248923_468047123970153,data,fetched (200),2020-05-29 13:18:00.702216,Facebook:/<post-id>/comments,este e o meu presidente  abraca criancas o tempo todo e nao so na epoca  de eleicao   brasil  acima  de tudo    deus acima de todos ,2019-06-03T03:41:37+0000,5.0,0.0,
25611,jairmessias.bolsonaro/211857482296579_1663830393765940/1663830393765940_714384322372296,25617,3,2,1663830393765940_714384322372296,data,fetched (200),2020-05-29 13:11:51.515620,Facebook:/<post-id>/comments,parabens pela decisao presidente  que deus continue nos abencoando  para colocarmos esta nacao adiante  forca e honra capitao  ,2019-11-13T00:23:57+0000,5.0,1.0,
75890,jairmessias.bolsonaro/211857482296579_1370373509778298/1370373509778298_2458009864227711,75894,5,2,1370373509778298_2458009864227711,data,fetched (200),2020-05-29 13:24:04.837296,Facebook:/<post-id>/comments,pode nao ser o melhor mais o unico que vai concertar  o brasil sucesso presidente  o povo brasileiro precisa muito de vc deus no comando,2019-02-09T17:32:06+0000,5.0,0.0,
75889,jairmessias.bolsonaro/211857482296579_1370373509778298/1370373509778298_380733046089404,75893,5,2,1370373509778298_380733046089404,data,fetched (200),2020-05-29 13:24:04.837296,Facebook:/<post-id>/comments,se cuida presidente o brasil precisa do senhor  estamos orando pela sua recuperacao ,2019-02-09T16:52:50+0000,5.0,0.0,
75887,jairmessias.bolsonaro/211857482296579_1370373509778298/1370373509778298_119484192466799,75891,5,2,1370373509778298_119484192466799,data,fetched (200),2020-05-29 13:24:04.570036,Facebook:/<post-id>/comments,deus te abencoe uma otima recuperacao firme forte o brasil precisa de vc ,2019-02-09T16:18:55+0000,5.0,0.0,
76217,jairmessias.bolsonaro/211857482296579_1370373509778298/1370373509778298_659020567834185,76221,5,2,1370373509778298_659020567834185,data,fetched (200),2020-05-29 13:24:09.376088,Facebook:/<post-id>/comments,ficamos muito feliz pela sua recuperacao temos coisas a serem resolvidas aqui no mato grosso  o meio ambiente esta a deus dara  so serve para cabide de emprego com altos salarios  os peixes morrendo nos rios contaminados por coliformes fecais dos esgostos residenciais  o pantanal agoniza  acabou o oxigenio dos rios   volte logo meu presidente amado ,2019-02-09T16:32:19+0000,5.0,0.0,
76216,jairmessias.bolsonaro/211857482296579_1370373509778298/1370373509778298_934715116918860,76220,5,2,1370373509778298_934715116918860,data,fetched (200),2020-05-29 13:24:09.376088,Facebook:/<post-id>/comments,forca capitao  o batalhao bolsonariano te aguarda j raimundo lider caminhoneiros do leste mineiro ,2019-02-09T15:51:13+0000,5.0,0.0,
76094,jairmessias.bolsonaro/211857482296579_1370373509778298/1370373509778298_585514638527289,76098,5,2,1370373509778298_585514638527289,data,fetched (200),2020-05-29 13:24:07.520740,Facebook:/<post-id>/comments,em frente  meu presidente  com relacao aos inimigos de vexa  vao cair por terra um por um em nome de jesus     ,2019-02-09T16:12:44+0000,5.0,0.0,
30984,jairmessias.bolsonaro/211857482296579_1663830393765940/1663830393765940_1663843543764625,30990,3,2,1663830393765940_1663843543764625,data,fetched (200),2020-05-29 13:13:09.607902,Facebook:/<post-id>/comments,50 anos  nunca fui filiado  espero ansiosamente o dia para concretizar,2019-11-12T22:35:03+0000,5.0,0.0,
75883,jairmessias.bolsonaro/211857482296579_1370373509778298/1370373509778298_286142538722656,75887,5,2,1370373509778298_286142538722656,data,fetched (200),2020-05-29 13:24:04.570036,Facebook:/<post-id>/comments,a comunidade do culto da mata  unasp  esta em oracao  todos os domingos as 4h45  pela sua excelencia ,2019-02-09T16:58:03+0000,5.0,0.0,
49227,jairmessias.bolsonaro/211857482296579_1663830393765940/1663830393765940_561886544570570,49233,3,2,1663830393765940_561886544570570,data,fetched (200),2020-05-29 13:17:39.707320,Facebook:/<post-id>/comments,imenso dia     ,2019-11-12T23:04:13+0000,5.0,0.0,
101172,jairmessias.bolsonaro/211857482296579_1512227452259569/1512227452259569_115895089691580,101175,8,2,1512227452259569_115895089691580,data,fetched (200),2020-05-29 13:30:06.959921,Facebook:/<post-id>/comments,boa noite    em 6 meses de governo bolsonaro o brasil ja e campeao   kkkkl,2019-07-08T01:31:45+0000,5.0,1.0,
101174,jairmessias.bolsonaro/211857482296579_1512227452259569/1512227452259569_463447081146600,101177,8,2,1512227452259569_463447081146600,data,fetched (200),2020-05-29 13:30:06.959921,Facebook:/<post-id>/comments,ue  o tite disse que nao mistura politica com a profissao dele  por que nao fez nada para impedir do mito entregar as medalhas ,2019-07-08T01:21:56+0000,5.0,0.0,
25559,jairmessias.bolsonaro/211857482296579_1663830393765940/1663830393765940_175322830190610,25565,3,2,1663830393765940_175322830190610,data,fetched (200),2020-05-29 13:11:50.727732,Facebook:/<post-id>/comments,eu tambem acabei de pedir para presidente do psl de porto ferreira que eu estou saindo do partido agora vou ser da alianca pelo brasil,2019-11-13T01:42:56+0000,5.0,0.0,
25566,jairmessias.bolsonaro/211857482296579_1663830393765940/1663830393765940_198638414499380,25572,3,2,1663830393765940_198638414499380,data,fetched (200),2020-05-29 13:11:51.193451,Facebook:/<post-id>/comments,penso em me filiar  o que nunca imaginei antes,2019-11-12T22:50:57+0000,5.0,0.0,
76270,jairmessias.bolsonaro/211857482296579_1370373509778298/1370373509778298_2034270903322186,76274,5,2,1370373509778298_2034270903322186,data,fetched (200),2020-05-29 13:24:10.208998,Facebook:/<post-id>/comments,estou imensamente feliz em ver que jesus esta realmente contigo presidente  nada nem ninguem vai atrapalhar seu caminho na recuperacao  continuamos rezando  tudo ja deu certo     ,2019-02-09T16:39:22+0000,5.0,1.0,
76260,jairmessias.bolsonaro/211857482296579_1370373509778298/1370373509778298_585515788527174,76264,5,2,1370373509778298_585515788527174,data,fetched (200),2020-05-29 13:24:10.208998,Facebook:/<post-id>/comments,forca guerreiro  vc ira vencer e nos ajudar para termos dias melhores em nosso pais  abraco  ,2019-02-09T16:15:31+0000,5.0,0.0,
29720,jairmessias.bolsonaro/211857482296579_1663830393765940/1663830393765940_175322193524007,29726,3,2,1663830393765940_175322193524007,data,fetched (200),2020-05-29 13:12:50.905446,Facebook:/<post-id>/comments,presidente  uma grande licao foi aprendida quando no psl  no inicio  la eram so sorrisos  abracos e juramentos de fidelidade  depois  sabemos bem o que aconteceu   jamais confiar 100  em alguem  esteja de olho nas atitudes destes que hoje dizem estar com o senhor  observe o modus operandi perante as situacao que surgirem  se estarao em harmonia com o partido ou nao    enquanto ainda e somente um graveto  e facil de quebrar ao meio e depois lancar na fogueira  porem  depois que se torna um grande galho  ai a coisa e  mais dificil  por isso  olhos atentos sempre  observando sempre estes  pupilos  que rodeiam o senhor   alguns podem sim  ser de confianca  porem  nao foram poucas as mascaras que cairam no psl   muita sorte e que deus o abencoe  presidente ,2019-11-13T01:35:20+0000,5.0,0.0,
50656,jairmessias.bolsonaro/211857482296579_1475667249248923/1475667249248923_1611316595666944,50661,4,2,1475667249248923_1611316595666944,data,fetched (200),2020-05-29 13:18:00.316578,Facebook:/<post-id>/comments,nunca tivemos no brasil um presidente mais popular e mais humilde do que bolsonaro  que deus de a ele muitos anos de vida e sabedoria   ,2019-06-03T03:13:30+0000,5.0,0.0,
76092,jairmessias.bolsonaro/211857482296579_1370373509778298/1370373509778298_120419129021402,76096,5,2,1370373509778298_120419129021402,data,fetched (200),2020-05-29 13:24:07.520740,Facebook:/<post-id>/comments,eu nao so brasileira  so boliviana  mais so sua fans y gusto muito bem de bolsonaro  deus abencoe sempre e cuide de vc  pronto vai tomar as rendas de tudo  pronta recuperacao ,2019-02-09T18:25:11+0000,5.0,0.0,
29317,jairmessias.bolsonaro/211857482296579_1663830393765940/1663830393765940_579198742820271,29323,3,2,1663830393765940_579198742820271,data,fetched (200),2020-05-29 13:12:45.078306,Facebook:/<post-id>/comments,o senhor pode ir pra onde quiser que vamos atraz rumo a 2022 nosso querido presidente    ,2019-11-12T22:36:26+0000,5.0,0.0,
50657,jairmessias.bolsonaro/211857482296579_1475667249248923/1475667249248923_143544150145928,50662,4,2,1475667249248923_143544150145928,data,fetched (200),2020-05-29 13:18:00.316578,Facebook:/<post-id>/comments,essas sao o futuro de um brasil melhor    parabens meu presidente ,2019-06-03T02:46:04+0000,5.0,0.0,
50658,jairmessias.bolsonaro/211857482296579_1475667249248923/1475667249248923_138015990711567,50663,4,2,1475667249248923_138015990711567,data,fetched (200),2020-05-29 13:18:00.316578,Facebook:/<post-id>/comments,esse e meu querido presidente do brasil   o melhor ate hoje    ,2019-06-03T02:36:55+0000,5.0,0.0,
75925,jairmessias.bolsonaro/211857482296579_1370373509778298/1370373509778298_239789113572440,75929,5,2,1370373509778298_239789113572440,data,fetched (200),2020-05-29 13:24:05.223031,Facebook:/<post-id>/comments,feliz em saber q o senhor esta cada dia melhor  deus abencoe sua recuperacao  forca ai capitao  o brasil precisa de voce ,2019-02-09T17:43:47+0000,5.0,0.0,
75924,jairmessias.bolsonaro/211857482296579_1370373509778298/1370373509778298_118628499219827,75928,5,2,1370373509778298_118628499219827,data,fetched (200),2020-05-29 13:24:05.223031,Facebook:/<post-id>/comments,presidente jair bolsonaro  se deus e por voce  quem sera contra voce  ninguem  deus e maior  deus e o povo esta do seu lado  confie em deus  que voce vai vencer essa batalha  voce vai vencer esses inimigos que querem ver a sua derrota  deus vai te dar a vitoria  os anjos e os santos te guardem e te protejam  o seu anjo da guarda te acompanhe sempre  jesus e o medico dos medicos  grande presidente voce e a solucao do nosso brasil  presidente jair bolsonaro  quando voce sempre sair de casa  reze  deus por mim  e ninguem contra mim ,2019-02-09T15:55:03+0000,5.0,0.0,
30983,jairmessias.bolsonaro/211857482296579_1663830393765940/1663830393765940_2385069181742298,30989,3,2,1663830393765940_2385069181742298,data,fetched (200),2020-05-29 13:13:09.607902,Facebook:/<post-id>/comments,precisa disponibilizar em pdf as pautas e a ideologia do partido  se tiver escrito social democracia  deixo de apoiar  ,2019-11-12T23:14:42+0000,5.0,0.0,
75884,jairmessias.bolsonaro/211857482296579_1370373509778298/1370373509778298_2089382794432717,75888,5,2,1370373509778298_2089382794432717,data,fetched (200),2020-05-29 13:24:04.570036,Facebook:/<post-id>/comments,que bom meu presidente  fico contente e feliz em ve lo se recuperando  va com calma  uma coisa de cada vez  e em primeiro lugar a sua saude  os brasileiros do bem lhe amam e estao ao seu lado para o que der e vier  avante meu capitao  unidos seremos mais fortes  brasil acima de tudo  deus acima de todos ,2019-02-09T15:44:27+0000,5.0,1.0,
101205,jairmessias.bolsonaro/211857482296579_1512227452259569/1512227452259569_2764923343581971,101208,8,2,1512227452259569_2764923343581971,data,fetched (200),2020-05-29 13:30:07.537602,Facebook:/<post-id>/comments,ja cancelou sua veja   11  5087 2112 para grande sp e 0800 7752112 demais   localidades  de segunda a sexta  das 8 as 22 h ,2019-07-08T01:48:24+0000,5.0,0.0,
75953,jairmessias.bolsonaro/211857482296579_1370373509778298/1370373509778298_2299001650371756,75957,5,2,1370373509778298_2299001650371756,data,fetched (200),2020-05-29 13:24:05.594879,Facebook:/<post-id>/comments,sr presidente  faca do brasil um pais de excelencia  de respeito  para que o povo brasileiro trabalhador possa ter os mesmos direitos e ter dignidade de vida  nos o apoiaremos ,2019-02-09T19:40:38+0000,5.0,1.0,
50798,jairmessias.bolsonaro/211857482296579_1475667249248923/1475667249248923_369789590317068,50803,4,2,1475667249248923_369789590317068,data,fetched (200),2020-05-29 13:18:02.553049,Facebook:/<post-id>/comments,a camisa do uniao fc e mais bonita  se o presidente aceitar uma camisa do nosso clube  enviarei ,2019-06-03T21:53:43+0000,5.0,3.0,
126,jairmessias.bolsonaro/211857482296579_1467409400074708/1467409400074708_138257693947469,133,2,2,1467409400074708_138257693947469,data,fetched (200),2020-05-29 13:05:22.874488,Facebook:/<post-id>/comments,#deusbrasilbolsonaro #bolsonaronossopresidente #dia26nasruas ,2019-05-26T00:59:38+0000,5.0,0.0,
75849,jairmessias.bolsonaro/211857482296579_1370373509778298/1370373509778298_2312031645693165,75853,5,2,1370373509778298_2312031645693165,data,fetched (200),2020-05-29 13:24:04.139448,Facebook:/<post-id>/comments,essa sopinha deve estar uma delicia       to ate com inveja       cuide se bem capitao    voce precisa estar bem forte pra tocar o batente    va devagar que o senhor e consigo    estamos em permanente oracoes pela sua rapida recuperacao    vai dar tudo certo    a sua equipe e aguerrida e competente    tudo vai acontecer no tempo de deus    continue confiando    o brasil inteiro acredita e espera em voce    ,2019-02-09T17:25:23+0000,5.0,1.0,
31037,jairmessias.bolsonaro/211857482296579_1663830393765940/1663830393765940_147259173254053,31043,3,2,1663830393765940_147259173254053,data,fetched (200),2020-05-29 13:13:10.291884,Facebook:/<post-id>/comments,so dizer onde eu tenho que ir pra assinar  seja como filiado  candidato    o que for preciso  ,2019-11-12T23:30:16+0000,5.0,0.0,
75846,jairmessias.bolsonaro/211857482296579_1370373509778298/1370373509778298_294835027898528,75850,5,2,1370373509778298_294835027898528,data,fetched (200),2020-05-29 13:24:04.139448,Facebook:/<post-id>/comments,volta logo o brasil precisa de vc urgente ,2019-02-09T15:57:29+0000,5.0,0.0,
75844,jairmessias.bolsonaro/211857482296579_1370373509778298/1370373509778298_768821650168796,75848,5,2,1370373509778298_768821650168796,data,fetched (200),2020-05-29 13:24:04.139448,Facebook:/<post-id>/comments,isso mesmo senhor presidente  do seu lado somos maioria e a minoria que lhe desejou mal  so podemos dizer deus sabera o que fazer nao cabe a nos desejarmos mal ne  um abraco do tamanho do brasil pro senhor e bem vindo a vida  vida longa ao nosso presidente do brasil  siga firme capitao  nos seguimos em oracao pelo senhor e pelo brasil ,2019-02-09T16:27:42+0000,5.0,0.0,
75842,jairmessias.bolsonaro/211857482296579_1370373509778298/1370373509778298_294838701231494,75846,5,2,1370373509778298_294838701231494,data,fetched (200),2020-05-29 13:24:04.139448,Facebook:/<post-id>/comments,presidente continue firme no proposito de fazer o melhor pro nosso brasil  deus e maior e a maldade das pessoas nao pode derrotar os bons  que deus cuide do senhor ,2019-02-09T16:05:17+0000,5.0,0.0,
75839,jairmessias.bolsonaro/211857482296579_1370373509778298/1370373509778298_244105716528062,75843,5,2,1370373509778298_244105716528062,data,fetched (200),2020-05-29 13:24:04.139448,Facebook:/<post-id>/comments,presidente muito feliz em ver o sr melhor  o brasil precisa do sr  volte logo ,2019-02-09T17:23:02+0000,5.0,0.0,
51855,jairmessias.bolsonaro/211857482296579_1475667249248923/1475667249248923_138018780711288,51860,4,2,1475667249248923_138018780711288,data,fetched (200),2020-05-29 13:18:17.411345,Facebook:/<post-id>/comments,na moral  se esse nao e o melhor presidente que o brasil ja teve e melhor cancelar o brasil ,2019-06-03T02:41:52+0000,5.0,0.0,
25732,jairmessias.bolsonaro/211857482296579_1663830393765940/1663830393765940_2705428556191648,25738,3,2,1663830393765940_2705428556191648,data,fetched (200),2020-05-29 13:11:53.182113,Facebook:/<post-id>/comments,onde assino  manda uma lista  imprimo  colho assinatura e mando via correio ,2019-11-12T22:55:29+0000,5.0,1.0,
76146,jairmessias.bolsonaro/211857482296579_1370373509778298/1370373509778298_758771514507469,76150,5,2,1370373509778298_758771514507469,data,fetched (200),2020-05-29 13:24:08.263710,Facebook:/<post-id>/comments,deus o abencoe e proteja  os brasileiros de bem estao contigo  ,2019-02-09T15:50:38+0000,5.0,0.0,
75833,jairmessias.bolsonaro/211857482296579_1370373509778298/1370373509778298_142140513477787,75837,5,2,1370373509778298_142140513477787,data,fetched (200),2020-05-29 13:24:03.760211,Facebook:/<post-id>/comments,ja deu tudo certo  agora e questao de mais algum tempo a recuperacao   orando e mandando muita energias positivas  ,2019-02-09T16:01:18+0000,5.0,0.0,
75832,jairmessias.bolsonaro/211857482296579_1370373509778298/1370373509778298_1370377359777913,75836,5,2,1370373509778298_1370377359777913,data,fetched (200),2020-05-29 13:24:03.760211,Facebook:/<post-id>/comments,forca presidente  o brasil e os brasileiros de bem precisam do senhor  gracas a deus deu tudo certo ,2019-02-09T15:35:39+0000,5.0,1.0,
25713,jairmessias.bolsonaro/211857482296579_1663830393765940/1663830393765940_198634374499784,25719,3,2,1663830393765940_198634374499784,data,fetched (200),2020-05-29 13:11:52.896595,Facebook:/<post-id>/comments,presidente deverias marcar dotodos os que te apoiaram nessa foto  pra sabermos em quem votar nas proximas eleicoes ,2019-11-12T22:40:11+0000,5.0,0.0,
75830,jairmessias.bolsonaro/211857482296579_1370373509778298/1370373509778298_2089375921100071,75834,5,2,1370373509778298_2089375921100071,data,fetched (200),2020-05-29 13:24:03.760211,Facebook:/<post-id>/comments,todos nos somos teus filhos e filhas porque e o pai da nossa nacao melhoras oramos por ti pai bolsonaro    pai do brasil,2019-02-09T15:39:32+0000,5.0,0.0,
25717,jairmessias.bolsonaro/211857482296579_1663830393765940/1663830393765940_149890269610155,25723,3,2,1663830393765940_149890269610155,data,fetched (200),2020-05-29 13:11:52.896595,Facebook:/<post-id>/comments,como faco para criar este partido em minha cidade       ,2019-11-12T22:44:23+0000,5.0,4.0,
