,path,id,parent_id,level,object_id,object_type,query_status,query_time,query_type,message,created_time,like_count,comment_count,error.message
44707,jairmessias.bolsonaro/211857482296579_1663830393765940/1663830393765940_156595885588800,44713,3,2,1663830393765940_156595885588800,data,fetched (200),2020-05-29 13:16:34.211051,Facebook:/<post-id>/comments,como um angolano faz pra se filiar a esse partido  porque eu acredito nesse  cabra macho  do bolsonaro  ,2019-11-12T22:54:19+0000,12.0,4.0,
102321,jairmessias.bolsonaro/211857482296579_1512227452259569/1512227452259569_166242354418005,102324,8,2,1512227452259569_166242354418005,data,fetched (200),2020-05-29 13:30:24.997062,Facebook:/<post-id>/comments,grande dia ,2019-07-08T01:39:41+0000,12.0,1.0,
75767,jairmessias.bolsonaro/211857482296579_1370373509778298/1370373509778298_2251905438193057,75771,5,2,1370373509778298_2251905438193057,data,fetched (200),2020-05-29 13:24:03.148486,Facebook:/<post-id>/comments,se fortaleca capitao    o brasil precisa de ti,2019-02-09T15:42:55+0000,12.0,0.0,
75792,jairmessias.bolsonaro/211857482296579_1370373509778298/1370373509778298_331510484131022,75796,5,2,1370373509778298_331510484131022,data,fetched (200),2020-05-29 13:24:03.402466,Facebook:/<post-id>/comments,forca e fe capitao  precisemos de vc aqui cuidando do nosso brasil   apesar de estar trabalhando mesmo no quarto de um hospital   guerreiro nosso presidente da republica jair messias bolsonaro   deus te abencoe com muita saude paz e luz    otima recuperacao  ,2019-02-09T15:40:32+0000,12.0,0.0,
75782,jairmessias.bolsonaro/211857482296579_1370373509778298/1370373509778298_394177531349881,75786,5,2,1370373509778298_394177531349881,data,fetched (200),2020-05-29 13:24:03.148486,Facebook:/<post-id>/comments,cancelamos no poder do nome de jesus  toda palavra de morte para o presidente   profetizamos a vida  e vida em abundancia ,2019-02-09T16:51:27+0000,12.0,0.0,
29013,jairmessias.bolsonaro/211857482296579_1663830393765940/1663830393765940_156602022254853,29019,3,2,1663830393765940_156602022254853,data,fetched (200),2020-05-29 13:12:41.335696,Facebook:/<post-id>/comments,to dentro ,2019-11-12T23:20:42+0000,12.0,1.0,
75776,jairmessias.bolsonaro/211857482296579_1370373509778298/1370373509778298_1044197695766331,75780,5,2,1370373509778298_1044197695766331,data,fetched (200),2020-05-29 13:24:03.148486,Facebook:/<post-id>/comments,quando o sr  puder comer o seu merecido bifao suculento  vamos fazer um churrasco especial aqui em casa para comemorar ,2019-02-09T17:15:48+0000,12.0,6.0,
75777,jairmessias.bolsonaro/211857482296579_1370373509778298/1370373509778298_252653635627020,75781,5,2,1370373509778298_252653635627020,data,fetched (200),2020-05-29 13:24:03.148486,Facebook:/<post-id>/comments,avante brasil  saude presidente  que bom ve lo tomando uma sopinha ,2019-02-09T15:40:20+0000,12.0,0.0,
75788,jairmessias.bolsonaro/211857482296579_1370373509778298/1370373509778298_934709223586116,75792,5,2,1370373509778298_934709223586116,data,fetched (200),2020-05-29 13:24:03.402466,Facebook:/<post-id>/comments,forca e fe presidente  continuo em oracao por sua vida  o brasil precisa de vc  ,2019-02-09T15:42:20+0000,12.0,0.0,
28982,jairmessias.bolsonaro/211857482296579_1663830393765940/1663830393765940_2401766876753711,28988,3,2,1663830393765940_2401766876753711,data,fetched (200),2020-05-29 13:12:40.972497,Facebook:/<post-id>/comments,santa catarina ja esta pronta para colher as assinaturas necessarias para isso    conte conosco  ,2019-11-12T22:43:34+0000,12.0,3.0,
75769,jairmessias.bolsonaro/211857482296579_1370373509778298/1370373509778298_790381244659371,75773,5,2,1370373509778298_790381244659371,data,fetched (200),2020-05-29 13:24:03.148486,Facebook:/<post-id>/comments,pelo ser humano especial que o senhor e e na esperanca de um brasil melhor   estou torcendo e orando pela sua pronta recuperacao ,2019-02-09T16:31:56+0000,11.0,0.0,
75780,jairmessias.bolsonaro/211857482296579_1370373509778298/1370373509778298_1487920218008266,75784,5,2,1370373509778298_1487920218008266,data,fetched (200),2020-05-29 13:24:03.148486,Facebook:/<post-id>/comments,vamos la capitao         o brasil precisa de vc        com certeza nao e um cara perfeito        mas acreditamos em seu carater para governar e ser o maestro da sua equipe de ministros          sabemos q existe uma longa jornada   mas com muuiiito trabalho vamos conseguir       brasil ira prosperar       ,2019-02-09T17:28:21+0000,11.0,0.0,
25505,jairmessias.bolsonaro/211857482296579_1663830393765940/1663830393765940_776513806131458,25511,3,2,1663830393765940_776513806131458,data,fetched (200),2020-05-29 13:11:50.050368,Facebook:/<post-id>/comments,arrumei meu titulo pra votar em bolsonaro e agora vou me filiar ao novo partido,2019-11-12T23:41:57+0000,11.0,0.0,
75801,jairmessias.bolsonaro/211857482296579_1370373509778298/1370373509778298_1599765980126913,75805,5,2,1370373509778298_1599765980126913,data,fetched (200),2020-05-29 13:24:03.402466,Facebook:/<post-id>/comments,deus no comando sempre  abencoe a todos da familia  bolsanaro presidente ,2019-02-09T15:53:26+0000,11.0,1.0,
75800,jairmessias.bolsonaro/211857482296579_1370373509778298/1370373509778298_771058369930411,75804,5,2,1370373509778298_771058369930411,data,fetched (200),2020-05-29 13:24:03.402466,Facebook:/<post-id>/comments,muito feliz pela evolucao do quadro da sua saude querido presidente  o senhor faz parte das oracoes diarias das pessoas de bem desse pais  o maus nao vencerao porque deus esta zelando pela sua saude  e nos somos so gratidao ao nosso amado deus   3  3,2019-02-09T21:31:55+0000,11.0,1.0,
26665,jairmessias.bolsonaro/211857482296579_1663830393765940/1663830393765940_1327917357387028,26671,3,2,1663830393765940_1327917357387028,data,fetched (200),2020-05-29 13:12:07.098510,Facebook:/<post-id>/comments,parabens e sucesso excelencia   conte sempre comigo  forca e honra  1sgt veterano da gloriosa e honrada pmesp ,2019-11-13T00:33:05+0000,11.0,0.0,
27121,jairmessias.bolsonaro/211857482296579_1663830393765940/1663830393765940_154407239109836,27127,3,2,1663830393765940_154407239109836,data,fetched (200),2020-05-29 13:12:13.292498,Facebook:/<post-id>/comments,isaque borba correa  bal  camboriu   conte comigo ,2019-11-12T23:06:25+0000,11.0,0.0,
75787,jairmessias.bolsonaro/211857482296579_1370373509778298/1370373509778298_2187516628244147,75791,5,2,1370373509778298_2187516628244147,data,fetched (200),2020-05-29 13:24:03.402466,Facebook:/<post-id>/comments,deus que te abencoe sempre presidente jair messias bolsonaro o sr e um presidente muito amado pelos brasileiros   3,2019-02-09T16:41:36+0000,11.0,0.0,
51,jairmessias.bolsonaro/211857482296579_1467409400074708/1467409400074708_318933789001320,58,2,2,1467409400074708_318933789001320,data,fetched (200),2020-05-29 13:05:21.483738,Facebook:/<post-id>/comments,um abraco pelo casamento do filho  e do enteado   que o casal seja muito feliz,2019-05-25T23:15:32+0000,11.0,0.0,
75774,jairmessias.bolsonaro/211857482296579_1370373509778298/1370373509778298_295259624521780,75778,5,2,1370373509778298_295259624521780,data,fetched (200),2020-05-29 13:24:03.148486,Facebook:/<post-id>/comments,que deus te abencoe sempre  estamos sim  torcendo pela sua recuperacao  por a nossa amada nacao como voce mesmo falou  o brasil precisa do nosso capitao de pe   foram 56 milhoes de brasileiros com voce  na esperanca de um dia melhor ,2019-02-09T16:25:58+0000,11.0,0.0,
29010,jairmessias.bolsonaro/211857482296579_1663830393765940/1663830393765940_1663834837098829,29016,3,2,1663830393765940_1663834837098829,data,fetched (200),2020-05-29 13:12:41.335696,Facebook:/<post-id>/comments,tamo junto,2019-11-12T22:33:28+0000,11.0,2.0,
75773,jairmessias.bolsonaro/211857482296579_1370373509778298/1370373509778298_758773977840556,75777,5,2,1370373509778298_758773977840556,data,fetched (200),2020-05-29 13:24:03.148486,Facebook:/<post-id>/comments,deus e maravilhoso bolsonaro  o brasil esta em oracao por voce   nos te amamos ,2019-02-09T15:54:50+0000,11.0,0.0,
25498,jairmessias.bolsonaro/211857482296579_1663830393765940/1663830393765940_198633441166544,25504,3,2,1663830393765940_198633441166544,data,fetched (200),2020-05-29 13:11:50.050368,Facebook:/<post-id>/comments,estamos juntos presidente  nunca foi pelo partido  mas pela sua lideranca ,2019-11-12T22:38:50+0000,11.0,2.0,
43320,jairmessias.bolsonaro/211857482296579_1663830393765940/1663830393765940_149894259609756,43326,3,2,1663830393765940_149894259609756,data,fetched (200),2020-05-29 13:16:14.925197,Facebook:/<post-id>/comments,avante capitao,2019-11-12T23:00:27+0000,10.0,0.0,
25495,jairmessias.bolsonaro/211857482296579_1663830393765940/1663830393765940_1510449092427783,25501,3,2,1663830393765940_1510449092427783,data,fetched (200),2020-05-29 13:11:50.050368,Facebook:/<post-id>/comments,eu havia me filiado no psl por sua causa presidente agora vou pedir minha desfiliacao ,2019-11-12T23:06:00+0000,10.0,1.0,
98131,jairmessias.bolsonaro/211857482296579_1370373509778298/1370373509778298_115770056201703,98135,5,2,1370373509778298_115770056201703,data,fetched (200),2020-05-29 13:29:21.609942,Facebook:/<post-id>/comments,que bom ver o presidente voltando a se alimentar,2019-02-09T16:11:05+0000,10.0,0.0,
43391,jairmessias.bolsonaro/211857482296579_1663830393765940/1663830393765940_158892898544639,43397,3,2,1663830393765940_158892898544639,data,fetched (200),2020-05-29 13:16:15.984600,Facebook:/<post-id>/comments,iremos aonde o presidente for  tchau  psl ,2019-11-13T00:38:45+0000,10.0,0.0,
95274,jairmessias.bolsonaro/211857482296579_1370373509778298/1370373509778298_309894123044191,95278,5,2,1370373509778298_309894123044191,data,fetched (200),2020-05-29 13:28:40.362845,Facebook:/<post-id>/comments,deus eh contigo  meu presidente ,2019-02-09T16:11:20+0000,10.0,0.0,
25518,jairmessias.bolsonaro/211857482296579_1663830393765940/1663830393765940_1663837170431929,25524,3,2,1663830393765940_1663837170431929,data,fetched (200),2020-05-29 13:11:50.332296,Facebook:/<post-id>/comments,a fala deveria ser   agradeco aos amigos do psl   e aos que usaram meu nome e depois viraram as costas  ,2019-11-12T22:33:54+0000,10.0,0.0,
75789,jairmessias.bolsonaro/211857482296579_1370373509778298/1370373509778298_2145123575798206,75793,5,2,1370373509778298_2145123575798206,data,fetched (200),2020-05-29 13:24:03.402466,Facebook:/<post-id>/comments,#forcapresidente  vamos rezar sempre  pelo senhor e pelo brasil  aguerra e espiritual tambem ,2019-02-09T17:06:54+0000,10.0,0.0,
75805,jairmessias.bolsonaro/211857482296579_1370373509778298/1370373509778298_934713160252389,75809,5,2,1370373509778298_934713160252389,data,fetched (200),2020-05-29 13:24:03.402466,Facebook:/<post-id>/comments,deus tem um plano em sua vida capitao  e sera cumprido  bom almoco ,2019-02-09T15:48:01+0000,10.0,0.0,
52553,jairmessias.bolsonaro/211857482296579_1475667249248923/1475667249248923_1475671822581799,52558,4,2,1475667249248923_1475671822581799,data,fetched (200),2020-05-29 13:18:26.993017,Facebook:/<post-id>/comments,amado pelas criancas  que bencao ,2019-06-03T02:22:29+0000,10.0,0.0,
75814,jairmessias.bolsonaro/211857482296579_1370373509778298/1370373509778298_401985887277623,75818,5,2,1370373509778298_401985887277623,data,fetched (200),2020-05-29 13:24:03.760211,Facebook:/<post-id>/comments,glorias a deus  deus te levantou para salvar essa nacao e com certeza ele te conduzira todos os dias da sua vida  ,2019-02-09T15:41:30+0000,10.0,0.0,
75815,jairmessias.bolsonaro/211857482296579_1370373509778298/1370373509778298_1987354527980018,75819,5,2,1370373509778298_1987354527980018,data,fetched (200),2020-05-29 13:24:03.760211,Facebook:/<post-id>/comments,nao pode celular na mesa na hora da comida  muleke     somos muitos desejando que se restabeleca e esteja forte para as batalhas que temos que enfrentar ,2019-02-09T16:05:25+0000,10.0,0.0,
26509,jairmessias.bolsonaro/211857482296579_1663830393765940/1663830393765940_198635561166332,26515,3,2,1663830393765940_198635561166332,data,fetched (200),2020-05-29 13:12:05.038266,Facebook:/<post-id>/comments,corumba ms estara sempre junto com voce presidente ,2019-11-12T22:42:26+0000,10.0,4.0,
50642,jairmessias.bolsonaro/211857482296579_1475667249248923/1475667249248923_583125385542930,50647,4,2,1475667249248923_583125385542930,data,fetched (200),2020-05-29 13:18:00.316578,Facebook:/<post-id>/comments,depois me perguntam pq eu me orgulho dele  kkkkkk te amo mito ,2019-06-03T12:13:49+0000,10.0,0.0,
50641,jairmessias.bolsonaro/211857482296579_1475667249248923/1475667249248923_138017974044702,50646,4,2,1475667249248923_138017974044702,data,fetched (200),2020-05-29 13:18:00.316578,Facebook:/<post-id>/comments,parabens presidente  mostrando  aos pequenos   simplicidade  amor e bondade e que teremos futuras pessoas de bem ,2019-06-03T02:40:35+0000,9.0,0.0,
102198,jairmessias.bolsonaro/211857482296579_1512227452259569/1512227452259569_1512228588926122,102201,8,2,1512227452259569_1512228588926122,data,fetched (200),2020-05-29 13:30:22.966862,Facebook:/<post-id>/comments,boa noite presidente  uma otima semana ao senhor  #selva ,2019-07-08T01:02:21+0000,9.0,0.0,
114497,jairmessias.bolsonaro/211857482296579_1512227452259569/1512227452259569_463453901109389,114500,8,2,1512227452259569_463453901109389,data,fetched (200),2020-05-29 13:33:22.064773,Facebook:/<post-id>/comments,meu presidente e pe quente demais  brasil acima de tudo  deus acima de todos  ,2019-07-08T01:18:37+0000,9.0,0.0,
25488,jairmessias.bolsonaro/211857482296579_1663830393765940/1663830393765940_144847363469280,25494,3,2,1663830393765940_144847363469280,data,fetched (200),2020-05-29 13:11:50.050368,Facebook:/<post-id>/comments,sou caminhoneiro vou me desfiliar do psl e me filiar  ao apb,2019-11-12T23:10:10+0000,9.0,0.0,
29044,jairmessias.bolsonaro/211857482296579_1663830393765940/1663830393765940_791537481302628,29050,3,2,1663830393765940_791537481302628,data,fetched (200),2020-05-29 13:12:41.720273,Facebook:/<post-id>/comments,fim do psl  sem bolsonaro eles nao sao nada ,2019-11-13T01:09:02+0000,9.0,0.0,
29041,jairmessias.bolsonaro/211857482296579_1663830393765940/1663830393765940_2401767853420280,29047,3,2,1663830393765940_2401767853420280,data,fetched (200),2020-05-29 13:12:41.720273,Facebook:/<post-id>/comments,manda o formulario para assinatura  criamos isso em tres dias uteis ,2019-11-12T22:44:36+0000,9.0,1.0,
29016,jairmessias.bolsonaro/211857482296579_1663830393765940/1663830393765940_738958456607647,29022,3,2,1663830393765940_738958456607647,data,fetched (200),2020-05-29 13:12:41.335696,Facebook:/<post-id>/comments,boa presidente fiz campanha ha 2 anos atras para sua candidatura  falava para o vento  e agora vejo o sr com seu partido  gostaria de me filiar  sucesso para nos brasileiros do bem ,2019-11-12T23:31:23+0000,9.0,1.0,
75841,jairmessias.bolsonaro/211857482296579_1370373509778298/1370373509778298_142143783477460,75845,5,2,1370373509778298_142143783477460,data,fetched (200),2020-05-29 13:24:04.139448,Facebook:/<post-id>/comments,nosso presidente    nosso idolo  deus esta e sempre e estara   ao seu lado    abracos respeitosos,2019-02-09T16:16:59+0000,9.0,0.0,
89893,jairmessias.bolsonaro/211857482296579_1370373509778298/1370373509778298_115263309576622,89897,5,2,1370373509778298_115263309576622,data,fetched (200),2020-05-29 13:27:23.760492,Facebook:/<post-id>/comments,boa recuperacao e deus o abencoe  presidente ,2019-02-09T16:03:47+0000,9.0,0.0,
27292,jairmessias.bolsonaro/211857482296579_1663830393765940/1663830393765940_144840530136630,27298,3,2,1663830393765940_144840530136630,data,fetched (200),2020-05-29 13:12:15.959892,Facebook:/<post-id>/comments,agora e trabalhar para garantir as 492 mil assinaturas e homologar o partido  desejo sucesso a todos nos  ,2019-11-12T22:42:19+0000,9.0,0.0,
27241,jairmessias.bolsonaro/211857482296579_1663830393765940/1663830393765940_1663833043765675,27247,3,2,1663830393765940_1663833043765675,data,fetched (200),2020-05-29 13:12:15.078956,Facebook:/<post-id>/comments,robo paulo lima colocando  me a disposicao,2019-11-12T22:33:05+0000,9.0,2.0,
25548,jairmessias.bolsonaro/211857482296579_1663830393765940/1663830393765940_415346022479642,25554,3,2,1663830393765940_415346022479642,data,fetched (200),2020-05-29 13:11:50.727732,Facebook:/<post-id>/comments,nunca defendi partido  em todas as conversas que tive com amigos era em apoio a voce e agora  ja que saiu do psl  so tenho uma coisa a falar  booora pra frente  pois nao parei de apoia lo,2019-11-12T23:31:18+0000,9.0,0.0,
92696,jairmessias.bolsonaro/211857482296579_1370373509778298/1370373509778298_401994000610145,92700,5,2,1370373509778298_401994000610145,data,fetched (200),2020-05-29 13:28:03.551611,Facebook:/<post-id>/comments,forca jair  deus e  contigo,2019-02-09T15:54:24+0000,9.0,0.0,
75808,jairmessias.bolsonaro/211857482296579_1370373509778298/1370373509778298_1044210729098361,75812,5,2,1370373509778298_1044210729098361,data,fetched (200),2020-05-29 13:24:03.402466,Facebook:/<post-id>/comments,meu presidente  sou seu defensor  e espero que seus  projetos de governo para o brasil continue firme e forte que nem a sua energia   aqui vamos fazendo a nossa parte  nao interessa se a esquerda teimar em se fazer de vitima  eles tiveram a chance deles e nada fizeram pelo povo brasileiro  venha firme  meu capitao   apoiamos tudo o que vier do seu comando ,2019-02-09T17:38:33+0000,9.0,0.0,
75816,jairmessias.bolsonaro/211857482296579_1370373509778298/1370373509778298_2206652379586393,75820,5,2,1370373509778298_2206652379586393,data,fetched (200),2020-05-29 13:24:03.760211,Facebook:/<post-id>/comments,siga em frente presidente messias bolsonaro  nada de ansiedade  o senhor ja tomou posse  agora  repouse  nao cometa exageros fisicos  o brasil precisa do senhor recuperado  vamos todos juntos recuperar nosso pavilhao e fazer desta patria uma grande nacao ,2019-02-09T15:56:02+0000,9.0,0.0,
75859,jairmessias.bolsonaro/211857482296579_1370373509778298/1370373509778298_401999337276278,75863,5,2,1370373509778298_401999337276278,data,fetched (200),2020-05-29 13:24:04.139448,Facebook:/<post-id>/comments,meu coracao transborda de felicidades em ve lo saudavel   tmj presidente ,2019-02-09T16:05:05+0000,9.0,0.0,
25525,jairmessias.bolsonaro/211857482296579_1663830393765940/1663830393765940_100307451421043,25531,3,2,1663830393765940_100307451421043,data,fetched (200),2020-05-29 13:11:50.332296,Facebook:/<post-id>/comments,se quiserem sugestao pra logo do novo partido ai esta  forte abraco ,2019-11-13T01:08:40+0000,9.0,6.0,
75802,jairmessias.bolsonaro/211857482296579_1370373509778298/1370373509778298_1370380386444277,75806,5,2,1370373509778298_1370380386444277,data,fetched (200),2020-05-29 13:24:03.402466,Facebook:/<post-id>/comments,confesso que tenho ficado mais com medo do mourao  volta logo presidente,2019-02-09T15:36:18+0000,9.0,3.0,
75790,jairmessias.bolsonaro/211857482296579_1370373509778298/1370373509778298_115879486201592,75794,5,2,1370373509778298_115879486201592,data,fetched (200),2020-05-29 13:24:03.402466,Facebook:/<post-id>/comments,que alegria  deus abencoe sua refeicao  que ela fortaleca alem do seu fisico  fortaleca sua alma  querido bolsonaro    ,2019-02-09T15:53:59+0000,9.0,1.0,
75791,jairmessias.bolsonaro/211857482296579_1370373509778298/1370373509778298_982762005252387,75795,5,2,1370373509778298_982762005252387,data,fetched (200),2020-05-29 13:24:03.402466,Facebook:/<post-id>/comments,a luta esta sendo grande mas as vitorias serao maiores  deus  continua abencoando sua vida  sr presidente bolsonaro  o brasil precisa de voce sr presidente bolsonaro,2019-02-09T15:45:55+0000,9.0,0.0,
25534,jairmessias.bolsonaro/211857482296579_1663830393765940/1663830393765940_2705407226193781,25540,3,2,1663830393765940_2705407226193781,data,fetched (200),2020-05-29 13:11:50.332296,Facebook:/<post-id>/comments,aonde assino presidente ,2019-11-12T22:40:59+0000,9.0,1.0,
25502,jairmessias.bolsonaro/211857482296579_1663830393765940/1663830393765940_2705414432859727,25508,3,2,1663830393765940_2705414432859727,data,fetched (200),2020-05-29 13:11:50.050368,Facebook:/<post-id>/comments,longe de mim ser afoito  mas    como faco pra me filiar   ,2019-11-12T22:45:28+0000,9.0,2.0,
75796,jairmessias.bolsonaro/211857482296579_1370373509778298/1370373509778298_256259105264337,75800,5,2,1370373509778298_256259105264337,data,fetched (200),2020-05-29 13:24:03.402466,Facebook:/<post-id>/comments,gloria a deus pela sua recuperacao presidente  continuaremos orando por vc  sua familia e o pelo nosso amado brasil ,2019-02-09T18:21:58+0000,9.0,0.0,
26408,jairmessias.bolsonaro/211857482296579_1663830393765940/1663830393765940_579195976153881,26414,3,2,1663830393765940_579195976153881,data,fetched (200),2020-05-29 13:12:03.643292,Facebook:/<post-id>/comments,estamos juntos presidente jair messias bolsonaro deus continue te abencoando em nome do senhor jesus cristo,2019-11-12T22:35:04+0000,8.0,1.0,
49478,jairmessias.bolsonaro/211857482296579_1663830393765940/1663830393765940_2454208848183974,49484,3,2,1663830393765940_2454208848183974,data,fetched (200),2020-05-29 13:17:43.356127,Facebook:/<post-id>/comments,boa presidente o proprio partido estava tantando te derrubar  tava certo tinha que sair fora msm,2019-11-13T01:43:39+0000,8.0,0.0,
25522,jairmessias.bolsonaro/211857482296579_1663830393765940/1663830393765940_1008990342774504,25528,3,2,1663830393765940_1008990342774504,data,fetched (200),2020-05-29 13:11:50.332296,Facebook:/<post-id>/comments,melhor decisao porque um monte ali depois de se eleger foram traidores coloque pessoas que voce possa confiar e isso e em qualquer momento paz ou conflito,2019-11-12T23:24:57+0000,8.0,0.0,
27249,jairmessias.bolsonaro/211857482296579_1663830393765940/1663830393765940_1510450859094273,27255,3,2,1663830393765940_1510450859094273,data,fetched (200),2020-05-29 13:12:15.078956,Facebook:/<post-id>/comments,nao votei no psl  votei em jair messias bolsonaro  por acreditar  em sua ideia de administracao para o bem do brasil e nao me arrependo  ao contrario  pela primeira vez em minha vida  tenho orgulho do meu voto e do presidente que ajudei a eleger  estamos juntos  capitao    #bolsonaro2022,2019-11-12T23:08:31+0000,8.0,2.0,
25538,jairmessias.bolsonaro/211857482296579_1663830393765940/1663830393765940_2385051941744022,25544,3,2,1663830393765940_2385051941744022,data,fetched (200),2020-05-29 13:11:50.727732,Facebook:/<post-id>/comments,vou me filiar pela primeira  vez as 53 anos ,2019-11-12T22:49:00+0000,8.0,0.0,
25500,jairmessias.bolsonaro/211857482296579_1663830393765940/1663830393765940_103151967758710,25506,3,2,1663830393765940_103151967758710,data,fetched (200),2020-05-29 13:11:50.050368,Facebook:/<post-id>/comments,partido alianca pelo brasil,2019-11-12T23:04:41+0000,8.0,6.0,
25583,jairmessias.bolsonaro/211857482296579_1663830393765940/1663830393765940_175321816857378,25589,3,2,1663830393765940_175321816857378,data,fetched (200),2020-05-29 13:11:51.193451,Facebook:/<post-id>/comments,foi nesse dia  presidente ,2019-11-13T01:30:38+0000,8.0,1.0,
25561,jairmessias.bolsonaro/211857482296579_1663830393765940/1663830393765940_144836806803669,25567,3,2,1663830393765940_144836806803669,data,fetched (200),2020-05-29 13:11:50.727732,Facebook:/<post-id>/comments,onde assinamos  boa decisao presidente  ,2019-11-12T22:37:16+0000,8.0,0.0,
101130,jairmessias.bolsonaro/211857482296579_1512227452259569/1512227452259569_612516282604269,101133,8,2,1512227452259569_612516282604269,data,fetched (200),2020-05-29 13:30:05.666736,Facebook:/<post-id>/comments,tite falando  ainn o presidente foi no estadio de futebol   ainn meus jogadores chamaram ele pra foto e gritaram mito mito mito    ainn magoei   vou tirar do time todo mundo que gritou mito mito mito    kkkkkk,2019-07-08T01:07:47+0000,8.0,0.0,
25542,jairmessias.bolsonaro/211857482296579_1663830393765940/1663830393765940_154403402443553,25548,3,2,1663830393765940_154403402443553,data,fetched (200),2020-05-29 13:11:50.727732,Facebook:/<post-id>/comments,conta comigo e com 75 por cento da cidade de paraiso do tocantins,2019-11-12T22:48:47+0000,8.0,2.0,
29192,jairmessias.bolsonaro/211857482296579_1663830393765940/1663830393765940_246759729631948,29198,3,2,1663830393765940_246759729631948,data,fetched (200),2020-05-29 13:12:43.767039,Facebook:/<post-id>/comments,por nada presidente  estou a disposicao ,2019-11-12T23:37:54+0000,8.0,11.0,
43387,jairmessias.bolsonaro/211857482296579_1663830393765940/1663830393765940_793090934465520,43393,3,2,1663830393765940_793090934465520,data,fetched (200),2020-05-29 13:16:15.984600,Facebook:/<post-id>/comments,vamos fazer uma alianca de verdade   1  filiados ao partido somente com curriculo e reputacao ilibada   2  candidatos e partido abrindo mao do fundo partidario e fundo eleitoral  a mudanca que o brasil deseja deve partir do bom exemplo  vamos limpar esta nacao dos maus costumes  que tal comecarmos limpando a propria casa  curtam e comentem para o comentario ter relevancia e poder ser comentado pelo nosso presidente e demais partidarios ,2019-11-12T22:51:02+0000,8.0,0.0,
25486,jairmessias.bolsonaro/211857482296579_1663830393765940/1663830393765940_102170517864015,25492,3,2,1663830393765940_102170517864015,data,fetched (200),2020-05-29 13:11:50.050368,Facebook:/<post-id>/comments,unidos pelo brasil ,2019-11-12T23:50:56+0000,8.0,2.0,
102291,jairmessias.bolsonaro/211857482296579_1512227452259569/1512227452259569_170314313998546,102294,8,2,1512227452259569_170314313998546,data,fetched (200),2020-05-29 13:30:24.585824,Facebook:/<post-id>/comments,ate a foice,2019-07-08T01:14:05+0000,8.0,1.0,
75760,jairmessias.bolsonaro/211857482296579_1370373509778298/1370373509778298_284710548869738,75764,5,2,1370373509778298_284710548869738,data,fetched (200),2020-05-29 13:24:03.148486,Facebook:/<post-id>/comments,que hospital porcaria  todo mundo sabe que sabadao e dia de feijoada  po ,2019-02-09T18:19:38+0000,8.0,0.0,
