,path,id,parent_id,level,object_id,object_type,query_status,query_time,query_type,message,created_time,like_count,comment_count,error.message
62144,211857482296579_1634149506734029/211857482296579_1411377829011199/1411377829011199_397891007674904,62148,5,2,1411377829011199_397891007674904,data,fetched (200),2020-06-02 20:35:50.749335,Facebook:/<post-id>/comments,fico pasma com essas revistas   nao sei como bolsonaro aguenta tanto mimimi    deem paz pro homem meu deus   o homem nao pode nem cagar em paz que e capaz de sair um jornalista mediocre do vaso pra ver se a bosta ta dura ou mole   e depois noticiar  ,2019-03-29T18:36:47+0000,3.0,0.0,
62117,211857482296579_1634149506734029/211857482296579_1411377829011199/1411377829011199_1411393022343013,62121,5,2,1411377829011199_1411393022343013,data,fetched (200),2020-06-02 20:35:50.475200,Facebook:/<post-id>/comments,bolsonaro comeu mais que todo mundo   kkkk  mitoooo vai pra cima arregacaaaaa e chega primeiro mesmo quem esta preso nao pode nem ir kkkkkk,2019-03-29T17:30:38+0000,3.0,0.0,
62101,211857482296579_1634149506734029/211857482296579_1411377829011199/1411377829011199_2363082093935164,62105,5,2,1411377829011199_2363082093935164,data,fetched (200),2020-06-02 20:35:50.124879,Facebook:/<post-id>/comments,lula chega ao presidio antes de temer ,2019-03-29T19:08:54+0000,3.0,0.0,
99381,jairmessias.bolsonaro/211857482296579_1375671095915206/1375671095915206_821515051515567,27364,3,2,1375671095915206_821515051515567,data,fetched (200),2020-06-02 20:26:56.252887,Facebook:/<post-id>/comments,renato fernandes dos santos olha o que voce falou ,2019-02-14T23:25:45+0000,3.0,1.0,
99769,jairmessias.bolsonaro/211857482296579_1375671095915206/1375671095915206_2214340028821525,27752,3,2,1375671095915206_2214340028821525,data,fetched (200),2020-06-02 20:27:04.434677,Facebook:/<post-id>/comments,se palmeiras da um kit oficial para o jair messias bolsonaro   ps  sou clube do remo ,2019-02-15T00:16:48+0000,3.0,0.0,
36146,211857482296579_1634149506734029/211857482296579_1364988146983501/1364988146983501_372699366643442,36151,4,2,1364988146983501_372699366643442,data,fetched (200),2020-06-02 20:29:28.280613,Facebook:/<post-id>/comments,amo mto e votaria 100000 de vezes  nunca fiquei tao satisfeita com um resultado de eleicao como esse  faco parte do exercito do capitao ,2019-02-04T00:44:17+0000,3.0,0.0,
35848,211857482296579_1634149506734029/211857482296579_1364988146983501/1364988146983501_1661649310601263,35853,4,2,1364988146983501_1661649310601263,data,fetched (200),2020-06-02 20:29:24.095463,Facebook:/<post-id>/comments,domingo a noite  chuva em sc  ai vem o presidente e sarcastico nos faz rir  mentira   kkk imaginei a voz dele   boa noite presidente e boa recuperacao ,2019-02-04T00:23:58+0000,3.0,0.0,
35572,211857482296579_1634149506734029/211857482296579_1364988146983501/1364988146983501_817978885211656,35577,4,2,1364988146983501_817978885211656,data,fetched (200),2020-06-02 20:29:19.939780,Facebook:/<post-id>/comments,o homi manda na p rra toda  ta no hospital se recuperando e ainda arranja tempo pra desmentir as falacias da galera       mito  sim    melhor presidente de sempre  tbm    eleicoes 2022  17     ,2019-02-03T23:38:34+0000,3.0,0.0,
52953,211857482296579_1634149506734029/211857482296579_1411377829011199/1411377829011199_2363090997267607,52957,5,2,1411377829011199_2363090997267607,data,fetched (200),2020-06-02 20:33:37.276990,Facebook:/<post-id>/comments,eu ja cheguei em velorio antes do defunto estava marcado o velorio para as 8 horas e a funeraria so chegou com o corpo as 8 30,2019-03-29T19:31:30+0000,3.0,1.0,
91424,jairmessias.bolsonaro/211857482296579_1375671095915206/1375671095915206_100560247743528,19407,3,2,1375671095915206_100560247743528,data,fetched (200),2020-06-02 20:25:02.432192,Facebook:/<post-id>/comments,essa camisa e a unica coisa que lhe deixa feio  te amo ,2019-02-14T23:22:37+0000,3.0,0.0,
107526,jairmessias.bolsonaro/211857482296579_1364988146983501/1364988146983501_1365001510315498,35508,4,2,1364988146983501_1365001510315498,data,fetched (200),2020-06-02 20:29:18.798096,Facebook:/<post-id>/comments,ja cagou  presidente  estou preocupado ,2019-02-03T23:33:40+0000,3.0,1.0,
52947,211857482296579_1634149506734029/211857482296579_1411377829011199/1411377829011199_1411385115677137,52951,5,2,1411377829011199_1411385115677137,data,fetched (200),2020-06-02 20:33:37.276990,Facebook:/<post-id>/comments,comassim    o presidente quer tirar o brilho do aniversariante    mesmo depois de ir ao cinema com a esposa   pra assistir um filme cristao com acessibilidade    e presidente    tua batata ta assando hauhauahaiahaiahq   ,2019-03-29T17:26:51+0000,3.0,3.0,
35666,211857482296579_1634149506734029/211857482296579_1364988146983501/1364988146983501_297043434335258,35671,4,2,1364988146983501_297043434335258,data,fetched (200),2020-06-02 20:29:21.485166,Facebook:/<post-id>/comments,por favor sr  presidente   repouse  fique um pouco off line   queremos que o senhor volte com muita saude   a nacao brasileira do bem te aguarda e te ama  fique com deus ,2019-02-04T00:10:36+0000,3.0,2.0,
85093,jairmessias.bolsonaro/211857482296579_1634149506734029/1634149506734029_139362440720778,13077,2,2,1634149506734029_139362440720778,data,fetched (200),2020-06-02 20:23:20.457314,Facebook:/<post-id>/comments,a credibilidade da folha e tao  pequena  tal qual a noticia  do que o presidente come ou deixa de comer mas e o retrato de que nosso pais  precisa mudar e muito em todos os acontecimentos da viagem do nosso presidente    a folha so viu este detalhe  as universidades estao  deixando a desejar  cade  a competencia  dessa gente   pelo o jeito vai vira um jornaleco de quinta ,2019-10-23T14:25:49+0000,3.0,1.0,
134271,jairmessias.bolsonaro/211857482296579_1411377829011199/1411377829011199_2391884774367925,62252,5,2,1411377829011199_2391884774367925,data,fetched (200),2020-06-02 20:35:52.296084,Facebook:/<post-id>/comments,mediocre esse jornalismo brasileiro   desespero total ,2019-03-29T21:17:02+0000,3.0,0.0,
134251,jairmessias.bolsonaro/211857482296579_1411377829011199/1411377829011199_1046918328839847,62232,5,2,1411377829011199_1046918328839847,data,fetched (200),2020-06-02 20:35:52.010980,Facebook:/<post-id>/comments,que midia podre hem meu presidente  o que nao fazem para prejudicar uma pessoa quando nao recebem propina hem    tem que fechar estas empresas de folhetim  boa sorte meu presidente  o povo esta a seu lado para o que der e vier    conte conosco  grande abraco e #bolsonaro2022  #ptnuncamais,2019-03-29T18:09:17+0000,3.0,0.0,
15521,211857482296579_1634149506734029/1634149506734029_1634151733400473/1634149506734029_120206849393027,15528,2,2,1634149506734029_120206849393027,data,fetched (200),2020-06-02 20:24:01.059422,Facebook:/<post-id>/comments,kkkk ta perdoado,2019-10-23T13:22:50+0000,3.0,0.0,
15350,211857482296579_1634149506734029/1634149506734029_1634151733400473/1634149506734029_674478992961934,15357,2,2,1634149506734029_674478992961934,data,fetched (200),2020-06-02 20:23:58.569391,Facebook:/<post-id>/comments,ele que e esperto  peixe cru pode dar vermes     proxima vez leva coxinha do brasil   ,2019-10-23T13:16:57+0000,3.0,0.0,
87656,jairmessias.bolsonaro/211857482296579_1634149506734029/1634149506734029_550479705686287,15640,2,2,1634149506734029_550479705686287,data,fetched (200),2020-06-02 20:24:02.777712,Facebook:/<post-id>/comments,vao reclamar q e peixefobico ,2019-10-23T13:21:47+0000,3.0,1.0,
87607,jairmessias.bolsonaro/211857482296579_1634149506734029/1634149506734029_120223466058032,15591,2,2,1634149506734029_120223466058032,data,fetched (200),2020-06-02 20:24:02.070098,Facebook:/<post-id>/comments,esse bolsonaro  kkkkkk,2019-10-23T13:50:18+0000,3.0,0.0,
111553,jairmessias.bolsonaro/211857482296579_1364988146983501/1364988146983501_1661687063930821,39535,4,2,1364988146983501_1661687063930821,data,fetched (200),2020-06-02 20:30:17.662011,Facebook:/<post-id>/comments,forca capitao  deve ser coisa do pt e companhia ,2019-02-04T01:09:17+0000,3.0,0.0,
96526,jairmessias.bolsonaro/211857482296579_1375671095915206/1375671095915206_2259015481046327,24509,3,2,1375671095915206_2259015481046327,data,fetched (200),2020-06-02 20:26:16.341205,Facebook:/<post-id>/comments,e da vinte e cinco de marco kkkkkk,2019-02-15T00:39:57+0000,3.0,0.0,
111565,jairmessias.bolsonaro/211857482296579_1364988146983501/1364988146983501_1364988813650101,39547,4,2,1364988146983501_1364988813650101,data,fetched (200),2020-06-02 20:30:18.032571,Facebook:/<post-id>/comments,quem e esse ator  alguem me fale    ,2019-02-03T23:31:16+0000,3.0,2.0,
67571,211857482296579_1634149506734029/211857482296579_1466315963517385/1466315963517385_1466324093516572,67574,7,2,1466315963517385_1466324093516572,data,fetched (200),2020-06-02 20:37:17.308303,Facebook:/<post-id>/comments,#bolsonaronossopresidente,2019-05-24T21:04:12+0000,3.0,0.0,
52988,211857482296579_1634149506734029/211857482296579_1411377829011199/1411377829011199_2317520478517382,52992,5,2,1411377829011199_2317520478517382,data,fetched (200),2020-06-02 20:33:38.098300,Facebook:/<post-id>/comments,proxima noticia  bolsonaro usa banheiro da camara federal  em visita ao legislativo e nao da descarga  ,2019-03-29T23:09:16+0000,3.0,0.0,
14273,211857482296579_1634149506734029/1634149506734029_1634151733400473/1634149506734029_674473179629182,14280,2,2,1634149506734029_674473179629182,data,fetched (200),2020-06-02 20:23:42.585807,Facebook:/<post-id>/comments,esse jornal e uma vergonha para o povo brasileiro ,2019-10-23T13:12:27+0000,3.0,0.0,
67845,211857482296579_1634149506734029/211857482296579_1466315963517385/1466315963517385_1466316530183995,67848,7,2,1466315963517385_1466316530183995,data,fetched (200),2020-06-02 20:37:21.220515,Facebook:/<post-id>/comments,,2019-05-24T21:01:13+0000,3.0,0.0,
14148,211857482296579_1634149506734029/1634149506734029_1634151733400473/1634149506734029_542674979857586,14155,2,2,1634149506734029_542674979857586,data,fetched (200),2020-06-02 20:23:40.575773,Facebook:/<post-id>/comments,folha de sao paulo   vc e tao mediocre que certamente so agrada os muares da ptzada porque sao vazios  futeis e baixa escolaridade ,2019-10-23T13:33:36+0000,3.0,1.0,
14135,211857482296579_1634149506734029/1634149506734029_1634151733400473/1634149506734029_550487785685479,14142,2,2,1634149506734029_550487785685479,data,fetched (200),2020-06-02 20:23:40.138895,Facebook:/<post-id>/comments,tanta coisa importante pra noticiar e este jornaleco preocupado com o que o presidente comeu   aff aja paciencia  e isso ai meu presidente  eu tbm nao gosto de comida japonesa e ate onde sei isso nao muda o carater de ninguem ,2019-10-23T13:32:09+0000,3.0,0.0,
87817,jairmessias.bolsonaro/211857482296579_1634149506734029/1634149506734029_550479562352968,15801,2,2,1634149506734029_550479562352968,data,fetched (200),2020-06-02 20:24:05.052564,Facebook:/<post-id>/comments, jornalista cretino    nem em jornalzinho de colegio sai coisa tao futil    deve ser mais uma cria da educacao  geracao pt ,2019-10-23T13:21:34+0000,3.0,0.0,
30071,211857482296579_1634149506734029/211857482296579_1375671095915206/1375671095915206_148292266176292,30077,3,2,1375671095915206_148292266176292,data,fetched (200),2020-06-02 20:27:43.649633,Facebook:/<post-id>/comments,e o lula  que comprou um dvd pirata pra assistir o proprio filme ,2019-02-15T00:58:43+0000,3.0,0.0,
100905,jairmessias.bolsonaro/211857482296579_1375671095915206/1375671095915206_179826106342089,28888,3,2,1375671095915206_179826106342089,data,fetched (200),2020-06-02 20:27:26.253353,Facebook:/<post-id>/comments,e muito mito    ,2019-02-14T23:21:09+0000,3.0,0.0,
30140,211857482296579_1634149506734029/211857482296579_1375671095915206/1375671095915206_545539832596132,30146,3,2,1375671095915206_545539832596132,data,fetched (200),2020-06-02 20:27:44.771140,Facebook:/<post-id>/comments,esse homem sabe mesmo poupar pagou so 10 reais na camisa kkkkk esse bolsonaro e mito mesmo kkkkk,2019-02-14T23:55:35+0000,3.0,2.0,
47553,211857482296579_1634149506734029/211857482296579_1364988146983501/1364988146983501_338054436808895,47558,4,2,1364988146983501_338054436808895,data,fetched (200),2020-06-02 20:32:15.694674,Facebook:/<post-id>/comments,esse tipo de besteira nao era nem pra chegar no senhor  faca um sac  servico de atendimento a cumunista  e contrate o coxinha como atendente ,2019-02-03T23:51:15+0000,3.0,0.0,
88469,jairmessias.bolsonaro/211857482296579_1634149506734029/1634149506734029_1634160386732941,16453,2,2,1634149506734029_1634160386732941,data,fetched (200),2020-06-02 20:24:18.032856,Facebook:/<post-id>/comments,midia lixo ,2019-10-23T13:10:48+0000,3.0,0.0,
88462,jairmessias.bolsonaro/211857482296579_1634149506734029/1634149506734029_674474402962393,16446,2,2,1634149506734029_674474402962393,data,fetched (200),2020-06-02 20:24:18.032856,Facebook:/<post-id>/comments, urgente   no proximo fim de semana  dias 29 e 30  nas manifestacoes da esquerda  juntos  psol  contra bolsonaro  a esquerda vai colocar black blocs disfarcados com camisas do bolsonaro  pra agredir mulheres nas ruas e criar imagens de impacto contra bolsonaro   divulguem isso em todas as redes sociais  so assim eles pensarao antes de fazer isso e todas as pessoas ja estarao sabendo que e armacao dos esquerdopatas  ,2019-10-23T13:13:11+0000,3.0,0.0,
16541,211857482296579_1634149506734029/1634149506734029_1634151733400473/1634149506734029_163038214760485,16548,2,2,1634149506734029_163038214760485,data,fetched (200),2020-06-02 20:24:19.587927,Facebook:/<post-id>/comments,essa #impresalixo da nojo,2019-10-24T08:42:14+0000,3.0,0.0,
88357,jairmessias.bolsonaro/211857482296579_1634149506734029/1634149506734029_2357319467866218,16341,2,2,1634149506734029_2357319467866218,data,fetched (200),2020-06-02 20:24:16.497862,Facebook:/<post-id>/comments,e os bobos piram achando que o brasil esta bem porque temos um presidente que come macarrao instantaneo    votei no cara pra evitar mais quatro anos de pt  sou de direita  conservador  mas nosso presidente e um perfeito imbecil  os filhos entao   ,2019-10-23T13:36:31+0000,3.0,1.0,
129883,jairmessias.bolsonaro/211857482296579_1411377829011199/1411377829011199_2363108180599222,57864,5,2,1411377829011199_2363108180599222,data,fetched (200),2020-06-02 20:34:48.465764,Facebook:/<post-id>/comments,falta do que fazer,2019-03-29T20:13:27+0000,3.0,0.0,
50430,211857482296579_1634149506734029/211857482296579_1364988146983501/1364988146983501_149472715934718,50435,4,2,1364988146983501_149472715934718,data,fetched (200),2020-06-02 20:33:01.050455,Facebook:/<post-id>/comments,as derrotas da esquerda    dilma fica   impeachment   fora temer   ficou    fascistas  nao passarao   passamos   lula livre   lula foi preso   vira vira ciro   nao virou   vira voto haddad   nao virou   ele nao   ele sim   renan sim   renan nao   vai freixo   nao foi   #foratoffoli carregando   ,2019-02-04T00:00:56+0000,3.0,0.0,
129985,jairmessias.bolsonaro/211857482296579_1411377829011199/1411377829011199_570692573410468,57966,5,2,1411377829011199_570692573410468,data,fetched (200),2020-06-02 20:34:50.080666,Facebook:/<post-id>/comments,e dai  ,2019-03-29T18:09:41+0000,3.0,0.0,
30130,211857482296579_1634149506734029/211857482296579_1375671095915206/1375671095915206_616477102132387,30136,3,2,1375671095915206_616477102132387,data,fetched (200),2020-06-02 20:27:44.373902,Facebook:/<post-id>/comments,isso ai  presidas  mostra que legalizar as drogas nao acaba com o trafico   hahahahah,2019-02-14T23:25:43+0000,3.0,0.0,
30113,211857482296579_1634149506734029/211857482296579_1375671095915206/1375671095915206_135462507494434,30119,3,2,1375671095915206_135462507494434,data,fetched (200),2020-06-02 20:27:44.373902,Facebook:/<post-id>/comments,o bolsonaro nao pode soltar um peido que sai no veja assim  bolsonaro acaba de peidar em sua residencia  e deixa varias pessoas chocadas,2019-02-14T23:36:21+0000,3.0,0.0,
130312,jairmessias.bolsonaro/211857482296579_1411377829011199/1411377829011199_306020240077373,58293,5,2,1411377829011199_306020240077373,data,fetched (200),2020-06-02 20:34:55.014541,Facebook:/<post-id>/comments,que faaaase ,2019-03-29T18:43:10+0000,3.0,0.0,
130345,jairmessias.bolsonaro/211857482296579_1411377829011199/1411377829011199_1411388405676808,58326,5,2,1411377829011199_1411388405676808,data,fetched (200),2020-06-02 20:34:55.392127,Facebook:/<post-id>/comments,nao sei o que e pior  eles publicarem isso ou voce se incomodar  faz seu trabalho  mano  ce ta parecendo crianca ,2019-03-29T17:28:27+0000,3.0,0.0,
111448,jairmessias.bolsonaro/211857482296579_1364988146983501/1364988146983501_2855646711242048,39430,4,2,1364988146983501_2855646711242048,data,fetched (200),2020-06-02 20:30:16.283836,Facebook:/<post-id>/comments,kkkkk mitou com esse resposta kkkkk hahaha,2019-02-04T00:05:58+0000,3.0,0.0,
52987,211857482296579_1634149506734029/211857482296579_1411377829011199/1411377829011199_126785475101783,52991,5,2,1411377829011199_126785475101783,data,fetched (200),2020-06-02 20:33:38.098300,Facebook:/<post-id>/comments,o estadao vai ter um quadro no programa da sonia abraao ,2019-03-29T18:56:11+0000,3.0,1.0,
111612,jairmessias.bolsonaro/211857482296579_1364988146983501/1364988146983501_664965833900176,39594,4,2,1364988146983501_664965833900176,data,fetched (200),2020-06-02 20:30:18.802404,Facebook:/<post-id>/comments,lacracao presidencial num domingo a noite  ,2019-02-03T23:34:08+0000,3.0,0.0,
51504,211857482296579_1634149506734029/211857482296579_1364988146983501/1364988146983501_173741963588679,51509,4,2,1364988146983501_173741963588679,data,fetched (200),2020-06-02 20:33:15.639732,Facebook:/<post-id>/comments,de graca elegemos o nosso presidente  de graca derrubamos o renan  de graca vimos a ladra roubar os documentos  de graca continuaremos lutando por um brasil melhor,2019-02-04T00:16:19+0000,3.0,0.0,
100603,jairmessias.bolsonaro/211857482296579_1375671095915206/1375671095915206_118981335850784,28586,3,2,1375671095915206_118981335850784,data,fetched (200),2020-06-02 20:27:22.043416,Facebook:/<post-id>/comments,eu era anarcocapitalista  mas o bolsonaro era mais,2019-02-15T00:14:52+0000,3.0,0.0,
100488,jairmessias.bolsonaro/211857482296579_1375671095915206/1375671095915206_1375673482581634,28471,3,2,1375671095915206_1375673482581634,data,fetched (200),2020-06-02 20:27:20.302596,Facebook:/<post-id>/comments,mito  ,2019-02-14T23:18:22+0000,3.0,0.0,
100423,jairmessias.bolsonaro/211857482296579_1375671095915206/1375671095915206_712122059189761,28406,3,2,1375671095915206_712122059189761,data,fetched (200),2020-06-02 20:27:19.583366,Facebook:/<post-id>/comments,sandalia ryder  calca moleton e um blazer por cima da camisa do palmeiras  foto oficial com a equipe que formulou o texto da previdencia    meu presidente ,2019-02-15T01:23:26+0000,3.0,0.0,
85028,jairmessias.bolsonaro/211857482296579_1634149506734029/1634149506734029_674480029628497,13012,2,2,1634149506734029_674480029628497,data,fetched (200),2020-06-02 20:23:20.457314,Facebook:/<post-id>/comments,a folha nao serve nem  para embrulhar peixe ,2019-10-23T13:17:53+0000,3.0,0.0,
51500,211857482296579_1634149506734029/211857482296579_1364988146983501/1364988146983501_1014466262096492,51505,4,2,1364988146983501_1014466262096492,data,fetched (200),2020-06-02 20:33:15.639732,Facebook:/<post-id>/comments,e um imbecil que nao entende que o filme dele nao tem apelo comercial  nossas salas de cinema quase sempre em shoppings sao carissimas pra custear filme que nao vai dar retorno ,2019-02-03T23:51:47+0000,3.0,0.0,
51502,211857482296579_1634149506734029/211857482296579_1364988146983501/1364988146983501_606095289814939,51507,4,2,1364988146983501_606095289814939,data,fetched (200),2020-06-02 20:33:15.639732,Facebook:/<post-id>/comments,cara imbecil  nao estamos interessados no filme dele  estamos interessados em melhorar nosso pais  ,2019-02-03T23:38:55+0000,3.0,0.0,
51525,211857482296579_1634149506734029/211857482296579_1364988146983501/1364988146983501_185366112426867,51530,4,2,1364988146983501_185366112426867,data,fetched (200),2020-06-02 20:33:15.945491,Facebook:/<post-id>/comments,agora vamos boicotar essa  merda  esse filme deve ser uma porcaria como todo  que os comunistas fazem   espalhar discordia e  o que  eles mas sabe fazer affff ,2019-02-04T00:15:06+0000,3.0,3.0,
51558,211857482296579_1634149506734029/211857482296579_1364988146983501/1364988146983501_2267975320088248,51563,4,2,1364988146983501_2267975320088248,data,fetched (200),2020-06-02 20:33:16.230251,Facebook:/<post-id>/comments,o melhor a fazer agora e ouvir o que os medicos dizem    se fortalecer  se recuperar  os eleitores nao caem nas fofoquinhas  fica tranquilo ai presidente  ,2019-02-03T23:49:07+0000,3.0,0.0,
134238,jairmessias.bolsonaro/211857482296579_1411377829011199/1411377829011199_154183608939377,62219,5,2,1411377829011199_154183608939377,data,fetched (200),2020-06-02 20:35:52.010980,Facebook:/<post-id>/comments,o bolsonaro nao pode nem chegar mais cedo que e materia  se chegar atrasado tambem  imagina se soltar um peido  nossa vai ser uma polemica  kkkk esse jornalistas brasileiros precisam ser reavaliados ,2019-03-29T21:00:09+0000,3.0,1.0,
134250,jairmessias.bolsonaro/211857482296579_1411377829011199/1411377829011199_1411391975676451,62231,5,2,1411377829011199_1411391975676451,data,fetched (200),2020-06-02 20:35:52.010980,Facebook:/<post-id>/comments,decadencia do jornalismo brasileiro,2019-03-29T17:30:05+0000,3.0,0.0,
133595,jairmessias.bolsonaro/211857482296579_1411377829011199/1411377829011199_433493144090418,61576,5,2,1411377829011199_433493144090418,data,fetched (200),2020-06-02 20:35:42.758809,Facebook:/<post-id>/comments,se tivesse atrasado seria criticado da mesma forma,2019-03-29T19:28:23+0000,3.0,1.0,
133256,jairmessias.bolsonaro/211857482296579_1411377829011199/1411377829011199_1046921072172906,61237,5,2,1411377829011199_1046921072172906,data,fetched (200),2020-06-02 20:35:38.112652,Facebook:/<post-id>/comments,bolsonaro e cumplice da vaca morta do churrasco ,2019-03-29T18:16:51+0000,3.0,1.0,
111631,jairmessias.bolsonaro/211857482296579_1364988146983501/1364988146983501_2945196178839597,39613,4,2,1364988146983501_2945196178839597,data,fetched (200),2020-06-02 20:30:18.802404,Facebook:/<post-id>/comments,#paz,2019-02-04T08:55:01+0000,3.0,0.0,
132424,jairmessias.bolsonaro/211857482296579_1411377829011199/1411377829011199_270733350504140,60405,5,2,1411377829011199_270733350504140,data,fetched (200),2020-06-02 20:35:25.007391,Facebook:/<post-id>/comments,fernando gori lima joao branco caio a  s  zaccariotto orlando bozzoni vettorazzo bruno bugni vasconcelos leticia vettorazzo,2019-03-29T20:01:52+0000,3.0,0.0,
111646,jairmessias.bolsonaro/211857482296579_1364988146983501/1364988146983501_173743673588508,39628,4,2,1364988146983501_173743673588508,data,fetched (200),2020-06-02 20:30:19.180359,Facebook:/<post-id>/comments,,2019-02-04T00:27:04+0000,3.0,0.0,
56334,211857482296579_1634149506734029/211857482296579_1411377829011199/1411377829011199_427163408050213,56338,5,2,1411377829011199_427163408050213,data,fetched (200),2020-06-02 20:34:26.742953,Facebook:/<post-id>/comments,viviane santos viviane albuquerque de oliveira tamires lima damaris rountree meninas  eu to morrendo com os comentarios  gente  que bosta de jornalismo e esse   ,2019-03-29T23:19:21+0000,3.0,3.0,
132109,jairmessias.bolsonaro/211857482296579_1411377829011199/1411377829011199_1277400422408690,60090,5,2,1411377829011199_1277400422408690,data,fetched (200),2020-06-02 20:35:20.641305,Facebook:/<post-id>/comments,bolsonaro e flagrado comendo carne  desrespeitando bilhoes de vegetarianos ,2019-03-29T18:47:49+0000,3.0,0.0,
132228,jairmessias.bolsonaro/211857482296579_1411377829011199/1411377829011199_384456142388476,60209,5,2,1411377829011199_384456142388476,data,fetched (200),2020-06-02 20:35:22.049210,Facebook:/<post-id>/comments,e dai alguem perguntou pra esse jornaleco a que hrs nosso presidente chegou  vao achar o que fazer ,2019-03-29T19:27:55+0000,3.0,1.0,
29870,211857482296579_1634149506734029/211857482296579_1375671095915206/1375671095915206_135463140827704,29876,3,2,1375671095915206_135463140827704,data,fetched (200),2020-06-02 20:27:40.920353,Facebook:/<post-id>/comments,segue a lista de quem se importa com isso ,2019-02-14T23:39:49+0000,3.0,0.0,
50621,211857482296579_1634149506734029/211857482296579_1364988146983501/1364988146983501_2032822043469137,50626,4,2,1364988146983501_2032822043469137,data,fetched (200),2020-06-02 20:33:03.485681,Facebook:/<post-id>/comments,atorzinho v a g a b u n d o,2019-02-04T00:14:28+0000,3.0,0.0,
133219,jairmessias.bolsonaro/211857482296579_1411377829011199/1411377829011199_1411379642344351,61200,5,2,1411377829011199_1411379642344351,data,fetched (200),2020-06-02 20:35:37.311475,Facebook:/<post-id>/comments,atencao bolsonaro rouba brigadeiro em festa,2019-03-29T17:24:20+0000,3.0,0.0,
50691,211857482296579_1634149506734029/211857482296579_1364988146983501/1364988146983501_606095626481572,50696,4,2,1364988146983501_606095626481572,data,fetched (200),2020-06-02 20:33:04.622033,Facebook:/<post-id>/comments,wesley de oliveira portela,2019-02-03T23:39:27+0000,3.0,0.0,
56704,211857482296579_1634149506734029/211857482296579_1411377829011199/1411377829011199_1411391799009802,56708,5,2,1411377829011199_1411391799009802,data,fetched (200),2020-06-02 20:34:32.134458,Facebook:/<post-id>/comments,,2019-03-29T17:29:59+0000,3.0,0.0,
