,path,id,parent_id,level,object_id,object_type,query_status,query_time,query_type,message,created_time,like_count,comment_count,error.message
16690,211857482296579_1634149506734029/211857482296579_1375671095915206/1375671095915206_596306154130707,16696,3,2,1375671095915206_596306154130707,data,fetched (200),2020-06-02 20:24:22.767255,Facebook:/<post-id>/comments,fala serio kkkkk quem nao tem uma camisa de time falsa comprada na feira  haha,2019-02-14T23:57:49+0000,6.0,2.0,
107459,jairmessias.bolsonaro/211857482296579_1364988146983501/1364988146983501_606095559814912,35441,4,2,1364988146983501_606095559814912,data,fetched (200),2020-06-02 20:29:18.040639,Facebook:/<post-id>/comments,avisa o ator que bolsonaro nao precisa fazer nada    se descobrirmos quem ele e  nos mesmos fazemos o servico   ,2019-02-03T23:39:19+0000,6.0,0.0,
107455,jairmessias.bolsonaro/211857482296579_1364988146983501/1364988146983501_1364991200316529,35437,4,2,1364988146983501_1364991200316529,data,fetched (200),2020-06-02 20:29:18.040639,Facebook:/<post-id>/comments,tenho mais o que fazer      kkkkkkkkk mito esse nosso presidente ,2019-02-03T23:32:08+0000,6.0,0.0,
107452,jairmessias.bolsonaro/211857482296579_1364988146983501/1364988146983501_297055284334073,35434,4,2,1364988146983501_297055284334073,data,fetched (200),2020-06-02 20:29:18.040639,Facebook:/<post-id>/comments,na verdade o filme e pessimo e nao teve nem bilheteria la fora  ,2019-02-04T00:46:54+0000,6.0,5.0,
73737,jairmessias.bolsonaro/211857482296579_1634149506734029/1634149506734029_1634151170067196,1721,2,2,1634149506734029_1634151170067196,data,fetched (200),2020-06-02 20:20:34.425184,Facebook:/<post-id>/comments,uma verdade dentre milhoes de mentiras ,2019-10-23T13:08:20+0000,6.0,0.0,
73649,jairmessias.bolsonaro/211857482296579_1634149506734029/1634149506734029_1259279250938726,1633,2,2,1634149506734029_1259279250938726,data,fetched (200),2020-06-02 20:20:33.292331,Facebook:/<post-id>/comments,cade o leite condensado presidente  levou  ,2019-10-23T15:28:46+0000,6.0,0.0,
6603,211857482296579_1634149506734029/1634149506734029_1634151733400473/1634149506734029_1634150630067250,6610,2,2,1634149506734029_1634150630067250,data,fetched (200),2020-06-02 20:21:45.635668,Facebook:/<post-id>/comments,pior e que os cara faz faculdade pra fazer uma materia dessas  ,2019-10-23T13:08:07+0000,6.0,0.0,
137769,jairmessias.bolsonaro/211857482296579_1466315963517385/1466315963517385_1466316473517334,65749,7,2,1466315963517385_1466316473517334,data,fetched (200),2020-06-02 20:36:51.230377,Facebook:/<post-id>/comments,esse e meu presidente,2019-05-24T21:01:09+0000,6.0,0.0,
137716,jairmessias.bolsonaro/211857482296579_1466315963517385/1466315963517385_1466317140183934,65696,7,2,1466315963517385_1466317140183934,data,fetched (200),2020-06-02 20:36:50.447956,Facebook:/<post-id>/comments,isso mesmo presidente ,2019-05-24T21:01:36+0000,6.0,0.0,
72096,jairmessias.bolsonaro/211857482296579_1634149506734029/1634149506734029_460520778146525,80,2,2,1634149506734029_460520778146525,data,fetched (200),2020-06-02 20:20:10.706301,Facebook:/<post-id>/comments,eu fico pensando no salario do profissional que se preza a fazer uma materia robusta e produtiva como esta  nao teria um conteudo mais produtivo ,2019-10-23T13:39:02+0000,6.0,1.0,
136393,jairmessias.bolsonaro/211857482296579_1466315963517385/1466315963517385_2564537293830133,64373,7,2,1466315963517385_2564537293830133,data,fetched (200),2020-06-02 20:36:31.737342,Facebook:/<post-id>/comments,capitao dia 26 eu vou de amarelo como sempre fomos nesses 4 anos     voce vai conseguir  estamos com voce ,2019-05-24T21:11:20+0000,6.0,1.0,
72084,jairmessias.bolsonaro/211857482296579_1634149506734029/1634149506734029_555537221870170,68,2,2,1634149506734029_555537221870170,data,fetched (200),2020-06-02 20:20:10.706301,Facebook:/<post-id>/comments,presidente  macarrao instantaneo e um veneno para a saude  com alimentacao nao se economiza  precisamos que vossa excelencia esteja presente para a posse da laurinha na presidencia da republica daqui a 30 anos ,2019-10-23T13:27:31+0000,6.0,0.0,
72083,jairmessias.bolsonaro/211857482296579_1634149506734029/1634149506734029_418262608836644,67,2,2,1634149506734029_418262608836644,data,fetched (200),2020-06-02 20:20:10.706301,Facebook:/<post-id>/comments,pode passar aqui em casa   melhor que sushi  eu garanto que e ,2019-10-23T19:27:15+0000,6.0,1.0,
72081,jairmessias.bolsonaro/211857482296579_1634149506734029/1634149506734029_3132101870196207,65,2,2,1634149506734029_3132101870196207,data,fetched (200),2020-06-02 20:20:10.706301,Facebook:/<post-id>/comments,poderia ser pior     bolsonaro constrange em banquete e nao come alimentos servidos  ,2019-10-23T13:47:41+0000,6.0,0.0,
107440,jairmessias.bolsonaro/211857482296579_1364988146983501/1364988146983501_338050400142632,35422,4,2,1364988146983501_338050400142632,data,fetched (200),2020-06-02 20:29:17.657695,Facebook:/<post-id>/comments,ele queria que vc fizesse uma participacao especial  mas o senhor estava muito ocupado pensando em salvar o brasil,2019-02-03T23:40:04+0000,6.0,0.0,
136396,jairmessias.bolsonaro/211857482296579_1466315963517385/1466315963517385_1053209831540127,64376,7,2,1466315963517385_1053209831540127,data,fetched (200),2020-06-02 20:36:31.737342,Facebook:/<post-id>/comments,a luta ta grande mas tenho fe em deus vamos vencer   ,2019-05-24T21:58:43+0000,6.0,0.0,
16693,211857482296579_1634149506734029/211857482296579_1375671095915206/1375671095915206_538571933319265,16699,3,2,1375671095915206_538571933319265,data,fetched (200),2020-06-02 20:24:23.052490,Facebook:/<post-id>/comments,o que ele usa ou deixa de usar e problema dele  voces nao acham ,2019-02-14T23:42:51+0000,6.0,0.0,
16707,211857482296579_1634149506734029/211857482296579_1375671095915206/1375671095915206_306115080045385,16713,3,2,1375671095915206_306115080045385,data,fetched (200),2020-06-02 20:24:23.052490,Facebook:/<post-id>/comments,nossa o que tem haver deixa o nosso presidente trabalhar que ladainha que e essa que dor de cotovelo tenha do parabens presidente pela simplicidade e humildade,2019-02-14T23:23:59+0000,6.0,0.0,
125026,jairmessias.bolsonaro/211857482296579_1411377829011199/1411377829011199_653563798399637,53007,5,2,1411377829011199_653563798399637,data,fetched (200),2020-06-02 20:33:38.098300,Facebook:/<post-id>/comments,a estrela e o aniversariante  o presidente foi educado em chegar antes e nao causar tumulto ofuscando o brilho do homenageado,2019-03-29T17:34:57+0000,6.0,0.0,
88736,jairmessias.bolsonaro/211857482296579_1375671095915206/1375671095915206_765234553834182,16719,3,2,1375671095915206_765234553834182,data,fetched (200),2020-06-02 20:24:23.052490,Facebook:/<post-id>/comments,carissimo presidente jair bolsonaro  esta musica  modestia a parte  foi uma forte ferramenta utilizada para vossa eleicao a presidente da republica  2018  com ela  conseguimos conscientizar muitos eleitores a votarem em v  excelencia  vossa eleicao a presidente do brasil foi uma grande vitoria p  os brasileiros   fiz todos os esforcos para canta la no dia da posse  nao foi possivel mas nao desisti   gostaria que me ouvisse canta la  ao vivo   muito obrigado   sei que deus vai permitir a realizacao  deste sonho                                                                                      sim     o melhor presidente   ,2019-02-15T00:55:48+0000,6.0,4.0,
111104,jairmessias.bolsonaro/211857482296579_1364988146983501/1364988146983501_2855648351241884,39086,4,2,1364988146983501_2855648351241884,data,fetched (200),2020-06-02 20:30:10.146324,Facebook:/<post-id>/comments, e cada uma q aparece hem presidente  ,2019-02-04T00:08:46+0000,6.0,1.0,
111118,jairmessias.bolsonaro/211857482296579_1364988146983501/1364988146983501_1364988706983445,39100,4,2,1364988146983501_1364988706983445,data,fetched (200),2020-06-02 20:30:10.533708,Facebook:/<post-id>/comments,e se tiver    aqui e br porra  quem manda na nossa casa somos nos  ,2019-02-03T23:31:12+0000,6.0,0.0,
127591,jairmessias.bolsonaro/211857482296579_1411377829011199/1411377829011199_1411378332344482,55572,5,2,1411377829011199_1411378332344482,data,fetched (200),2020-06-02 20:34:15.412369,Facebook:/<post-id>/comments,gustavo alencar lauriane lima to esperando os cara postar que o bolsonaro foi cagar as 14h jair messias bolsonaro,2019-03-29T17:23:39+0000,6.0,1.0,
127384,jairmessias.bolsonaro/211857482296579_1411377829011199/1411377829011199_1046905762174437,55365,5,2,1411377829011199_1046905762174437,data,fetched (200),2020-06-02 20:34:12.431809,Facebook:/<post-id>/comments,falta de materia presidente eles te amam kkkkk,2019-03-29T17:42:55+0000,6.0,2.0,
102126,jairmessias.bolsonaro/211857482296579_1375671095915206/1375671095915206_821523298181409,30109,3,2,1375671095915206_821523298181409,data,fetched (200),2020-06-02 20:27:44.092130,Facebook:/<post-id>/comments,misericordia a revista veja esta com a credibilidade mais baixa que barriga de cobra      que falta de noticia em    ,2019-02-14T23:40:32+0000,6.0,1.0,
13514,211857482296579_1634149506734029/1634149506734029_1634151733400473/1634149506734029_555532868537272,13521,2,2,1634149506734029_555532868537272,data,fetched (200),2020-06-02 20:23:31.093668,Facebook:/<post-id>/comments,se fosse a turma petralha  voltariam com garrafas de saque dos mais caros  tudo pago no cartao corporativo  o pais ta mudando  dilma em portugal voltou com a sacola cheia de vinhos caros  pagos com nosso dinheiro ,2019-10-23T13:21:50+0000,5.0,0.0,
16300,211857482296579_1634149506734029/1634149506734029_1634151733400473/1634149506734029_158478251903959,16307,2,2,1634149506734029_158478251903959,data,fetched (200),2020-06-02 20:24:15.852992,Facebook:/<post-id>/comments,  ao vivo stf   vem ai 200 mil bandidos pras ruas   prisao em segunda instancia 23 10 2019  https   youtu be wjqpwujfspo,2019-10-23T14:17:30+0000,5.0,0.0,
130595,jairmessias.bolsonaro/211857482296579_1411377829011199/1411377829011199_194520671521283,58576,5,2,1411377829011199_194520671521283,data,fetched (200),2020-06-02 20:34:58.638017,Facebook:/<post-id>/comments,quando nao se tem crime nem corrupcao pra divulgar  e isso que da  avante  capitao  #elesim #bolsonaro2022,2019-03-29T23:09:47+0000,5.0,0.0,
16761,211857482296579_1634149506734029/211857482296579_1375671095915206/1375671095915206_616478975465533,16767,3,2,1375671095915206_616478975465533,data,fetched (200),2020-06-02 20:24:23.755611,Facebook:/<post-id>/comments,e dai o importante e que veste como qualquer uma original ,2019-02-14T23:29:13+0000,5.0,1.0,
53048,211857482296579_1634149506734029/211857482296579_1411377829011199/1411377829011199_491185998082535,53052,5,2,1411377829011199_491185998082535,data,fetched (200),2020-06-02 20:33:38.684865,Facebook:/<post-id>/comments,meu deus e mta falta do q fazer desses jornalistas kkkkkk,2019-03-29T17:53:04+0000,5.0,0.0,
52990,211857482296579_1634149506734029/211857482296579_1411377829011199/1411377829011199_1411383389010643,52994,5,2,1411377829011199_1411383389010643,data,fetched (200),2020-06-02 20:33:38.098300,Facebook:/<post-id>/comments,nao existe mais jornais informativos  o que esta havendo e uma implantacao de ele disse que  ele falou que  acabou a credibilidade da midia ,2019-03-29T17:26:05+0000,5.0,0.0,
65722,211857482296579_1634149506734029/211857482296579_1466315963517385/1466315963517385_618658148651617,65725,7,2,1466315963517385_618658148651617,data,fetched (200),2020-06-02 20:36:50.836919,Facebook:/<post-id>/comments,sai do facebook e vai trabalhar,2019-05-24T21:33:00+0000,5.0,3.0,
131913,jairmessias.bolsonaro/211857482296579_1411377829011199/1411377829011199_491178291416639,59894,5,2,1411377829011199_491178291416639,data,fetched (200),2020-06-02 20:35:17.230323,Facebook:/<post-id>/comments,cortem a verba dessas midias ,2019-03-29T17:36:16+0000,5.0,0.0,
30106,211857482296579_1634149506734029/211857482296579_1375671095915206/1375671095915206_1375671889248460,30112,3,2,1375671095915206_1375671889248460,data,fetched (200),2020-06-02 20:27:44.092130,Facebook:/<post-id>/comments,o celso de melo agora e o dono da verdade    homem nao nasce homem  mulher nao nasce mulher  a biologia nao tem a menor importancia  e o jacare nao e um bicho    homem de 130 kilos com 1 95 de altura que se dizer mulher  pode pedir o amparo da lei maria da penha  entrar numa igreja e beijar todo mundo a forca  esculhambar com o padre ou pastor  urinar e evacuar  no altar e quem for contra vai ser preso por homofobia  transfobia e racismo   ,2019-02-14T23:17:32+0000,5.0,0.0,
65743,211857482296579_1634149506734029/211857482296579_1466315963517385/1466315963517385_1466316263517355,65746,7,2,1466315963517385_1466316263517355,data,fetched (200),2020-06-02 20:36:51.230377,Facebook:/<post-id>/comments,excelente meu presidente    ,2019-05-24T21:00:57+0000,5.0,0.0,
30144,211857482296579_1634149506734029/211857482296579_1375671095915206/1375671095915206_1055160491354565,30150,3,2,1375671095915206_1055160491354565,data,fetched (200),2020-06-02 20:27:44.771140,Facebook:/<post-id>/comments,kkkkkkkk esse jornalista ja pode ganhar o premio imbecil do ano ,2019-02-14T23:29:23+0000,5.0,0.0,
51490,211857482296579_1634149506734029/211857482296579_1364988146983501/1364988146983501_1365001980315451,51495,4,2,1364988146983501_1365001980315451,data,fetched (200),2020-06-02 20:33:15.233797,Facebook:/<post-id>/comments, ,2019-02-03T23:33:47+0000,5.0,0.0,
39099,211857482296579_1634149506734029/211857482296579_1364988146983501/1364988146983501_704897953238403,39104,4,2,1364988146983501_704897953238403,data,fetched (200),2020-06-02 20:30:10.533708,Facebook:/<post-id>/comments,entre com acao contra este cara  tirar uns dolares dele   ele quer aparacer ,2019-02-03T23:34:16+0000,5.0,0.0,
52967,211857482296579_1634149506734029/211857482296579_1411377829011199/1411377829011199_1411385845677064,52971,5,2,1411377829011199_1411385845677064,data,fetched (200),2020-06-02 20:33:37.683896,Facebook:/<post-id>/comments,ele foi convidado    chega a hora que  quiser  ,2019-03-29T17:27:13+0000,5.0,0.0,
107463,jairmessias.bolsonaro/211857482296579_1364988146983501/1364988146983501_591534941292138,35445,4,2,1364988146983501_591534941292138,data,fetched (200),2020-06-02 20:29:18.040639,Facebook:/<post-id>/comments,tudo marketing pra colocar o tal filme na midia  usando seu nome ,2019-02-03T23:52:11+0000,5.0,0.0,
124995,jairmessias.bolsonaro/211857482296579_1411377829011199/1411377829011199_1411380282344287,52976,5,2,1411377829011199_1411380282344287,data,fetched (200),2020-06-02 20:33:37.683896,Facebook:/<post-id>/comments,nossa  sr presidente kkkk que noticia perturbadora,2019-03-29T17:24:39+0000,5.0,0.0,
107465,jairmessias.bolsonaro/211857482296579_1364988146983501/1364988146983501_338051446809194,35447,4,2,1364988146983501_338051446809194,data,fetched (200),2020-06-02 20:29:18.040639,Facebook:/<post-id>/comments,melhoras  sr  presidente do brasil  a nacao brasileira ora pelo senhor ,2019-02-03T23:42:33+0000,5.0,0.0,
52973,211857482296579_1634149506734029/211857482296579_1411377829011199/1411377829011199_653567515065932,52977,5,2,1411377829011199_653567515065932,data,fetched (200),2020-06-02 20:33:37.683896,Facebook:/<post-id>/comments,fake news  bolsonaro deixa o aniversariante constrangido devido a sua pontualidade  rses,2019-03-29T17:42:03+0000,5.0,0.0,
39083,211857482296579_1634149506734029/211857482296579_1364988146983501/1364988146983501_817982368544641,39088,4,2,1364988146983501_817982368544641,data,fetched (200),2020-06-02 20:30:10.146324,Facebook:/<post-id>/comments,muito bom  excelencia ,2019-02-03T23:45:15+0000,5.0,0.0,
107474,jairmessias.bolsonaro/211857482296579_1364988146983501/1364988146983501_2251826221707258,35456,4,2,1364988146983501_2251826221707258,data,fetched (200),2020-06-02 20:29:18.040639,Facebook:/<post-id>/comments,atorzinho querendo sujar a imagem do brasil  processo nele ,2019-02-04T00:05:45+0000,5.0,0.0,
52974,211857482296579_1634149506734029/211857482296579_1411377829011199/1411377829011199_345739232716038,52978,5,2,1411377829011199_345739232716038,data,fetched (200),2020-06-02 20:33:37.683896,Facebook:/<post-id>/comments,kkkkk    o estadao esta em estado de  nao tem o que fazer    kkkk,2019-03-29T19:34:20+0000,5.0,1.0,
49400,211857482296579_1634149506734029/211857482296579_1364988146983501/1364988146983501_395328597940390,49405,4,2,1364988146983501_395328597940390,data,fetched (200),2020-06-02 20:32:43.234406,Facebook:/<post-id>/comments,hehe,2019-02-04T00:48:45+0000,5.0,1.0,
107516,jairmessias.bolsonaro/211857482296579_1364988146983501/1364988146983501_301862527351264,35498,4,2,1364988146983501_301862527351264,data,fetched (200),2020-06-02 20:29:18.798096,Facebook:/<post-id>/comments,nao deixe isto abalar eles da esquerdas estao fazendo de tudo pra te derrubar mas so que nao vao pois o povo de bem esta com vc ,2019-02-04T00:24:08+0000,5.0,0.0,
39112,211857482296579_1634149506734029/211857482296579_1364988146983501/1364988146983501_2297154127234128,39117,4,2,1364988146983501_2297154127234128,data,fetched (200),2020-06-02 20:30:10.533708,Facebook:/<post-id>/comments,top  melhor presidente    ,2019-02-04T00:20:12+0000,5.0,0.0,
52975,211857482296579_1634149506734029/211857482296579_1411377829011199/1411377829011199_491192508081884,52979,5,2,1411377829011199_491192508081884,data,fetched (200),2020-06-02 20:33:37.683896,Facebook:/<post-id>/comments,jair messias bolsonaro colocou a mao no bolso  como a midia publica  bolsonaro coloca a mao no bolso e faz gesto obsceno  kkk eles te amam e nao sabem meu presidente    avante brasil   ,2019-03-29T18:08:44+0000,5.0,0.0,
52977,211857482296579_1634149506734029/211857482296579_1411377829011199/1411377829011199_127259358382739,52981,5,2,1411377829011199_127259358382739,data,fetched (200),2020-06-02 20:33:37.683896,Facebook:/<post-id>/comments,alem de tudo tem pontualidade britanica  posso votar 17 de novo  ,2019-03-29T17:56:26+0000,5.0,2.0,
52978,211857482296579_1634149506734029/211857482296579_1411377829011199/1411377829011199_727246637670563,52982,5,2,1411377829011199_727246637670563,data,fetched (200),2020-06-02 20:33:37.683896,Facebook:/<post-id>/comments,pra comer churrasco eu tb sou o primeiro a chegar e o ultimo a sair   ,2019-03-29T17:43:26+0000,5.0,0.0,
134089,jairmessias.bolsonaro/211857482296579_1411377829011199/1411377829011199_1411382489010733,62070,5,2,1411377829011199_1411382489010733,data,fetched (200),2020-06-02 20:35:49.790302,Facebook:/<post-id>/comments,se bolsonaro fizesse campanha contra a dengue  com certeza a midia defenderia o mosquito ,2019-03-29T17:25:39+0000,5.0,0.0,
51501,211857482296579_1634149506734029/211857482296579_1364988146983501/1364988146983501_1364991770316472,51506,4,2,1364988146983501_1364991770316472,data,fetched (200),2020-06-02 20:33:15.639732,Facebook:/<post-id>/comments,fica tranquilo capitao   tem maluco esquerdista em todo mundo kkkkk,2019-02-03T23:32:18+0000,5.0,1.0,
16740,211857482296579_1634149506734029/211857482296579_1375671095915206/1375671095915206_135462944161057,16746,3,2,1375671095915206_135462944161057,data,fetched (200),2020-06-02 20:24:23.460406,Facebook:/<post-id>/comments,quem nao tem o que fazer    pra editar um material desses ,2019-02-14T23:38:29+0000,5.0,0.0,
52993,211857482296579_1634149506734029/211857482296579_1411377829011199/1411377829011199_664575654007345,52997,5,2,1411377829011199_664575654007345,data,fetched (200),2020-06-02 20:33:38.098300,Facebook:/<post-id>/comments,presidente reveja a estatal do trem bala q nao saiu mas a estatal continua la,2019-03-29T20:23:33+0000,5.0,0.0,
16717,211857482296579_1634149506734029/211857482296579_1375671095915206/1375671095915206_814871485539484,16723,3,2,1375671095915206_814871485539484,data,fetched (200),2020-06-02 20:24:23.052490,Facebook:/<post-id>/comments,esse  e   nosso   presidente bolsonaro   sucesso ,2019-02-15T00:33:33+0000,5.0,0.0,
16672,211857482296579_1634149506734029/211857482296579_1375671095915206/1375671095915206_1015764531941380,16678,3,2,1375671095915206_1015764531941380,data,fetched (200),2020-06-02 20:24:22.767255,Facebook:/<post-id>/comments,alem de ganharmos o melhor presidente ganhamos um criador de memes sem limite kkkkkkkk,2019-02-15T00:00:31+0000,5.0,0.0,
53001,211857482296579_1634149506734029/211857482296579_1411377829011199/1411377829011199_1411390385676610,53005,5,2,1411377829011199_1411390385676610,data,fetched (200),2020-06-02 20:33:38.098300,Facebook:/<post-id>/comments,ia adorar ser a aniversariante  pense no presente ,2019-03-29T17:29:22+0000,5.0,0.0,
124964,jairmessias.bolsonaro/211857482296579_1411377829011199/1411377829011199_440611969813973,52945,5,2,1411377829011199_440611969813973,data,fetched (200),2020-06-02 20:33:37.276990,Facebook:/<post-id>/comments,bolsonaro me representa  sou a primeira a chegar na festa e so saio quando acaba a comida  rosana juliana joycinha,2019-03-29T20:44:55+0000,5.0,2.0,
16674,211857482296579_1634149506734029/211857482296579_1375671095915206/1375671095915206_243953783212756,16680,3,2,1375671095915206_243953783212756,data,fetched (200),2020-06-02 20:24:22.767255,Facebook:/<post-id>/comments,relaxa presidente  que a gente faz uma vaquinha e compra uma oficial para vossa excelencia ,2019-02-14T23:35:20+0000,5.0,0.0,
53004,211857482296579_1634149506734029/211857482296579_1411377829011199/1411377829011199_384451342388956,53008,5,2,1411377829011199_384451342388956,data,fetched (200),2020-06-02 20:33:38.098300,Facebook:/<post-id>/comments,muito bem  sempre o primeiro    sempre na frente  continue assim capitao    ,2019-03-29T19:19:02+0000,5.0,0.0,
53007,211857482296579_1634149506734029/211857482296579_1411377829011199/1411377829011199_659769504480044,53011,5,2,1411377829011199_659769504480044,data,fetched (200),2020-06-02 20:33:38.098300,Facebook:/<post-id>/comments,estadao chegou antes do bolsonaro e do aniversariante ,2019-03-29T20:02:22+0000,5.0,0.0,
53010,211857482296579_1634149506734029/211857482296579_1411377829011199/1411377829011199_397893277674677,53014,5,2,1411377829011199_397893277674677,data,fetched (200),2020-06-02 20:33:38.408475,Facebook:/<post-id>/comments,eita que a falta de assunto desses jornais esta grande ,2019-03-29T18:43:17+0000,5.0,0.0,
16723,211857482296579_1634149506734029/211857482296579_1375671095915206/1375671095915206_554676428365793,16729,3,2,1375671095915206_554676428365793,data,fetched (200),2020-06-02 20:24:23.460406,Facebook:/<post-id>/comments,essa noticia nao tera repercussao mundial,2019-02-15T00:02:20+0000,5.0,0.0,
124974,jairmessias.bolsonaro/211857482296579_1411377829011199/1411377829011199_127262685049073,52955,5,2,1411377829011199_127262685049073,data,fetched (200),2020-06-02 20:33:37.276990,Facebook:/<post-id>/comments,nossa    isso muda tudo    em 2022  votarei novamente nele  com essa informacao  tao  relevante    ,2019-03-29T18:09:37+0000,5.0,2.0,
16722,211857482296579_1634149506734029/211857482296579_1375671095915206/1375671095915206_2259019457712596,16728,3,2,1375671095915206_2259019457712596,data,fetched (200),2020-06-02 20:24:23.460406,Facebook:/<post-id>/comments,ate isso    pelo amor de deus    deixem o homem em paz   ,2019-02-15T00:50:56+0000,5.0,1.0,
16721,211857482296579_1634149506734029/211857482296579_1375671095915206/1375671095915206_2250248301908499,16727,3,2,1375671095915206_2250248301908499,data,fetched (200),2020-06-02 20:24:23.460406,Facebook:/<post-id>/comments,quem nao tem o que falar   faz isso mesmo  procura pelo em ovo kkkkk vamos pra frente presidente ,2019-02-15T12:00:10+0000,5.0,0.0,
124981,jairmessias.bolsonaro/211857482296579_1411377829011199/1411377829011199_430073067800550,52962,5,2,1411377829011199_430073067800550,data,fetched (200),2020-06-02 20:33:37.683896,Facebook:/<post-id>/comments,fui cancelar minha assinatura digital do estadao que ja esta c valor promocional e atendente me deu um mes gratis  depois dessa tem q cancelar mesmo ,2019-03-29T19:15:39+0000,5.0,0.0,
16715,211857482296579_1634149506734029/211857482296579_1375671095915206/1375671095915206_115335566264752,16721,3,2,1375671095915206_115335566264752,data,fetched (200),2020-06-02 20:24:23.052490,Facebook:/<post-id>/comments,bolsonaro e muito simples e disparado o melhor presidente desde que os militares deixaram o poder ,2019-02-14T23:29:57+0000,5.0,0.0,
124985,jairmessias.bolsonaro/211857482296579_1411377829011199/1411377829011199_1046912205507126,52966,5,2,1411377829011199_1046912205507126,data,fetched (200),2020-06-02 20:33:37.683896,Facebook:/<post-id>/comments,meu aniversario vou comemorar numa churrascaria tb  o senhor ta super convidado  meu presidente  sera uma honra,2019-03-29T17:54:57+0000,5.0,0.0,
16712,211857482296579_1634149506734029/211857482296579_1375671095915206/1375671095915206_431143134358427,16718,3,2,1375671095915206_431143134358427,data,fetched (200),2020-06-02 20:24:23.052490,Facebook:/<post-id>/comments,com   camisa   falsa   ou   nao    meu   presidente   e   chik   do   mesmo    jeito     brasil   acima de tudo e deus acima   de todos,2019-02-14T23:29:23+0000,5.0,0.0,
16702,211857482296579_1634149506734029/211857482296579_1375671095915206/1375671095915206_2259001304381078,16708,3,2,1375671095915206_2259001304381078,data,fetched (200),2020-06-02 20:24:23.052490,Facebook:/<post-id>/comments,votacao rapida  jair bolsonaro sera o melhor presidente que o brasil ja teve  curte ai ,2019-02-15T00:06:34+0000,5.0,0.0,
16703,211857482296579_1634149506734029/211857482296579_1375671095915206/1375671095915206_148291916176327,16709,3,2,1375671095915206_148291916176327,data,fetched (200),2020-06-02 20:24:23.052490,Facebook:/<post-id>/comments,cada dia mais so tenho certeza que votei no cara certo ,2019-02-15T00:55:56+0000,5.0,0.0,
